sentence,sentiment,lem_words,lem_tags,word_tags
"The food is very average...the Thai fusion stuff is a bit too sweet, every thing they serve is too sweet here.",0,food be very average thai fusion stuff be bit too sweet thing serve be too sweet here,NN VB RB VB NN NN NN VB NN RB JJ NN VB VB RB JJ RB,"['food/NN', 'be/VB', 'very/RB', 'average/VB', 'thai/NN', 'fusion/NN', 'stuff/NN', 'be/VB', 'bit/NN', 'too/RB', 'sweet/JJ', 'thing/NN', 'serve/VB', 'be/VB', 'too/RB', 'sweet/JJ', 'here/RB']"
Never have I had such dramatic delivery guys (a lot of huffing and panting and muttering under breath b/c I live in a walkup) who always seem disappointed with their tips.,0,never have have such dramatic delivery guy lot huffing pant mutter breath live walkup always seem disappoint tip,RB VB VB JJ JJ NN NN NN NN VB VB NN VB NN RB VB VB NN,"['never/RB', 'have/VB', 'have/VB', 'such/JJ', 'dramatic/JJ', 'delivery/NN', 'guy/NN', 'lot/NN', 'huffing/NN', 'pant/VB', 'mutter/VB', 'breath/NN', 'live/VB', 'walkup/NN', 'always/RB', 'seem/VB', 'disappoint/VB', 'tip/NN']"
Save yourself the time and trouble and skip this one!,0,save time trouble skip one,VB NN NN NN NN,"['save/VB', 'time/NN', 'trouble/NN', 'skip/NN', 'one/NN']"
The food was actually aweful.,0,food be actually aweful,NN VB RB JJ,"['food/NN', 'be/VB', 'actually/RB', 'aweful/JJ']"
"I have reservations about the all you can eat deal, however -- the choices are fairly limited and you can probably order more food than you can eat for less than $18 by just going off the menu.",0,have reservation all eat deal however choice be fairly limit probably order more food eat less just go menu,VB NN RB VB NN RB NN VB RB VB RB NN JJ NN VB JJ RB VB NN,"['have/VB', 'reservation/NN', 'all/RB', 'eat/VB', 'deal/NN', 'however/RB', 'choice/NN', 'be/VB', 'fairly/RB', 'limit/VB', 'probably/RB', 'order/NN', 'more/JJ', 'food/NN', 'eat/VB', 'less/JJ', 'just/RB', 'go/VB', 'menu/NN']"
"The sandwiches are dry, tasteless and way overpriced.",0,sandwich be dry tasteless way overpriced,NN VB JJ JJ NN JJ,"['sandwich/NN', 'be/VB', 'dry/JJ', 'tasteless/JJ', 'way/NN', 'overpriced/JJ']"
"Despite a slightly limited menu, everything prepared is done to perfection, ultra fresh and a work of food art.",0,slightly limited menu everything prepare be do perfection ultra fresh work food art,RB JJ NN NN VB VB VB NN JJ JJ NN NN NN,"['slightly/RB', 'limited/JJ', 'menu/NN', 'everything/NN', 'prepare/VB', 'be/VB', 'do/VB', 'perfection/NN', 'ultra/JJ', 'fresh/JJ', 'work/NN', 'food/NN', 'art/NN']"
"Food was just average...if they lowered the prices just a bit, it would be a bigger draw.",0,food be just average lower price just bit be bigger draw,NN VB RB JJ VB NN RB NN VB JJ VB,"['food/NN', 'be/VB', 'just/RB', 'average/JJ', 'lower/VB', 'price/NN', 'just/RB', 'bit/NN', 'be/VB', 'bigger/JJ', 'draw/VB']"
Not worth it.,0,not worth,RB JJ,"['not/RB', 'worth/JJ']"
"With the exception of our lemon salad that had so much pepper on it that our eyes started watering, the food here was decent, not great.",0,exception lemon salad have so much pepper eye start food here be decent not great,NN NN NN VB RB JJ NN NN VB NN RB VB JJ RB JJ,"['exception/NN', 'lemon/NN', 'salad/NN', 'have/VB', 'so/RB', 'much/JJ', 'pepper/NN', 'eye/NN', 'start/VB', 'food/NN', 'here/RB', 'be/VB', 'decent/JJ', 'not/RB', 'great/JJ']"
My chow fun and chow see was really bland and oily.,0,chow fun chow see be really bland oily,NN NN NN NN VB RB JJ JJ,"['chow/NN', 'fun/NN', 'chow/NN', 'see/NN', 'be/VB', 'really/RB', 'bland/JJ', 'oily/JJ']"
Somehow working the italian charm with constant mille grazie does not constitute proper service.,0,somehow italian charm constant mille grazie do not constitute proper service,RB JJ NN JJ NN NN VB RB JJ JJ NN,"['somehow/RB', 'italian/JJ', 'charm/NN', 'constant/JJ', 'mille/NN', 'grazie/NN', 'do/VB', 'not/RB', 'constitute/JJ', 'proper/JJ', 'service/NN']"
"The decor is night tho...but they REALLY need to clean that vent in the ceiling...its quite un-appetizing, and kills your effort to make this place look sleek and modern.",0,decor be night tho really need clean vent ceiling quite appetizing kill effort make place look sleek modern,NN VB NN NN RB VB VB NN NN RB JJ VB NN VB NN VB JJ JJ,"['decor/NN', 'be/VB', 'night/NN', 'tho/NN', 'really/RB', 'need/VB', 'clean/VB', 'vent/NN', 'ceiling/NN', 'quite/RB', 'appetizing/JJ', 'kill/VB', 'effort/NN', 'make/VB', 'place/NN', 'look/VB', 'sleek/JJ', 'modern/JJ']"
"For the people who want great food plus great service, Roxy is a place to AVOID!",0,person want great food great service roxy be place avoid,NN VB JJ NN JJ NN NN VB NN VB,"['person/NN', 'want/VB', 'great/JJ', 'food/NN', 'great/JJ', 'service/NN', 'roxy/NN', 'be/VB', 'place/NN', 'avoid/VB']"
"When we stumbled on Leon, we thought that we had found quite the gem BUT, we were certainly wrong.",0,stumble leon think have find quite gem be certainly wrong,VB NN VB VB VB RB NN VB RB JJ,"['stumble/VB', 'leon/NN', 'think/VB', 'have/VB', 'find/VB', 'quite/RB', 'gem/NN', 'be/VB', 'certainly/RB', 'wrong/JJ']"
I'm not picky - but it was actually gross.,0,not picky be actually gross,RB JJ VB RB JJ,"['not/RB', 'picky/JJ', 'be/VB', 'actually/RB', 'gross/JJ']"
please don't fool us.,0,please don fool,VB VB NN,"['please/VB', 'don/VB', 'fool/NN']"
"Also, because it is so thin, it gets cold very quickly and its not that filling.",0,also be thin get cold very quickly not fill,RB VB JJ VB JJ RB RB RB VB,"['also/RB', 'be/VB', 'thin/JJ', 'get/VB', 'cold/JJ', 'very/RB', 'quickly/RB', 'not/RB', 'fill/VB']"
"Quite frankly, this is some of the worst sushi I have ever tried.",0,quite frankly be worst sushi have ever try,RB RB VB JJ NN VB RB VB,"['quite/RB', 'frankly/RB', 'be/VB', 'worst/JJ', 'sushi/NN', 'have/VB', 'ever/RB', 'try/VB']"
The soup for the udon was soy sauce and water.,0,soup be soy sauce water,NN VB NN NN NN,"['soup/NN', 'be/VB', 'soy/NN', 'sauce/NN', 'water/NN']"
"I have tried to make reservations, but both times, the hostess didn't have my name.",0,have try make reservation time hostess didn have name,VB VB VB NN NN NN VB VB NN,"['have/VB', 'try/VB', 'make/VB', 'reservation/NN', 'time/NN', 'hostess/NN', 'didn/VB', 'have/VB', 'name/NN']"
first it took us a long time to find the place.,0,first take long time find place,JJ VB JJ NN VB NN,"['first/JJ', 'take/VB', 'long/JJ', 'time/NN', 'find/VB', 'place/NN']"
"Don't dine at Tamarind for the vegetarian dishes, they are simply not up to par with the non-veg selections.",0,don dine tamarind vegetarian dish be simply not par veg selection,VB VB NN JJ NN VB RB RB VB JJ NN,"['don/VB', 'dine/VB', 'tamarind/NN', 'vegetarian/JJ', 'dish/NN', 'be/VB', 'simply/RB', 'not/RB', 'par/VB', 'veg/JJ', 'selection/NN']"
not sure why this restaurant would be rated that highly.,0,not sure restaurant be rate highly,RB JJ NN VB VB RB,"['not/RB', 'sure/JJ', 'restaurant/NN', 'be/VB', 'rate/VB', 'highly/RB']"
"The fish was adequate, but inexpertly sliced.",0,fish be adequate inexpertly slice,NN VB JJ RB VB,"['fish/NN', 'be/VB', 'adequate/JJ', 'inexpertly/RB', 'slice/VB']"
"For instance, plates were just dumped on the table, I was handed the wine list upside down, etc.... ",0,instance plate be just dump table be hand wine list upside etc,NN NN VB RB VB NN VB VB NN NN NN NN,"['instance/NN', 'plate/NN', 'be/VB', 'just/RB', 'dump/VB', 'table/NN', 'be/VB', 'hand/VB', 'wine/NN', 'list/NN', 'upside/NN', 'etc/NN']"
"The decor is night tho...but they REALLY need to clean that vent in the ceiling...its quite un-appetizing, and kills your effort to make this place look sleek and modern.",0,decor be night tho really need clean vent ceiling quite appetizing kill effort make place look sleek modern,NN VB NN NN RB VB VB NN NN RB JJ VB NN VB NN VB JJ JJ,"['decor/NN', 'be/VB', 'night/NN', 'tho/NN', 'really/RB', 'need/VB', 'clean/VB', 'vent/NN', 'ceiling/NN', 'quite/RB', 'appetizing/JJ', 'kill/VB', 'effort/NN', 'make/VB', 'place/NN', 'look/VB', 'sleek/JJ', 'modern/JJ']"
We ordered some beef and noodle soup dishes from the Thai section of the menu but nothing we got was Thai.,0,order beef noodle soup dish thai section menu nothing get be thai,VB NN JJ NN NN NN NN NN NN VB VB NN,"['order/VB', 'beef/NN', 'noodle/JJ', 'soup/NN', 'dish/NN', 'thai/NN', 'section/NN', 'menu/NN', 'nothing/NN', 'get/VB', 'be/VB', 'thai/NN']"
Never again!,0,never again,RB RB,"['never/RB', 'again/RB']"
"We, there were four of us, arrived at noon - the place was empty - and the staff acted like we were imposing on them and they were very rude.",0,be arrive noon place be empty staff act be impose be very rude,VB VB NN NN VB JJ NN VB VB VB VB RB JJ,"['be/VB', 'arrive/VB', 'noon/NN', 'place/NN', 'be/VB', 'empty/JJ', 'staff/NN', 'act/VB', 'be/VB', 'impose/VB', 'be/VB', 'very/RB', 'rude/JJ']"
The workers there also absolutely load the bagel with cream cheese (gets a little messy).,0,worker also absolutely load bagel cream cheese get little messy,NN RB RB VB NN NN NN VB JJ JJ,"['worker/NN', 'also/RB', 'absolutely/RB', 'load/VB', 'bagel/NN', 'cream/NN', 'cheese/NN', 'get/VB', 'little/JJ', 'messy/JJ']"
"Anybody who likes this place must be from a different planet, where greasy, dry and tasteless are complimentary.",0,anybody like place be different planet greasy dry tasteless be complimentary,NN VB NN VB JJ NN JJ NN JJ VB JJ,"['anybody/NN', 'like/VB', 'place/NN', 'be/VB', 'different/JJ', 'planet/NN', 'greasy/JJ', 'dry/NN', 'tasteless/JJ', 'be/VB', 'complimentary/JJ']"
"Overall, not worth the money.",0,overall not money,JJ RB NN,"['overall/JJ', 'not/RB', 'money/NN']"
"The food however, is what one might expect.",0,food however be one expect,NN RB VB NN VB,"['food/NN', 'however/RB', 'be/VB', 'one/NN', 'expect/VB']"
Also they were $15 each!,0,also be,RB VB,"['also/RB', 'be/VB']"
The only fallback on this restaurant is the prices.,0,only fallback restaurant be price,JJ NN NN VB NN,"['only/JJ', 'fallback/NN', 'restaurant/NN', 'be/VB', 'price/NN']"
They were such a rip-off ($8.95 for four small meat patties in steamed buns) and not worth trying.,0,be such rip small meat patty steamed bun not worth try,VB JJ VB JJ NN NN JJ NN RB JJ VB,"['be/VB', 'such/JJ', 'rip/VB', 'small/JJ', 'meat/NN', 'patty/NN', 'steamed/JJ', 'bun/NN', 'not/RB', 'worth/JJ', 'try/VB']"
The lobster sandwich is $24 and although it was good it was not nearly enough to warrant that price.,0,lobster sandwich be be good be not nearly enough warrant price,NN NN VB VB JJ VB RB RB JJ VB NN,"['lobster/NN', 'sandwich/NN', 'be/VB', 'be/VB', 'good/JJ', 'be/VB', 'not/RB', 'nearly/RB', 'enough/JJ', 'warrant/VB', 'price/NN']"
Somehow working the italian charm with constant mille grazie does not constitute proper service.,0,somehow italian charm constant mille grazie do not constitute proper service,RB JJ NN JJ NN NN VB RB JJ JJ NN,"['somehow/RB', 'italian/JJ', 'charm/NN', 'constant/JJ', 'mille/NN', 'grazie/NN', 'do/VB', 'not/RB', 'constitute/JJ', 'proper/JJ', 'service/NN']"
"Took my mom for Mother's Day, and the maitre d' was pretty rude.",0,take mom mother day maitre be pretty rude,VB NN NN NN NN VB JJ JJ,"['take/VB', 'mom/NN', 'mother/NN', 'day/NN', 'maitre/NN', 'be/VB', 'pretty/JJ', 'rude/JJ']"
"The service varys from day to day- sometimes they're very nice, and sometimes not.",0,service varys day day sometimes re very nice sometimes not,NN NN NN NN RB NN RB JJ RB RB,"['service/NN', 'varys/NN', 'day/NN', 'day/NN', 'sometimes/RB', 're/NN', 'very/RB', 'nice/JJ', 'sometimes/RB', 'not/RB']"
Never have I had such dramatic delivery guys (a lot of huffing and panting and muttering under breath b/c I live in a walkup) who always seem disappointed with their tips.,0,never have have such dramatic delivery guy lot huffing pant mutter breath live walkup always seem disappoint tip,RB VB VB JJ JJ NN NN NN NN VB VB NN VB NN RB VB VB NN,"['never/RB', 'have/VB', 'have/VB', 'such/JJ', 'dramatic/JJ', 'delivery/NN', 'guy/NN', 'lot/NN', 'huffing/NN', 'pant/VB', 'mutter/VB', 'breath/NN', 'live/VB', 'walkup/NN', 'always/RB', 'seem/VB', 'disappoint/VB', 'tip/NN']"
"Skip this restaurant, it's a big disappointment.",0,skip restaurant big disappointment,NN NN JJ NN,"['skip/NN', 'restaurant/NN', 'big/JJ', 'disappointment/NN']"
"Even though its good seafood, the prices are too high.",0,even good seafood price be too high,RB JJ NN NN VB RB JJ,"['even/RB', 'good/JJ', 'seafood/NN', 'price/NN', 'be/VB', 'too/RB', 'high/JJ']"
"After all that, they complained to me about the small tip.",0,complain small tip,VB JJ NN,"['complain/VB', 'small/JJ', 'tip/NN']"
"We did tip, I guess the model/waitress just wanted more and complained to the manager.",0,do tip guess model waitress just want more complain manager,VB NN NN NN NN RB VB RB VB NN,"['do/VB', 'tip/NN', 'guess/NN', 'model/NN', 'waitress/NN', 'just/RB', 'want/VB', 'more/RB', 'complain/VB', 'manager/NN']"
Was surprisingly disappointed.,0,be surprisingly disappoint,VB RB VB,"['be/VB', 'surprisingly/RB', 'disappoint/VB']"
"After dinner the manager grabbed my boyfriend, asked him: Where are you from...maybe you dont know how things work in America...and in the end stormed away almost teareyed yelling that tips are the only thing they survive on.",0,dinner manager grab boyfriend ask be maybe dont know thing work america end storm away almost tearey yell tip be only thing survive,NN NN VB NN VB VB RB VB VB NN NN NN NN VB RB RB VB VB NN VB JJ NN VB,"['dinner/NN', 'manager/NN', 'grab/VB', 'boyfriend/NN', 'ask/VB', 'be/VB', 'maybe/RB', 'dont/VB', 'know/VB', 'thing/NN', 'work/NN', 'america/NN', 'end/NN', 'storm/VB', 'away/RB', 'almost/RB', 'tearey/VB', 'yell/VB', 'tip/NN', 'be/VB', 'only/JJ', 'thing/NN', 'survive/VB']"
Save yourself the time and trouble and skip this one!,0,save time trouble skip one,VB NN NN NN NN,"['save/VB', 'time/NN', 'trouble/NN', 'skip/NN', 'one/NN']"
"Despite a slightly limited menu, everything prepared is done to perfection, ultra fresh and a work of food art.",0,slightly limited menu everything prepare be do perfection ultra fresh work food art,RB JJ NN NN VB VB VB NN JJ JJ NN NN NN,"['slightly/RB', 'limited/JJ', 'menu/NN', 'everything/NN', 'prepare/VB', 'be/VB', 'do/VB', 'perfection/NN', 'ultra/JJ', 'fresh/JJ', 'work/NN', 'food/NN', 'art/NN']"
NO PIZZA 33 for me!,0,pizza,NN,['pizza/NN']
"The staff has been nice, but they seemed really stressed and the unisex bathroom needs to be cleaned more often.",0,staff have be nice seem really stressed unisex bathroom need be clean more often,NN VB VB JJ VB RB JJ NN NN NN VB VB RB RB,"['staff/NN', 'have/VB', 'be/VB', 'nice/JJ', 'seem/VB', 'really/RB', 'stressed/JJ', 'unisex/NN', 'bathroom/NN', 'need/NN', 'be/VB', 'clean/VB', 'more/RB', 'often/RB']"
"Also, specify if you like your food spicy- its rather bland if you don't.",0,also specify food spicy rather bland don,RB VB NN JJ RB JJ VB,"['also/RB', 'specify/VB', 'food/NN', 'spicy/JJ', 'rather/RB', 'bland/JJ', 'don/VB']"
The menu is limited but almost all of the dishes are excellent.,0,menu be limited almost dish be excellent,NN VB JJ RB NN VB JJ,"['menu/NN', 'be/VB', 'limited/JJ', 'almost/RB', 'dish/NN', 'be/VB', 'excellent/JJ']"
Would NEVER go back there.,0,never go back there,RB VB RB RB,"['never/RB', 'go/VB', 'back/RB', 'there/RB']"
The lobster sandwich is $24 and although it was good it was not nearly enough to warrant that price.,0,lobster sandwich be be good be not nearly enough warrant price,NN NN VB VB JJ VB RB RB JJ VB NN,"['lobster/NN', 'sandwich/NN', 'be/VB', 'be/VB', 'good/JJ', 'be/VB', 'not/RB', 'nearly/RB', 'enough/JJ', 'warrant/VB', 'price/NN']"
The only problem is that the manager is a complete incompetent.,0,only problem be manager be complete incompetent,JJ NN VB NN VB JJ JJ,"['only/JJ', 'problem/NN', 'be/VB', 'manager/NN', 'be/VB', 'complete/JJ', 'incompetent/JJ']"
They were such a rip-off ($8.95 for four small meat patties in steamed buns) and not worth trying.,0,be such rip small meat patty steamed bun not worth try,VB JJ VB JJ NN NN JJ NN RB JJ VB,"['be/VB', 'such/JJ', 'rip/VB', 'small/JJ', 'meat/NN', 'patty/NN', 'steamed/JJ', 'bun/NN', 'not/RB', 'worth/JJ', 'try/VB']"
Avoid this place!,0,avoid place,VB NN,"['avoid/VB', 'place/NN']"
The atmosphere is noisy and the waiters are literally walking around doing things as fast as they can.,0,atmosphere be noisy waiter be literally walk do thing fast,NN VB JJ NN VB RB VB VB NN RB,"['atmosphere/NN', 'be/VB', 'noisy/JJ', 'waiter/NN', 'be/VB', 'literally/RB', 'walk/VB', 'do/VB', 'thing/NN', 'fast/RB']"
"My husbands was perfect, my was well done and dry.",0,husband be perfect be well do dry,NN VB JJ VB RB VB JJ,"['husband/NN', 'be/VB', 'perfect/JJ', 'be/VB', 'well/RB', 'do/VB', 'dry/JJ']"
"Well, this place is so Ghetto its not even funny.",0,well place be ghetto not even funny,RB NN VB NN RB RB JJ,"['well/RB', 'place/NN', 'be/VB', 'ghetto/NN', 'not/RB', 'even/RB', 'funny/JJ']"
But $1 for each small piece???,0,small piece,JJ NN,"['small/JJ', 'piece/NN']"
And I hate to say this but I doubt I'll ever go back. ,0,hate say doubt ll ever go back,NN VB NN NN RB VB RB,"['hate/NN', 'say/VB', 'doubt/NN', 'll/NN', 'ever/RB', 'go/VB', 'back/RB']"
"The last two times I ordered from here my food was soo spicy that  I could barely eat it, and the spice took away from the flavor of the dish.",0,last time order here food be spicy barely eat spice take away flavor dish,JJ NN VB RB NN VB JJ RB VB NN VB RB NN NN,"['last/JJ', 'time/NN', 'order/VB', 'here/RB', 'food/NN', 'be/VB', 'spicy/JJ', 'barely/RB', 'eat/VB', 'spice/NN', 'take/VB', 'away/RB', 'flavor/NN', 'dish/NN']"
We were very disappointed.,0,be very disappointed,VB RB JJ,"['be/VB', 'very/RB', 'disappointed/JJ']"
But $1 for each small piece???,0,small piece,JJ NN,"['small/JJ', 'piece/NN']"
This place is incredibly tiny.,0,place be incredibly tiny,NN VB RB JJ,"['place/NN', 'be/VB', 'incredibly/RB', 'tiny/JJ']"
"The atmosphere isn't the greatest , but I suppose that's how they keep the prices down .",0,atmosphere isn greatest suppose keep price,NN JJ JJ VB VB NN,"['atmosphere/NN', 'isn/JJ', 'greatest/JJ', 'suppose/VB', 'keep/VB', 'price/NN']"
This place would be so much better served by being run by a group that actually understands customer service.,0,place be so much better serve be run group actually understand customer service,NN VB RB RB RB VB VB VB NN RB VB NN NN,"['place/NN', 'be/VB', 'so/RB', 'much/RB', 'better/RB', 'serve/VB', 'be/VB', 'run/VB', 'group/NN', 'actually/RB', 'understand/VB', 'customer/NN', 'service/NN']"
The lobster sandwich is $24 and although it was good it was not nearly enough to warrant that price.,0,lobster sandwich be be good be not nearly enough warrant price,NN NN VB VB JJ VB RB RB JJ VB NN,"['lobster/NN', 'sandwich/NN', 'be/VB', 'be/VB', 'good/JJ', 'be/VB', 'not/RB', 'nearly/RB', 'enough/JJ', 'warrant/VB', 'price/NN']"
Mine was a little burnt but still delicious with goat cheese and panchetta (raddichio was kind of bitter though).,0,mine be little burnt still delicious goat cheese panchetta raddichio be kind bitter,NN VB JJ JJ RB JJ NN NN VB NN VB NN JJ,"['mine/NN', 'be/VB', 'little/JJ', 'burnt/JJ', 'still/RB', 'delicious/JJ', 'goat/NN', 'cheese/NN', 'panchetta/VB', 'raddichio/NN', 'be/VB', 'kind/NN', 'bitter/JJ']"
It's a rather cramped and busy restaurant and it closes early.,0,rather cramped busy restaurant close early,RB JJ JJ NN VB RB,"['rather/RB', 'cramped/JJ', 'busy/JJ', 'restaurant/NN', 'close/VB', 'early/RB']"
"The svc can be a bit rude at times, esp if you have big group, but overall the restaurant is a must!",0,svc be bit rude time esp have big group restaurant be,NN VB JJ JJ NN RB VB JJ NN NN VB,"['svc/NN', 'be/VB', 'bit/JJ', 'rude/JJ', 'time/NN', 'esp/RB', 'have/VB', 'big/JJ', 'group/NN', 'restaurant/NN', 'be/VB']"
Also they were $15 each!,0,also be,RB VB,"['also/RB', 'be/VB']"
"Moules were excellent, lobster ravioli was VERY salty!",0,moule be excellent lobster ravioli be very salty,NN VB JJ NN NN VB RB JJ,"['moule/NN', 'be/VB', 'excellent/JJ', 'lobster/NN', 'ravioli/NN', 'be/VB', 'very/RB', 'salty/JJ']"
Dessert is a joke...dont bother,0,dessert be joke dont,NN VB NN VB,"['dessert/NN', 'be/VB', 'joke/NN', 'dont/VB']"
It's a rather cramped and busy restaurant and it closes early.,0,rather cramped busy restaurant close early,RB JJ JJ NN VB RB,"['rather/RB', 'cramped/JJ', 'busy/JJ', 'restaurant/NN', 'close/VB', 'early/RB']"
The workers there also absolutely load the bagel with cream cheese (gets a little messy).,0,worker also absolutely load bagel cream cheese get little messy,NN RB RB VB NN NN NN VB JJ JJ,"['worker/NN', 'also/RB', 'absolutely/RB', 'load/VB', 'bagel/NN', 'cream/NN', 'cheese/NN', 'get/VB', 'little/JJ', 'messy/JJ']"
the turkey burgers are scary!,0,turkey burger be scary,NN NN VB JJ,"['turkey/NN', 'burger/NN', 'be/VB', 'scary/JJ']"
Service is not what you are coming here for...,0,service be not be come here,NN VB RB VB VB RB,"['service/NN', 'be/VB', 'not/RB', 'be/VB', 'come/VB', 'here/RB']"
"The food arrived 20 minutes after I called, cold and soggy.",0,food arrived minute call cold soggy,NN JJ NN VB JJ JJ,"['food/NN', 'arrived/JJ', 'minute/NN', 'call/VB', 'cold/JJ', 'soggy/JJ']"
Not a great place for family or general dining.,0,not great place family general dining,RB JJ NN NN JJ NN,"['not/RB', 'great/JJ', 'place/NN', 'family/NN', 'general/JJ', 'dining/NN']"
the all-u-can-eat sushi is definitely in very poor quality.,0,all eat sushi be definitely very poor quality,RB VB NN VB RB RB JJ NN,"['all/RB', 'eat/VB', 'sushi/NN', 'be/VB', 'definitely/RB', 'very/RB', 'poor/JJ', 'quality/NN']"
"A gentleman, maybe the manager, came to our table, and without so much as a smile or greeting asked for our order.",0,gentleman maybe manager come table so much smile greeting ask order,NN RB NN VB NN RB JJ NN NN VB NN,"['gentleman/NN', 'maybe/RB', 'manager/NN', 'come/VB', 'table/NN', 'so/RB', 'much/JJ', 'smile/NN', 'greeting/NN', 'ask/VB', 'order/NN']"
The lobster sandwich is $24 and although it was good it was not nearly enough to warrant that price.,0,lobster sandwich be be good be not nearly enough warrant price,NN NN VB VB JJ VB RB RB JJ VB NN,"['lobster/NN', 'sandwich/NN', 'be/VB', 'be/VB', 'good/JJ', 'be/VB', 'not/RB', 'nearly/RB', 'enough/JJ', 'warrant/VB', 'price/NN']"
I'm not picky - but it was actually gross.,0,not picky be actually gross,RB JJ VB RB JJ,"['not/RB', 'picky/JJ', 'be/VB', 'actually/RB', 'gross/JJ']"
I'm not picky - but it was actually gross.,0,not picky be actually gross,RB JJ VB RB JJ,"['not/RB', 'picky/JJ', 'be/VB', 'actually/RB', 'gross/JJ']"
"I had their eggs benedict for brunch, which were the worst in my entire life, I tried removing the hollondaise sauce completely that was how failed it was.",0,have egg benedict brunch be worst entire life try remove hollondaise sauce completely be failed be,VB NN NN NN VB JJ JJ NN VB VB NN NN RB VB JJ VB,"['have/VB', 'egg/NN', 'benedict/NN', 'brunch/NN', 'be/VB', 'worst/JJ', 'entire/JJ', 'life/NN', 'try/VB', 'remove/VB', 'hollondaise/NN', 'sauce/NN', 'completely/RB', 'be/VB', 'failed/JJ', 'be/VB']"
Someone else recommended the dessert - we also left that.,0,someone else recommend dessert also left,NN RB VB NN RB VB,"['someone/NN', 'else/RB', 'recommend/VB', 'dessert/NN', 'also/RB', 'left/VB']"
The rice was poor quality and was cooked so badly it was hard.,0,rice be poor quality be cook so badly be hard,NN VB JJ NN VB VB RB RB VB JJ,"['rice/NN', 'be/VB', 'poor/JJ', 'quality/NN', 'be/VB', 'cook/VB', 'so/RB', 'badly/RB', 'be/VB', 'hard/JJ']"
"The last two times I ordered from here my food was soo spicy that  I could barely eat it, and the spice took away from the flavor of the dish.",0,last time order here food be spicy barely eat spice take away flavor dish,JJ NN VB RB NN VB JJ RB VB NN VB RB NN NN,"['last/JJ', 'time/NN', 'order/VB', 'here/RB', 'food/NN', 'be/VB', 'spicy/JJ', 'barely/RB', 'eat/VB', 'spice/NN', 'take/VB', 'away/RB', 'flavor/NN', 'dish/NN']"
"The waitress, seems to be more concerned of looking good than actually waitressing.",0,waitress seem be more concerned look good actually waitressing,NN VB VB RB JJ VB JJ RB JJ,"['waitress/NN', 'seem/VB', 'be/VB', 'more/RB', 'concerned/JJ', 'look/VB', 'good/JJ', 'actually/RB', 'waitressing/JJ']"
"My husbands was perfect, my was well done and dry.",0,husband be perfect be well do dry,NN VB JJ VB RB VB JJ,"['husband/NN', 'be/VB', 'perfect/JJ', 'be/VB', 'well/RB', 'do/VB', 'dry/JJ']"
We thought that this place is using too much of MSG cooking in the foods.,0,think place be used too much msg cooking food,VB NN VB VB RB JJ JJ NN NN,"['think/VB', 'place/NN', 'be/VB', 'used/VB', 'too/RB', 'much/JJ', 'msg/JJ', 'cooking/NN', 'food/NN']"
"The food is decent at best, and the ambience, well, it's a matter of opinion, some may consider it to be a sweet thing, I thought it was just annoying.",0,food be decent best ambience well matter opinion consider be sweet thing think be just annoying,NN VB JJ JJ NN RB NN NN VB VB JJ NN VB VB RB JJ,"['food/NN', 'be/VB', 'decent/JJ', 'best/JJ', 'ambience/NN', 'well/RB', 'matter/NN', 'opinion/NN', 'consider/VB', 'be/VB', 'sweet/JJ', 'thing/NN', 'think/VB', 'be/VB', 'just/RB', 'annoying/JJ']"
"The service was terrible, we had to wait for everything and ask several of different people for the same thing before we were allowed to be served.",0,service be terrible have wait everything ask several different person same thing be allow be serve,NN VB JJ VB VB NN VB JJ JJ NN JJ NN VB VB VB VB,"['service/NN', 'be/VB', 'terrible/JJ', 'have/VB', 'wait/VB', 'everything/NN', 'ask/VB', 'several/JJ', 'different/JJ', 'person/NN', 'same/JJ', 'thing/NN', 'be/VB', 'allow/VB', 'be/VB', 'serve/VB']"
Okay-i don't mind the oily part (cause most are cooked that way) but it was way too bland.,0,okay don mind oily part cause most be cook way be way too bland,JJ VB VB JJ NN NN RB VB VB NN VB NN RB JJ,"['okay/JJ', 'don/VB', 'mind/VB', 'oily/JJ', 'part/NN', 'cause/NN', 'most/RB', 'be/VB', 'cook/VB', 'way/NN', 'be/VB', 'way/NN', 'too/RB', 'bland/JJ']"
