sentence,sentiment,lem_words,lem_tags,word_tags
I loved it and would go again.,2,love go again,VB VB RB,"['love/VB', 'go/VB', 'again/RB']"
You must try the shrimp appetizers.,2,try shrimp appetizer,VB NN NN,"['try/VB', 'shrimp/NN', 'appetizer/NN']"
Always great service!,2,always great service,RB JJ NN,"['always/RB', 'great/JJ', 'service/NN']"
"Delicate spices, onions, eggs and a kick-ass roti.",2,delicate spice onion egg kick ass roti,JJ NN NN NN JJ NN NN,"['delicate/JJ', 'spice/NN', 'onion/NN', 'egg/NN', 'kick/JJ', 'ass/NN', 'roti/NN']"
"I found the food, service and value exceptional everytime I have been there.",2,find food service value exceptional everytime have be there,VB NN NN NN JJ NN VB VB RB,"['find/VB', 'food/NN', 'service/NN', 'value/NN', 'exceptional/JJ', 'everytime/NN', 'have/VB', 'be/VB', 'there/RB']"
I have to say that I am pleasantly suprised and I will most likely stop in again if I am in the neighborhood.,2,have say be pleasantly suprised most likely stop again be neighborhood,VB VB VB RB JJ RB RB VB RB VB NN,"['have/VB', 'say/VB', 'be/VB', 'pleasantly/RB', 'suprised/JJ', 'most/RB', 'likely/RB', 'stop/VB', 'again/RB', 'be/VB', 'neighborhood/NN']"
Very good wine choices.,2,very good wine choice,RB JJ NN NN,"['very/RB', 'good/JJ', 'wine/NN', 'choice/NN']"
It was divine melts in your mouth.,2,be divine melt mouth,VB JJ VB NN,"['be/VB', 'divine/JJ', 'melt/VB', 'mouth/NN']"
Get the tuna of gari.,2,get tuna gari,VB NN NN,"['get/VB', 'tuna/NN', 'gari/NN']"
The wine the service was very good too.,2,wine service be very good too,NN NN VB RB JJ RB,"['wine/NN', 'service/NN', 'be/VB', 'very/RB', 'good/JJ', 'too/RB']"
"To me it exemplifies Soho, cute, artsy, interesting.",2,exemplify cute artsy interesting,VB JJ JJ JJ,"['exemplify/VB', 'cute/JJ', 'artsy/JJ', 'interesting/JJ']"
"Most of the servers are very attentive, friendly and quite attractive.",2,most server be very attentive friendly quite attractive,JJ NN VB RB JJ JJ RB JJ,"['most/JJ', 'server/NN', 'be/VB', 'very/RB', 'attentive/JJ', 'friendly/JJ', 'quite/RB', 'attractive/JJ']"
Fantastic place.,2,fantastic place,JJ NN,"['fantastic/JJ', 'place/NN']"
Try the lobster teriyaki and the rose special roll.,2,try lobster teriyaki rise special roll,VB NN NN VB JJ NN,"['try/VB', 'lobster/NN', 'teriyaki/NN', 'rise/VB', 'special/JJ', 'roll/NN']"
"The food was delicious (I had a halibut special, my husband had steak), and the service was top-notch.",2,food be delicious have halibut special husband have steak service be top notch,NN VB JJ VB JJ JJ NN VB NN NN VB JJ NN,"['food/NN', 'be/VB', 'delicious/JJ', 'have/VB', 'halibut/JJ', 'special/JJ', 'husband/NN', 'have/VB', 'steak/NN', 'service/NN', 'be/VB', 'top/JJ', 'notch/NN']"
There is a lot of variety even for people who eat vegetarian like me.,2,be lot variety even person eat vegetarian,VB NN NN RB NN VB JJ,"['be/VB', 'lot/NN', 'variety/NN', 'even/RB', 'person/NN', 'eat/VB', 'vegetarian/JJ']"
Have frequented 'ino for several years and the food remains excellent.,2,have frequent ino several year food remain excellent,VB VB NN JJ NN NN VB JJ,"['have/VB', 'frequent/VB', 'ino/NN', 'several/JJ', 'year/NN', 'food/NN', 'remain/VB', 'excellent/JJ']"
I had a great experience.,2,have great experience,VB JJ NN,"['have/VB', 'great/JJ', 'experience/NN']"
First of all Dal Bukhara Rocks.,2,first dal bukhara rock,JJ NN NN NN,"['first/JJ', 'dal/NN', 'bukhara/NN', 'rock/NN']"
The entertainment was great they have shows that go on through out the dinner.,2,entertainment be great have show go dinner,NN VB JJ VB NN VB NN,"['entertainment/NN', 'be/VB', 'great/JJ', 'have/VB', 'show/NN', 'go/VB', 'dinner/NN']"
Highly recommended to all!,2,highly recommend,RB VB,"['highly/RB', 'recommend/VB']"
I highly recommend the restaurant based on our experience last night.,2,highly recommend restaurant base experience last night,RB VB NN VB NN JJ NN,"['highly/RB', 'recommend/VB', 'restaurant/NN', 'base/VB', 'experience/NN', 'last/JJ', 'night/NN']"
"In the evening, this place attracted a well dressed, with it, NY crowd.",2,evening place attract well dress ny crowd,NN NN VB RB VB JJ NN,"['evening/NN', 'place/NN', 'attract/VB', 'well/RB', 'dress/VB', 'ny/JJ', 'crowd/NN']"
"Everything was wonderful; food, drinks, staff, mileau.",2,everything be wonderful food drink staff mileau,NN VB JJ NN NN NN NN,"['everything/NN', 'be/VB', 'wonderful/JJ', 'food/NN', 'drink/NN', 'staff/NN', 'mileau/NN']"
Truly the mark of an attentive waiter.,2,truly mark attentive waiter,RB NN JJ NN,"['truly/RB', 'mark/NN', 'attentive/JJ', 'waiter/NN']"
I am reluctant to write because I would not want my jem of a pizza place to become overcrowded.,2,be reluctant write not want jem pizza place become overcrowded,VB JJ VB RB VB NN NN NN VB JJ,"['be/VB', 'reluctant/JJ', 'write/VB', 'not/RB', 'want/VB', 'jem/NN', 'pizza/NN', 'place/NN', 'become/VB', 'overcrowded/JJ']"
"Yes, the prices are high, but I felt it was worth it.",2,yes price be high felt be worth,RB NN VB JJ NN VB JJ,"['yes/RB', 'price/NN', 'be/VB', 'high/JJ', 'felt/NN', 'be/VB', 'worth/JJ']"
Big Wong gets big Ups for a fine establishment.,2,big wong get big up fine establishment,JJ NN VB JJ NN JJ NN,"['big/JJ', 'wong/NN', 'get/VB', 'big/JJ', 'up/NN', 'fine/JJ', 'establishment/NN']"
"For those that go once and don't enjoy it, all I can say is that they just don't get it.",2,go once don enjoy say be just don get,VB RB VB NN VB VB RB VB VB,"['go/VB', 'once/RB', 'don/VB', 'enjoy/NN', 'say/VB', 'be/VB', 'just/RB', 'don/VB', 'get/VB']"
love the food.,2,love food,VB NN,"['love/VB', 'food/NN']"
This place is a great bargain.,2,place be great bargain,NN VB JJ NN,"['place/NN', 'be/VB', 'great/JJ', 'bargain/NN']"
"Ask for Usha, the nicest bartender in manhattan.",2,ask usha nicest bartender manhattan,NN NN JJ NN JJ,"['ask/NN', 'usha/NN', 'nicest/JJ', 'bartender/NN', 'manhattan/JJ']"
Mermaid Inn is an overall good restaurant with really good seafood.,2,mermaid inn be overall good restaurant really good seafood,NN NN VB JJ JJ NN RB JJ NN,"['mermaid/NN', 'inn/NN', 'be/VB', 'overall/JJ', 'good/JJ', 'restaurant/NN', 'really/RB', 'good/JJ', 'seafood/NN']"
"In an area sadly lacking in decent Thai food, this is one of the best spots.",2,area sadly lack decent thai food be best spot,NN RB VB JJ NN NN VB JJ NN,"['area/NN', 'sadly/RB', 'lack/VB', 'decent/JJ', 'thai/NN', 'food/NN', 'be/VB', 'best/JJ', 'spot/NN']"
I loved it and would go again.,2,love go again,VB VB RB,"['love/VB', 'go/VB', 'again/RB']"
The bagel was huge.,2,bagel be huge,NN VB JJ,"['bagel/NN', 'be/VB', 'huge/JJ']"
We will be back.,2,be back,VB RB,"['be/VB', 'back/RB']"
"Great service, great food.",2,great service great food,JJ NN JJ NN,"['great/JJ', 'service/NN', 'great/JJ', 'food/NN']"
The food was exceptional.,2,food be exceptional,NN VB JJ,"['food/NN', 'be/VB', 'exceptional/JJ']"
"The food is good, I can't lie.",2,food be good lie,NN VB JJ VB,"['food/NN', 'be/VB', 'good/JJ', 'lie/VB']"
"the salads are delicious, both refreshing and very spicy.",2,salad be delicious refreshing very spicy,NN VB JJ JJ RB JJ,"['salad/NN', 'be/VB', 'delicious/JJ', 'refreshing/JJ', 'very/RB', 'spicy/JJ']"
"Just straight up cheap, good food.",2,just straight cheap good food,RB RB RB JJ NN,"['just/RB', 'straight/RB', 'cheap/RB', 'good/JJ', 'food/NN']"
"It is nearly impossible to get a table, so if you ever have the chance to go here for dinner, DO NOT pass it up.",2,be nearly impossible get table ever have chance go here dinner do not pass,VB RB JJ VB NN RB VB NN VB RB NN VB RB VB,"['be/VB', 'nearly/RB', 'impossible/JJ', 'get/VB', 'table/NN', 'ever/RB', 'have/VB', 'chance/NN', 'go/VB', 'here/RB', 'dinner/NN', 'do/VB', 'not/RB', 'pass/VB']"
Every time in New York I make it a point to visit Restaurant Saul on Smith Street.,2,time new york make point visit restaurant saul street,NN NN NN VB NN VB NN VB NN,"['time/NN', 'new/NN', 'york/NN', 'make/VB', 'point/NN', 'visit/VB', 'restaurant/NN', 'saul/VB', 'street/NN']"
And really large portions.,2,really large portion,RB JJ NN,"['really/RB', 'large/JJ', 'portion/NN']"
and you can't beat the prices.,2,beat price,VB NN,"['beat/VB', 'price/NN']"
This is a nice pizza place with good selection of thin crust pizza including the Basil slice.,2,be nice pizza place good selection thin crust pizza include basil slice,VB JJ NN NN JJ NN JJ NN NN VB NN NN,"['be/VB', 'nice/JJ', 'pizza/NN', 'place/NN', 'good/JJ', 'selection/NN', 'thin/JJ', 'crust/NN', 'pizza/NN', 'include/VB', 'basil/NN', 'slice/NN']"
Food is great and inexpensive.,2,food be great inexpensive,NN VB JJ JJ,"['food/NN', 'be/VB', 'great/JJ', 'inexpensive/JJ']"
"Don't judge this place prima facie, you have to try it to believe it, a home away from home for the literate heart.",2,don judge place prima facie have try believe home away home literate heart,VB NN NN NN NN VB VB VB NN RB NN JJ NN,"['don/VB', 'judge/NN', 'place/NN', 'prima/NN', 'facie/NN', 'have/VB', 'try/VB', 'believe/VB', 'home/NN', 'away/RB', 'home/NN', 'literate/JJ', 'heart/NN']"
"The atmosphere isn't the greatest , but I suppose that's how they keep the prices down .",2,atmosphere isn greatest suppose keep price,NN JJ JJ VB VB NN,"['atmosphere/NN', 'isn/JJ', 'greatest/JJ', 'suppose/VB', 'keep/VB', 'price/NN']"
I've lived in NY for 5 years and this place has it all.,2,ve live ny year place have,NN VB NN NN NN VB,"['ve/NN', 'live/VB', 'ny/NN', 'year/NN', 'place/NN', 'have/VB']"
A restaurant that doesn't try to do anything except serve great food with great service in a pleasant atmosphere.,2,restaurant doesn try do anything serve great food great service pleasant atmosphere,NN VB NN VB NN NN JJ NN JJ NN JJ NN,"['restaurant/NN', 'doesn/VB', 'try/NN', 'do/VB', 'anything/NN', 'serve/NN', 'great/JJ', 'food/NN', 'great/JJ', 'service/NN', 'pleasant/JJ', 'atmosphere/NN']"
Winnie and her staff are the best crew you can find serving you.,2,winnie staff be best crew find serve,NN NN VB JJ NN VB VB,"['winnie/NN', 'staff/NN', 'be/VB', 'best/JJ', 'crew/NN', 'find/VB', 'serve/VB']"
"Pizza is terrific, as is homemade pasta.",2,pizza be terrific be homemade pasta,NN VB JJ VB JJ NN,"['pizza/NN', 'be/VB', 'terrific/JJ', 'be/VB', 'homemade/JJ', 'pasta/NN']"
The cream cheeses are out of this world and I love that coffee!!,2,cream cheese be world love coffee,NN NN VB NN NN NN,"['cream/NN', 'cheese/NN', 'be/VB', 'world/NN', 'love/NN', 'coffee/NN']"
Service is fast and friendly.,2,service be fast friendly,NN VB JJ JJ,"['service/NN', 'be/VB', 'fast/JJ', 'friendly/JJ']"
I had Lobster Bisque it has 2 oz. of Maine Lobster in it.,2,have lobster bisque have oz maine lobster,VB NN NN VB NN JJ NN,"['have/VB', 'lobster/NN', 'bisque/NN', 'have/VB', 'oz/NN', 'maine/JJ', 'lobster/NN']"
"They tell me they are going to cover the garden in glass for the winter, so i'm looking forward to going there on a snowy night to enjoy it.",2,tell be go cover garden glass winter look forward go there snowy night enjoy,VB VB VB VB NN NN NN VB RB VB RB JJ NN VB,"['tell/VB', 'be/VB', 'go/VB', 'cover/VB', 'garden/NN', 'glass/NN', 'winter/NN', 'look/VB', 'forward/RB', 'go/VB', 'there/RB', 'snowy/JJ', 'night/NN', 'enjoy/VB']"
It is expensive but well worth the money.,2,be expensive well money,VB JJ RB NN,"['be/VB', 'expensive/JJ', 'well/RB', 'money/NN']"
"Food is usually very good, though ocasionally I wondered about freshmess of raw vegatables in side orders.",2,food be usually very good ocasionally wonder freshmess raw vegatable side order,NN VB RB RB JJ RB VB NN JJ NN NN NN,"['food/NN', 'be/VB', 'usually/RB', 'very/RB', 'good/JJ', 'ocasionally/RB', 'wonder/VB', 'freshmess/NN', 'raw/JJ', 'vegatable/NN', 'side/NN', 'order/NN']"
I almost hesititate to write a review because the atmosphere was so great and I would hate for it too become to crowded.,2,almost hesititate write review atmosphere be so great hate too become crowd,RB JJ VB NN NN VB RB JJ VB RB VB VB,"['almost/RB', 'hesititate/JJ', 'write/VB', 'review/NN', 'atmosphere/NN', 'be/VB', 'so/RB', 'great/JJ', 'hate/VB', 'too/RB', 'become/VB', 'crowd/VB']"
"This place is really trendi but they have forgotten about the most important part of a  restaurant, the food.",2,place be really trendi have forget most important part restaurant food,NN VB RB NN VB VB RB JJ NN NN NN,"['place/NN', 'be/VB', 'really/RB', 'trendi/NN', 'have/VB', 'forget/VB', 'most/RB', 'important/JJ', 'part/NN', 'restaurant/NN', 'food/NN']"
Big Wong gets big Ups for a fine establishment.,2,big wong get big up fine establishment,JJ NN VB JJ NN JJ NN,"['big/JJ', 'wong/NN', 'get/VB', 'big/JJ', 'up/NN', 'fine/JJ', 'establishment/NN']"
Suan is a great place that I often take my friends (classmates) too.,2,suan be great place often take friend classmate too,NN VB JJ NN RB VB NN NN RB,"['suan/NN', 'be/VB', 'great/JJ', 'place/NN', 'often/RB', 'take/VB', 'friend/NN', 'classmate/NN', 'too/RB']"
What more could you want?,2,more want,RB VB,"['more/RB', 'want/VB']"
"Over the years the host, Vittorio, and his crew, have always treated me as family--although with all the business this not-so-little gem does, it amazing he's even able to remember a consistent but not-so-frequent visitor.",2,year host vittorio crew have always treat family business not so little gem do amazing even able remember consistent not so frequent visitor,NN NN NN NN VB RB VB NN NN RB RB JJ NN VB JJ RB JJ VB JJ RB RB JJ NN,"['year/NN', 'host/NN', 'vittorio/NN', 'crew/NN', 'have/VB', 'always/RB', 'treat/VB', 'family/NN', 'business/NN', 'not/RB', 'so/RB', 'little/JJ', 'gem/NN', 'do/VB', 'amazing/JJ', 'even/RB', 'able/JJ', 'remember/VB', 'consistent/JJ', 'not/RB', 'so/RB', 'frequent/JJ', 'visitor/NN']"
I have lived in Japan for 7 years and the taste of the food and the feel of the restaurant is like being back in Japan.,2,have live japan year taste food feel restaurant be be back japan,VB VB NN NN NN NN NN NN VB VB RB NN,"['have/VB', 'live/VB', 'japan/NN', 'year/NN', 'taste/NN', 'food/NN', 'feel/NN', 'restaurant/NN', 'be/VB', 'be/VB', 'back/RB', 'japan/NN']"
The setting is casual and romantic.,2,setting be casual romantic,NN VB JJ JJ,"['setting/NN', 'be/VB', 'casual/JJ', 'romantic/JJ']"
"This place, which is only a few months old, is perhaps Queens' biggest secret!",2,place be only few month old be perhaps queen biggest secret,NN VB RB JJ NN JJ VB RB NN JJ VB,"['place/NN', 'be/VB', 'only/RB', 'few/JJ', 'month/NN', 'old/JJ', 'be/VB', 'perhaps/RB', 'queen/NN', 'biggest/JJ', 'secret/VB']"
This is my first time writing a review for a restaurant because the food and service was excellent.,2,be first time write review restaurant food service be excellent,VB JJ NN VB NN NN NN NN VB JJ,"['be/VB', 'first/JJ', 'time/NN', 'write/VB', 'review/NN', 'restaurant/NN', 'food/NN', 'service/NN', 'be/VB', 'excellent/JJ']"
I had a great experience.,2,have great experience,VB JJ NN,"['have/VB', 'great/JJ', 'experience/NN']"
Truly the mark of an attentive waiter.,2,truly mark attentive waiter,RB NN JJ NN,"['truly/RB', 'mark/NN', 'attentive/JJ', 'waiter/NN']"
Steamed fresh so brought hot hot hot to your table.,2,steam fresh so bring hot hot hot table,VB JJ RB VB JJ JJ JJ NN,"['steam/VB', 'fresh/JJ', 'so/RB', 'bring/VB', 'hot/JJ', 'hot/JJ', 'hot/JJ', 'table/NN']"
"Considering we were the last patrons there and it was after the closing time, the waitstaff did not rush us at all and made us feel comfortable and relaxed.",2,consider be last patron there be closing time waitstaff do not rush make feel comfortable relax,VB VB JJ NN RB VB JJ NN NN VB RB VB VB VB JJ VB,"['consider/VB', 'be/VB', 'last/JJ', 'patron/NN', 'there/RB', 'be/VB', 'closing/JJ', 'time/NN', 'waitstaff/NN', 'do/VB', 'not/RB', 'rush/VB', 'make/VB', 'feel/VB', 'comfortable/JJ', 'relax/VB']"
"Although the tables may be closely situated, the candle-light, food-quality and service overcompensate.",2,table be closely situate candle light food quality service overcompensate,NN VB RB VB NN JJ NN NN NN NN,"['table/NN', 'be/VB', 'closely/RB', 'situate/VB', 'candle/NN', 'light/JJ', 'food/NN', 'quality/NN', 'service/NN', 'overcompensate/NN']"
The server was really cool and served us our food and drinks with a smile.,2,server be really cool serve food drink smile,NN VB RB JJ VB NN NN NN,"['server/NN', 'be/VB', 'really/RB', 'cool/JJ', 'serve/VB', 'food/NN', 'drink/NN', 'smile/NN']"
This place is always very crowded and popular.,2,place be always very crowd popular,NN VB RB RB VB JJ,"['place/NN', 'be/VB', 'always/RB', 'very/RB', 'crowd/VB', 'popular/JJ']"
I got an excellent piece of cheesecake and we had several other nice pastries.,2,get excellent piece cheesecake have several other nice pastry,VB JJ NN NN VB JJ JJ JJ NN,"['get/VB', 'excellent/JJ', 'piece/NN', 'cheesecake/NN', 'have/VB', 'several/JJ', 'other/JJ', 'nice/JJ', 'pastry/NN']"
This place blew me away...by far my new favorite restaurant on the uppereast side.,2,place blow away far new favorite restaurant uppereast side,NN VB RB RB JJ JJ NN JJ NN,"['place/NN', 'blow/VB', 'away/RB', 'far/RB', 'new/JJ', 'favorite/JJ', 'restaurant/NN', 'uppereast/JJ', 'side/NN']"
It's simply the best meal in NYC.,2,simply best meal nyc,RB JJ NN NN,"['simply/RB', 'best/JJ', 'meal/NN', 'nyc/NN']"
"The food is good, especially their more basic dishes, and the drinks are delicious.",2,food be good especially more basic dish drink be delicious,NN VB JJ RB JJ JJ NN NN VB JJ,"['food/NN', 'be/VB', 'good/JJ', 'especially/RB', 'more/JJ', 'basic/JJ', 'dish/NN', 'drink/NN', 'be/VB', 'delicious/JJ']"
"(that is A MUST, but not every restaurant can do...) ",2,be not restaurant do,VB RB NN VB,"['be/VB', 'not/RB', 'restaurant/NN', 'do/VB']"
When I lived upstate for a while I would buy freeze the bagels and they would still be better than any else.,2,live upstate buy freeze bagel still be better else,VB JJ VB VB NN RB VB JJ RB,"['live/VB', 'upstate/JJ', 'buy/VB', 'freeze/VB', 'bagel/NN', 'still/RB', 'be/VB', 'better/JJ', 'else/RB']"
Best drumsticks over rice and sour spicy soup in town!,2,best drumstick rice sour spicy soup town,JJ NN NN JJ JJ NN NN,"['best/JJ', 'drumstick/NN', 'rice/NN', 'sour/JJ', 'spicy/JJ', 'soup/NN', 'town/NN']"
"When you're sitting in their main dining room (which has a spectacular, hand-painted high ceiling) you'd never know there was a world outside.",2,re sit main dining room have spectacular hand paint high ceiling never know be world outside,NN VB JJ NN NN VB JJ NN VB JJ NN RB VB VB NN NN,"['re/NN', 'sit/VB', 'main/JJ', 'dining/NN', 'room/NN', 'have/VB', 'spectacular/JJ', 'hand/NN', 'paint/VB', 'high/JJ', 'ceiling/NN', 'never/RB', 'know/VB', 'be/VB', 'world/NN', 'outside/NN']"
I recieved prompt service with a smile.,2,recieve prompt service smile,VB JJ NN NN,"['recieve/VB', 'prompt/JJ', 'service/NN', 'smile/NN']"
All the people that I bring there go back on their own and bring THEIR friends!,2,person bring there go back own bring friend,NN VB RB VB RB JJ VB NN,"['person/NN', 'bring/VB', 'there/RB', 'go/VB', 'back/RB', 'own/JJ', 'bring/VB', 'friend/NN']"
"It may be a bit packed on weekends, but the vibe is good and it is the best French food you will find in the area.",2,be bit pack weekend vibe be good be best french food find area,VB NN VB NN NN VB JJ VB JJ JJ NN VB NN,"['be/VB', 'bit/NN', 'pack/VB', 'weekend/NN', 'vibe/NN', 'be/VB', 'good/JJ', 'be/VB', 'best/JJ', 'french/JJ', 'food/NN', 'find/VB', 'area/NN']"
The sangria was pretty tasty and good on a hot muggy day.,2,sangria be pretty tasty good hot muggy day,NN VB JJ JJ JJ JJ JJ NN,"['sangria/NN', 'be/VB', 'pretty/JJ', 'tasty/JJ', 'good/JJ', 'hot/JJ', 'muggy/JJ', 'day/NN']"
"Great spot, whether looking for a couple of drinks or quiet dinner.",2,great spot look couple drink quiet dinner,JJ NN VB NN NN JJ NN,"['great/JJ', 'spot/NN', 'look/VB', 'couple/NN', 'drink/NN', 'quiet/JJ', 'dinner/NN']"
Love YUKA.,2,love yuka,VB RB,"['love/VB', 'yuka/RB']"
Winnie and her staff are the best crew you can find serving you.,2,winnie staff be best crew find serve,NN NN VB JJ NN VB VB,"['winnie/NN', 'staff/NN', 'be/VB', 'best/JJ', 'crew/NN', 'find/VB', 'serve/VB']"
The rice to fish ration was also good--they didn't try to overpack the rice.,2,rice fish ration be also good didn try overpack rice,NN VB NN VB RB JJ VB NN VB NN,"['rice/NN', 'fish/VB', 'ration/NN', 'be/VB', 'also/RB', 'good/JJ', 'didn/VB', 'try/NN', 'overpack/VB', 'rice/NN']"
We went around 9:30 on a Friday and it had died down a bit by then so the service was great!,2,go friday have die bit then service be great,VB NN VB VB NN RB NN VB JJ,"['go/VB', 'friday/NN', 'have/VB', 'die/VB', 'bit/NN', 'then/RB', 'service/NN', 'be/VB', 'great/JJ']"
Not the typical NYC gimmick theme restaurant.,2,not typical nyc gimmick theme restaurant,RB JJ NN NN NN NN,"['not/RB', 'typical/JJ', 'nyc/NN', 'gimmick/NN', 'theme/NN', 'restaurant/NN']"
We will return many times for this oasis in mid-town.,2,return many time oasis mid town,VB JJ NN NN JJ NN,"['return/VB', 'many/JJ', 'time/NN', 'oasis/NN', 'mid/JJ', 'town/NN']"
The owner and staff are all Japanese as well and that adds to the entire ambiance.,2,owner staff be japanese as well add entire ambiance,NN NN VB RB RB RB VB JJ NN,"['owner/NN', 'staff/NN', 'be/VB', 'japanese/RB', 'as/RB', 'well/RB', 'add/VB', 'entire/JJ', 'ambiance/NN']"
The staff there is very attentive and down to earth.,2,staff be very attentive down earth,NN VB RB JJ RB NN,"['staff/NN', 'be/VB', 'very/RB', 'attentive/JJ', 'down/RB', 'earth/NN']"
"The large selection of bruschettas, paninis, tramezzinis keep the palate from stagnating.",2,large selection bruschetta paninis tramezzinis keep palate stagnate,JJ NN NN NN NN VB NN VB,"['large/JJ', 'selection/NN', 'bruschetta/NN', 'paninis/NN', 'tramezzinis/NN', 'keep/VB', 'palate/NN', 'stagnate/VB']"
A classic!,2,classic,JJ,['classic/JJ']
"To be completely fair, the only redeeming factor was the food, which was above average, but couldn't make up for all the other deficiencies of Teodora.",2,be completely fair only redeeming factor be food be above average couldn make other deficiency teodora,VB RB JJ RB JJ NN VB NN VB JJ NN JJ VB JJ NN NN,"['be/VB', 'completely/RB', 'fair/JJ', 'only/RB', 'redeeming/JJ', 'factor/NN', 'be/VB', 'food/NN', 'be/VB', 'above/JJ', 'average/NN', 'couldn/JJ', 'make/VB', 'other/JJ', 'deficiency/NN', 'teodora/NN']"
"Cute place, nice wait staff but would never go there again.",2,cute place nice wait staff never go there again,JJ NN JJ NN NN RB VB RB RB,"['cute/JJ', 'place/NN', 'nice/JJ', 'wait/NN', 'staff/NN', 'never/RB', 'go/VB', 'there/RB', 'again/RB']"
Our family never expected such incredible entertainment in a restaurant.,2,family never expect such incredible entertainment restaurant,NN RB VB JJ JJ NN NN,"['family/NN', 'never/RB', 'expect/VB', 'such/JJ', 'incredible/JJ', 'entertainment/NN', 'restaurant/NN']"
The food is so cheap and the waiters are nice.,2,food be so cheap waiter be nice,NN VB RB JJ NN VB JJ,"['food/NN', 'be/VB', 'so/RB', 'cheap/JJ', 'waiter/NN', 'be/VB', 'nice/JJ']"
MMmmm... it was delicious.,2,mmmmm be delicious,NN VB JJ,"['mmmmm/NN', 'be/VB', 'delicious/JJ']"
love the food.,2,love food,VB NN,"['love/VB', 'food/NN']"
It hits the spot every time,2,hit spot time,VB NN NN,"['hit/VB', 'spot/NN', 'time/NN']"
This place has the best Chinese style BBQ ribs in the city.,2,place have best chinese style bbq rib city,NN VB JJ JJ NN NN NN NN,"['place/NN', 'have/VB', 'best/JJ', 'chinese/JJ', 'style/NN', 'bbq/NN', 'rib/NN', 'city/NN']"
"The food is good, I can't lie.",2,food be good lie,NN VB JJ VB,"['food/NN', 'be/VB', 'good/JJ', 'lie/VB']"
But that is highly forgivable.,2,be highly forgivable,VB RB JJ,"['be/VB', 'highly/RB', 'forgivable/JJ']"
Baluchi's has solid food and a nice decor at reasonable prices.,2,baluchi have solid food nice decor reasonable price,NN VB JJ NN JJ NN JJ NN,"['baluchi/NN', 'have/VB', 'solid/JJ', 'food/NN', 'nice/JJ', 'decor/NN', 'reasonable/JJ', 'price/NN']"
"Considering we were the last patrons there and it was after the closing time, the waitstaff did not rush us at all and made us feel comfortable and relaxed.",2,consider be last patron there be closing time waitstaff do not rush make feel comfortable relax,VB VB JJ NN RB VB JJ NN NN VB RB VB VB VB JJ VB,"['consider/VB', 'be/VB', 'last/JJ', 'patron/NN', 'there/RB', 'be/VB', 'closing/JJ', 'time/NN', 'waitstaff/NN', 'do/VB', 'not/RB', 'rush/VB', 'make/VB', 'feel/VB', 'comfortable/JJ', 'relax/VB']"
"The atmosphere is unheralded, the service impecible, and the food magnificant.",2,atmosphere be unheralded service impecible food magnificant,NN VB JJ NN JJ NN NN,"['atmosphere/NN', 'be/VB', 'unheralded/JJ', 'service/NN', 'impecible/JJ', 'food/NN', 'magnificant/NN']"
The food is prepared quickly and efficiently.,2,food be prepare quickly efficiently,NN VB VB RB RB,"['food/NN', 'be/VB', 'prepare/VB', 'quickly/RB', 'efficiently/RB']"
"i've been to sapphire twice and both times the food was fine, if not good.",2,have be sapphire twice time food be fine not good,VB VB VB RB NN NN VB JJ RB JJ,"['have/VB', 'be/VB', 'sapphire/VB', 'twice/RB', 'time/NN', 'food/NN', 'be/VB', 'fine/JJ', 'not/RB', 'good/JJ']"
Wine list selection is good and wine-by-the-glass was generously filled to the top.,2,wine list selection be good wine glass be generously fill top,NN NN NN VB JJ NN NN VB RB VB NN,"['wine/NN', 'list/NN', 'selection/NN', 'be/VB', 'good/JJ', 'wine/NN', 'glass/NN', 'be/VB', 'generously/RB', 'fill/VB', 'top/NN']"
One of my favorite places in Manhattan.,2,favorite place manhattan,JJ NN JJ,"['favorite/JJ', 'place/NN', 'manhattan/JJ']"
Downstairs lounge is always a good attraction,2,downstairs lounge be always good attraction,NN NN VB RB JJ NN,"['downstairs/NN', 'lounge/NN', 'be/VB', 'always/RB', 'good/JJ', 'attraction/NN']"
"I found it on a cold night, the perfect spot to warm up.",2,find cold night perfect spot warm,VB JJ NN JJ NN VB,"['find/VB', 'cold/JJ', 'night/NN', 'perfect/JJ', 'spot/NN', 'warm/VB']"
