sentence,sentiment,lem_words,lem_tags,word_tags
i would recommend reservations on weekends though.,1,recommend reservation weekend,VB NN NN,"['recommend/VB', 'reservation/NN', 'weekend/NN']"
"Food was okay, nothing great.",1,food be okay nothing great,NN VB JJ NN JJ,"['food/NN', 'be/VB', 'okay/JJ', 'nothing/NN', 'great/JJ']"
Have the iced tea.,1,have iced tea,VB JJ NN,"['have/VB', 'iced/JJ', 'tea/NN']"
I complete the total bagel experience by having it lightly toasted.,1,complete total bagel experience have lightly toast,NN JJ NN NN VB RB VB,"['complete/NN', 'total/JJ', 'bagel/NN', 'experience/NN', 'have/VB', 'lightly/RB', 'toast/VB']"
I'm sure I'll return for a final judgement tho.,1,sure ll return final judgement tho,JJ NN NN JJ NN NN,"['sure/JJ', 'll/NN', 'return/NN', 'final/JJ', 'judgement/NN', 'tho/NN']"
"For all you lazy folks that don't want to come to Alphabet City, I say, good - stay out.",1,lazy folk don want come alphabet city say good stay out,JJ NN VB VB VB NN NN VB JJ NN RB,"['lazy/JJ', 'folk/NN', 'don/VB', 'want/VB', 'come/VB', 'alphabet/NN', 'city/NN', 'say/VB', 'good/JJ', 'stay/NN', 'out/RB']"
I visit New Green Bo when I have money or when I am broke.,1,visit new green bo have money be break,NN JJ JJ NN VB NN VB VB,"['visit/NN', 'new/JJ', 'green/JJ', 'bo/NN', 'have/VB', 'money/NN', 'be/VB', 'break/VB']"
i don't usually order wine with indian so i can't comment on their wine list or their wines.,1,don usually order wine indian comment wine list wine,VB RB NN NN NN VB NN NN NN,"['don/VB', 'usually/RB', 'order/NN', 'wine/NN', 'indian/NN', 'comment/VB', 'wine/NN', 'list/NN', 'wine/NN']"
My friends and I were on vacation in NY and was referred to Chance by a friend.,1,friend be vacation ny be refer chance friend,NN VB NN NN VB VB NN NN,"['friend/NN', 'be/VB', 'vacation/NN', 'ny/NN', 'be/VB', 'refer/VB', 'chance/NN', 'friend/NN']"
"The decor in this place is very diner-ish and the kind of place you expect in the East Village - not romantic, just simple, small and sparse.",1,decor place be very diner ish kind place expect east village not romantic just simple small sparse,NN NN VB RB NN NN NN NN VB JJ NN RB JJ RB JJ JJ JJ,"['decor/NN', 'place/NN', 'be/VB', 'very/RB', 'diner/NN', 'ish/NN', 'kind/NN', 'place/NN', 'expect/VB', 'east/JJ', 'village/NN', 'not/RB', 'romantic/JJ', 'just/RB', 'simple/JJ', 'small/JJ', 'sparse/JJ']"
I lived in Maine for ten years and grew up on fish.,1,live maine year grow fish,VB NN NN VB NN,"['live/VB', 'maine/NN', 'year/NN', 'grow/VB', 'fish/NN']"
I have to agree with the previous reviewer.,1,have agree previous reviewer,VB VB JJ NN,"['have/VB', 'agree/VB', 'previous/JJ', 'reviewer/NN']"
"Recommendations, of course, are required!",1,recommendation course be require,NN NN VB VB,"['recommendation/NN', 'course/NN', 'be/VB', 'require/VB']"
Went to Cafe Spice with 4 of my friends on a saturday night.,1,go cafe spice friend saturday night,VB NN NN NN NN NN,"['go/VB', 'cafe/NN', 'spice/NN', 'friend/NN', 'saturday/NN', 'night/NN']"
"Compared to other shabu restaurants around town, this places wins hands-down.",1,compare other shabu restaurant town place win hand,VB JJ NN NN NN NN VB NN,"['compare/VB', 'other/JJ', 'shabu/NN', 'restaurant/NN', 'town/NN', 'place/NN', 'win/VB', 'hand/NN']"
Food was good not great not worth the wait or another visit,1,food be good not great not wait visit,NN VB JJ RB JJ RB NN NN,"['food/NN', 'be/VB', 'good/JJ', 'not/RB', 'great/JJ', 'not/RB', 'wait/NN', 'visit/NN']"
You fellas above says its the best Taiwanese restaurant in town.,1,fella say best restaurant town,NN VB JJ NN NN,"['fella/NN', 'say/VB', 'best/JJ', 'restaurant/NN', 'town/NN']"
"Anyways, if you're in the neighborhood to eat good food, I wouldn't waste my time trying to find something, rather go across the street to Tamari.",1,re neighborhood eat good food wouldn waste time try find something rather go street tamari,NN NN VB JJ NN VB VB NN VB VB NN RB VB NN VB,"['re/NN', 'neighborhood/NN', 'eat/VB', 'good/JJ', 'food/NN', 'wouldn/VB', 'waste/VB', 'time/NN', 'try/VB', 'find/VB', 'something/NN', 'rather/RB', 'go/VB', 'street/NN', 'tamari/VB']"
Was there Friday night.,1,be there friday night,VB RB JJ NN,"['be/VB', 'there/RB', 'friday/JJ', 'night/NN']"
It's popular w/the late crowd.,1,popular late crowd,JJ JJ NN,"['popular/JJ', 'late/JJ', 'crowd/NN']"
Went to Cafe Spice with 4 of my friends on a saturday night.,1,go cafe spice friend saturday night,VB NN NN NN NN NN,"['go/VB', 'cafe/NN', 'spice/NN', 'friend/NN', 'saturday/NN', 'night/NN']"
"My friends settled for rice dishes, but we came back the following day to try the dim sum, which was good...not outstanding, but good.",1,friend settle rice dish come back following day try dim sum be good not outstanding good,NN VB NN NN VB RB JJ NN VB JJ NN VB JJ RB JJ JJ,"['friend/NN', 'settle/VB', 'rice/NN', 'dish/NN', 'come/VB', 'back/RB', 'following/JJ', 'day/NN', 'try/VB', 'dim/JJ', 'sum/NN', 'be/VB', 'good/JJ', 'not/RB', 'outstanding/JJ', 'good/JJ']"
However it is the ONLY Taiwanese restaurant in town.,1,however be only taiwanese restaurant town,RB VB JJ JJ NN NN,"['however/RB', 'be/VB', 'only/JJ', 'taiwanese/JJ', 'restaurant/NN', 'town/NN']"
Visited there while on vacation and reading the reviews.,1,visit there vacation read reviews,VB RB NN VB NN,"['visit/VB', 'there/RB', 'vacation/NN', 'read/VB', 'reviews/NN']"
Price no more than a Jersey deli but way better.,1,price no more jersey deli way better,NN RB JJ NN NN NN RB,"['price/NN', 'no/RB', 'more/JJ', 'jersey/NN', 'deli/NN', 'way/NN', 'better/RB']"
"When I called this morning, I didn't think I would be able to get in at 12, but I was able to get in, along with four other guests.",1,call morning didn think be able get be able get other guest,VB NN VB VB VB JJ VB VB JJ VB JJ NN,"['call/VB', 'morning/NN', 'didn/VB', 'think/VB', 'be/VB', 'able/JJ', 'get/VB', 'be/VB', 'able/JJ', 'get/VB', 'other/JJ', 'guest/NN']"
Please be aware that it's CASH or AMEX only!,1,be aware cash amex only,VB JJ NN RB RB,"['be/VB', 'aware/JJ', 'cash/NN', 'amex/RB', 'only/RB']"
Went to Village last night for my birthday.,1,go village last night birthday,VB NN JJ NN NN,"['go/VB', 'village/NN', 'last/JJ', 'night/NN', 'birthday/NN']"
"My friends spoke so much about it for months, I finally made the time to come down ear and dine in.",1,friend speak so much month finally make time come ear dine,NN VB RB JJ NN RB VB NN VB NN VB,"['friend/NN', 'speak/VB', 'so/RB', 'much/JJ', 'month/NN', 'finally/RB', 'make/VB', 'time/NN', 'come/VB', 'ear/NN', 'dine/VB']"
"It costs $2 extra to turn a regular roll into an inside-out roll, but the roll more than triples in size, and that's not just from the rice.",1,cost extra turn regular roll inside roll roll more triple size not just rice,VB JJ VB JJ NN NN NN NN RB NN NN RB RB NN,"['cost/VB', 'extra/JJ', 'turn/VB', 'regular/JJ', 'roll/NN', 'inside/NN', 'roll/NN', 'roll/NN', 'more/RB', 'triple/NN', 'size/NN', 'not/RB', 'just/RB', 'rice/NN']"
"My friends settled for rice dishes, but we came back the following day to try the dim sum, which was good...not outstanding, but good.",1,friend settle rice dish come back following day try dim sum be good not outstanding good,NN VB NN NN VB RB JJ NN VB JJ NN VB JJ RB JJ JJ,"['friend/NN', 'settle/VB', 'rice/NN', 'dish/NN', 'come/VB', 'back/RB', 'following/JJ', 'day/NN', 'try/VB', 'dim/JJ', 'sum/NN', 'be/VB', 'good/JJ', 'not/RB', 'outstanding/JJ', 'good/JJ']"
The two star chefs left quite some time ago to open their own place.,1,star chef left quite time open own place,NN NN VB RB NN VB JJ NN,"['star/NN', 'chef/NN', 'left/VB', 'quite/RB', 'time/NN', 'open/VB', 'own/JJ', 'place/NN']"
I went there in late afternoon for some bite size food and refleshment with my date.,1,go there late afternoon bite size food refleshment date,VB RB JJ NN JJ NN NN NN NN,"['go/VB', 'there/RB', 'late/JJ', 'afternoon/NN', 'bite/JJ', 'size/NN', 'food/NN', 'refleshment/NN', 'date/NN']"
"Inside is a little cramped, but to be expected.",1,inside be little cramped be expect,NN VB JJ JJ VB VB,"['inside/NN', 'be/VB', 'little/JJ', 'cramped/JJ', 'be/VB', 'expect/VB']"
For dinner I had the chicken tikka-masala and some garlic naan.,1,dinner have chicken tikka masala garlic naan,NN VB NN NN NN NN RB,"['dinner/NN', 'have/VB', 'chicken/NN', 'tikka/NN', 'masala/NN', 'garlic/NN', 'naan/RB']"
Once for dinner and once for brunch.,1,once dinner once brunch,RB NN RB NN,"['once/RB', 'dinner/NN', 'once/RB', 'brunch/NN']"
I went there with my friend last saturday.,1,go there friend last saturday,VB RB NN JJ NN,"['go/VB', 'there/RB', 'friend/NN', 'last/JJ', 'saturday/NN']"
Will give it another chance before I write it off.,1,give chance,VB NN,"['give/VB', 'chance/NN']"
"A large is $20, and toppings are about $3 each.",1,large be topping be,JJ VB NN VB,"['large/JJ', 'be/VB', 'topping/NN', 'be/VB']"
He has visited Thailand and is quite expert on the cuisine.,1,have visit thailand be quite expert cuisine,VB VB NN VB RB VB NN,"['have/VB', 'visit/VB', 'thailand/NN', 'be/VB', 'quite/RB', 'expert/VB', 'cuisine/NN']"
"Still, any quibbles about the bill were off-set by the pour-your-own measures of liquers which were courtesey of the house...",1,still quibble bill be off set pour own measure liquer be courtesey house,RB NN NN VB RB NN NN JJ NN NN VB NN NN,"['still/RB', 'quibble/NN', 'bill/NN', 'be/VB', 'off/RB', 'set/NN', 'pour/NN', 'own/JJ', 'measure/NN', 'liquer/NN', 'be/VB', 'courtesey/NN', 'house/NN']"
Have the iced tea.,1,have iced tea,VB JJ NN,"['have/VB', 'iced/JJ', 'tea/NN']"
"I have never eaten in the restaurant, however, upon reading the reviews I got take out last week.",1,have never eat restaurant however read reviews get take last week,VB RB VB NN RB VB NN VB NN JJ NN,"['have/VB', 'never/RB', 'eat/VB', 'restaurant/NN', 'however/RB', 'read/VB', 'reviews/NN', 'get/VB', 'take/NN', 'last/JJ', 'week/NN']"
the food is decent.,1,food be decent,NN VB JJ,"['food/NN', 'be/VB', 'decent/JJ']"
"From the street it looks very hidden, and is actually an old warehouse.",1,street look very hidden be actually old warehouse,NN VB RB JJ VB RB JJ NN,"['street/NN', 'look/VB', 'very/RB', 'hidden/JJ', 'be/VB', 'actually/RB', 'old/JJ', 'warehouse/NN']"
"My friends spoke so much about it for months, I finally made the time to come down ear and dine in.",1,friend speak so much month finally make time come ear dine,NN VB RB JJ NN RB VB NN VB NN VB,"['friend/NN', 'speak/VB', 'so/RB', 'much/JJ', 'month/NN', 'finally/RB', 'make/VB', 'time/NN', 'come/VB', 'ear/NN', 'dine/VB']"
"Better than the bagel shop on the corner, but not worth going out of your way for, in my opinion.",1,better bagel shop corner not worth go way opinion,JJ NN NN JJ RB JJ VB NN NN,"['better/JJ', 'bagel/NN', 'shop/NN', 'corner/JJ', 'not/RB', 'worth/JJ', 'go/VB', 'way/NN', 'opinion/NN']"
Even the pasta is delicious here (a rarity in New York pizza restaurants).,1,even pasta be delicious here rarity new york pizza restaurant,RB NN VB JJ RB NN NN NN NN NN,"['even/RB', 'pasta/NN', 'be/VB', 'delicious/JJ', 'here/RB', 'rarity/NN', 'new/NN', 'york/NN', 'pizza/NN', 'restaurant/NN']"
Just ignore the trendy wannabes.,1,just ignore trendy wannabe,RB VB JJ NN,"['just/RB', 'ignore/VB', 'trendy/JJ', 'wannabe/NN']"
Molto bene!,1,molto bene,NN NN,"['molto/NN', 'bene/NN']"
You can't say its cheap because food is cheaper in Chinatown.,1,say cheap food be cheaper chinatown,VB JJ NN VB JJ JJ,"['say/VB', 'cheap/JJ', 'food/NN', 'be/VB', 'cheaper/JJ', 'chinatown/JJ']"
"Inside is a little cramped, but to be expected.",1,inside be little cramped be expect,NN VB JJ JJ VB VB,"['inside/NN', 'be/VB', 'little/JJ', 'cramped/JJ', 'be/VB', 'expect/VB']"
Everything we had was good or ok....but definitely nothing great.,1,everything have be good definitely nothing great,NN VB VB JJ RB NN JJ,"['everything/NN', 'have/VB', 'be/VB', 'good/JJ', 'definitely/RB', 'nothing/NN', 'great/JJ']"
(1) turnip cakes at the little kiosk on east side of Mott St. just south of bayard,1,turnip cake little kiosk east side mott st just south bayard,NN NN JJ NN JJ NN JJ NN RB RB NN,"['turnip/NN', 'cake/NN', 'little/JJ', 'kiosk/NN', 'east/JJ', 'side/NN', 'mott/JJ', 'st/NN', 'just/RB', 'south/RB', 'bayard/NN']"
My girlfiends and I ate at O.G. again last night.,1,girlfiend eat again last night,NN VB RB JJ NN,"['girlfiend/NN', 'eat/VB', 'again/RB', 'last/JJ', 'night/NN']"
"Of course, it is crowded but who cares.",1,course be crowd care,NN VB VB VB,"['course/NN', 'be/VB', 'crowd/VB', 'care/VB']"
"The service was attentive, yet unimposing, the food was far better than many notorious restaurants in Midtown and the wine list is extensive and well priced.",1,service be attentive yet unimposing food be far better many notorious restaurant midtown wine list be extensive well price,NN VB JJ RB JJ NN VB RB JJ JJ JJ NN NN NN NN VB JJ RB VB,"['service/NN', 'be/VB', 'attentive/JJ', 'yet/RB', 'unimposing/JJ', 'food/NN', 'be/VB', 'far/RB', 'better/JJ', 'many/JJ', 'notorious/JJ', 'restaurant/NN', 'midtown/NN', 'wine/NN', 'list/NN', 'be/VB', 'extensive/JJ', 'well/RB', 'price/VB']"
"It costs $2 extra to turn a regular roll into an inside-out roll, but the roll more than triples in size, and that's not just from the rice.",1,cost extra turn regular roll inside roll roll more triple size not just rice,VB JJ VB JJ NN NN NN NN RB NN NN RB RB NN,"['cost/VB', 'extra/JJ', 'turn/VB', 'regular/JJ', 'roll/NN', 'inside/NN', 'roll/NN', 'roll/NN', 'more/RB', 'triple/NN', 'size/NN', 'not/RB', 'just/RB', 'rice/NN']"
I'm sure I'll return for a final judgement tho.,1,sure ll return final judgement tho,JJ NN NN JJ NN NN,"['sure/JJ', 'll/NN', 'return/NN', 'final/JJ', 'judgement/NN', 'tho/NN']"
"When I called this morning, I didn't think I would be able to get in at 12, but I was able to get in, along with four other guests.",1,call morning didn think be able get be able get other guest,VB NN VB VB VB JJ VB VB JJ VB JJ NN,"['call/VB', 'morning/NN', 'didn/VB', 'think/VB', 'be/VB', 'able/JJ', 'get/VB', 'be/VB', 'able/JJ', 'get/VB', 'other/JJ', 'guest/NN']"
"I had my eyes on this place, promising myself I will one day 'give it a try.' ",1,have eye place promise day give try,VB NN NN VB NN VB NN,"['have/VB', 'eye/NN', 'place/NN', 'promise/VB', 'day/NN', 'give/VB', 'try/NN']"
"i have eaten here a handful of times, for no reason besides sheer convenience.",1,have eat here handful time reason sheer convenience,VB VB RB NN NN NN NN NN,"['have/VB', 'eat/VB', 'here/RB', 'handful/NN', 'time/NN', 'reason/NN', 'sheer/NN', 'convenience/NN']"
I've eaten at many different Indian restaurants.,1,have eat many different indian restaurant,VB VB JJ JJ JJ NN,"['have/VB', 'eat/VB', 'many/JJ', 'different/JJ', 'indian/JJ', 'restaurant/NN']"
I had Filet Mignon with garlic mash.,1,have filet mignon garlic mash,VB NN NN NN NN,"['have/VB', 'filet/NN', 'mignon/NN', 'garlic/NN', 'mash/NN']"
What's the difference between the two?,1,difference,NN,['difference/NN']
I know because I live nearby.,1,know live nearby,RB JJ NN,"['know/RB', 'live/JJ', 'nearby/NN']"
"When I'm feeling stressed by the noise and congestion around my office, I head for Cafe St. Bart's.",1,feeling stress noise congestion office head cafe st bart,NN VB NN NN NN NN NN NN NN,"['feeling/NN', 'stress/VB', 'noise/NN', 'congestion/NN', 'office/NN', 'head/NN', 'cafe/NN', 'st/NN', 'bart/NN']"
For dinner I had the chicken tikka-masala and some garlic naan.,1,dinner have chicken tikka masala garlic naan,NN VB NN NN NN NN RB,"['dinner/NN', 'have/VB', 'chicken/NN', 'tikka/NN', 'masala/NN', 'garlic/NN', 'naan/RB']"
"Food was okay, nothing great.",1,food be okay nothing great,NN VB JJ NN JJ,"['food/NN', 'be/VB', 'okay/JJ', 'nothing/NN', 'great/JJ']"
A little noise but I think that was because of our party!,1,little noise think be party,JJ NN VB VB NN,"['little/JJ', 'noise/NN', 'think/VB', 'be/VB', 'party/NN']"
Also a little more expensive than your average bagel place.,1,also little more expensive average bagel place,RB JJ RB JJ JJ NN NN,"['also/RB', 'little/JJ', 'more/RB', 'expensive/JJ', 'average/JJ', 'bagel/NN', 'place/NN']"
They are opening two more places as i saw a flyer there one in Yonkers which is a restraunt and banquet hall and another one in parsipanny new jersey.,1,be open more place see flyer there yonker be restraunt banquet hall one parsipanny new jersey,VB VB JJ NN VB NN RB NN VB NN NN NN NN JJ JJ NN,"['be/VB', 'open/VB', 'more/JJ', 'place/NN', 'see/VB', 'flyer/NN', 'there/RB', 'yonker/NN', 'be/VB', 'restraunt/NN', 'banquet/NN', 'hall/NN', 'one/NN', 'parsipanny/JJ', 'new/JJ', 'jersey/NN']"
"Downtown Dinner 2002 - Prixe fix: Appetizers were ok, waiter gave me poor suggestion..try the potato stuff kanish best one.",1,downtown dinner fix appetizer be waiter give poor suggestion try potato stuff kanish best,JJ NN VB NN VB NN VB JJ NN VB NN NN VB RB,"['downtown/JJ', 'dinner/NN', 'fix/VB', 'appetizer/NN', 'be/VB', 'waiter/NN', 'give/VB', 'poor/JJ', 'suggestion/NN', 'try/VB', 'potato/NN', 'stuff/NN', 'kanish/VB', 'best/RB']"
(1) turnip cakes at the little kiosk on east side of Mott St. just south of bayard,1,turnip cake little kiosk east side mott st just south bayard,NN NN JJ NN JJ NN JJ NN RB RB NN,"['turnip/NN', 'cake/NN', 'little/JJ', 'kiosk/NN', 'east/JJ', 'side/NN', 'mott/JJ', 'st/NN', 'just/RB', 'south/RB', 'bayard/NN']"
A little noise but I think that was because of our party!,1,little noise think be party,JJ NN VB VB NN,"['little/JJ', 'noise/NN', 'think/VB', 'be/VB', 'party/NN']"
"A large is $20, and toppings are about $3 each.",1,large be topping be,JJ VB NN VB,"['large/JJ', 'be/VB', 'topping/NN', 'be/VB']"
"However, if you want great food at a great price and don't mind the decor, you can't beat this place.",1,however want great food great price don mind decor beat place,RB VB JJ NN JJ NN VB VB NN NN NN,"['however/RB', 'want/VB', 'great/JJ', 'food/NN', 'great/JJ', 'price/NN', 'don/VB', 'mind/VB', 'decor/NN', 'beat/NN', 'place/NN']"
"Compared to Ess-a, Tal offers a less doughy bagel!",1,compare es tal offer less doughy bagel,VB VB NN NN JJ JJ NN,"['compare/VB', 'es/VB', 'tal/NN', 'offer/NN', 'less/JJ', 'doughy/JJ', 'bagel/NN']"
Went to Cafe Spice with 4 of my friends on a saturday night.,1,go cafe spice friend saturday night,VB NN NN NN NN NN,"['go/VB', 'cafe/NN', 'spice/NN', 'friend/NN', 'saturday/NN', 'night/NN']"
I have eaten a lot of pizza here.,1,have eat lot pizza here,VB VB NN NN RB,"['have/VB', 'eat/VB', 'lot/NN', 'pizza/NN', 'here/RB']"
"Of course, it is crowded but who cares.",1,course be crowd care,NN VB VB VB,"['course/NN', 'be/VB', 'crowd/VB', 'care/VB']"
Service is average.,1,service be average,NN VB JJ,"['service/NN', 'be/VB', 'average/JJ']"
As a student in NYU i need a place to eat after a hard day of work so usually i just go to any indian restraunt near by. ,1,student nyu need place eat hard day work so usually just go indian restraunt,NN NN VB NN VB JJ NN NN RB RB RB VB JJ NN,"['student/NN', 'nyu/NN', 'need/VB', 'place/NN', 'eat/VB', 'hard/JJ', 'day/NN', 'work/NN', 'so/RB', 'usually/RB', 'just/RB', 'go/VB', 'indian/JJ', 'restraunt/NN']"
I complete the total bagel experience by having it lightly toasted.,1,complete total bagel experience have lightly toast,NN JJ NN NN VB RB VB,"['complete/NN', 'total/JJ', 'bagel/NN', 'experience/NN', 'have/VB', 'lightly/RB', 'toast/VB']"
"Great bagels, spreads and a good place to hang out in.",1,great bagel spread good place hang,JJ NN NN JJ NN VB,"['great/JJ', 'bagel/NN', 'spread/NN', 'good/JJ', 'place/NN', 'hang/VB']"
After passing by this restaurant for sometime I finally decided to go in and have dinner.,1,pass restaurant sometime finally decide go have dinner,VB NN RB RB VB VB VB NN,"['pass/VB', 'restaurant/NN', 'sometime/RB', 'finally/RB', 'decide/VB', 'go/VB', 'have/VB', 'dinner/NN']"
We visited Orsay during NY Restaurant Week and tried their $35 menu.,1,visit orsay ny restaurant week try menu,VB JJ JJ NN NN VB NN,"['visit/VB', 'orsay/JJ', 'ny/JJ', 'restaurant/NN', 'week/NN', 'try/VB', 'menu/NN']"
I had Filet Mignon with garlic mash.,1,have filet mignon garlic mash,VB NN NN NN NN,"['have/VB', 'filet/NN', 'mignon/NN', 'garlic/NN', 'mash/NN']"
"Inside is a little cramped, but to be expected.",1,inside be little cramped be expect,NN VB JJ JJ VB VB,"['inside/NN', 'be/VB', 'little/JJ', 'cramped/JJ', 'be/VB', 'expect/VB']"
"Having hunted around for a quiet, romantic, yet not hideously expensive restaurant I stumbled across reviews for La Lanterna and gave it a shot.",1,have hunt quiet romantic yet not hideously expensive restaurant stumble reviews la lanterna give shot,VB VB JJ JJ RB RB RB JJ NN VB NN NN NN VB NN,"['have/VB', 'hunt/VB', 'quiet/JJ', 'romantic/JJ', 'yet/RB', 'not/RB', 'hideously/RB', 'expensive/JJ', 'restaurant/NN', 'stumble/VB', 'reviews/NN', 'la/NN', 'lanterna/NN', 'give/VB', 'shot/NN']"
Kind of a small place but I guess if they are not too busy might be able to fit a group or kids.,1,kind small place guess be not too busy be able fit group kid,NN JJ NN NN VB RB RB JJ VB JJ VB NN NN,"['kind/NN', 'small/JJ', 'place/NN', 'guess/NN', 'be/VB', 'not/RB', 'too/RB', 'busy/JJ', 'be/VB', 'able/JJ', 'fit/VB', 'group/NN', 'kid/NN']"
"Still, any quibbles about the bill were off-set by the pour-your-own measures of liquers which were courtesey of the house...",1,still quibble bill be off set pour own measure liquer be courtesey house,RB NN NN VB RB NN NN JJ NN NN VB NN NN,"['still/RB', 'quibble/NN', 'bill/NN', 'be/VB', 'off/RB', 'set/NN', 'pour/NN', 'own/JJ', 'measure/NN', 'liquer/NN', 'be/VB', 'courtesey/NN', 'house/NN']"
We had Lava Cake... we ordered when our food came it takes at least a 1/2 to make it. ,1,have lava cake order food come take least make,VB NN NN VB NN VB VB JJ VB,"['have/VB', 'lava/NN', 'cake/NN', 'order/VB', 'food/NN', 'come/VB', 'take/VB', 'least/JJ', 'make/VB']"
"You'll pay at least double at any other Italian restaurant in the city, and most still don't compare.",1,ll pay least double other italian restaurant city most still don compare,VB NN JJ JJ JJ JJ NN NN RB RB VB VB,"['ll/VB', 'pay/NN', 'least/JJ', 'double/JJ', 'other/JJ', 'italian/JJ', 'restaurant/NN', 'city/NN', 'most/RB', 'still/RB', 'don/VB', 'compare/VB']"
Sit outside in the warm weather; inside for cozy winter.,1,sit outside warm weather inside cozy winter,NN NN JJ NN NN JJ NN,"['sit/NN', 'outside/NN', 'warm/JJ', 'weather/NN', 'inside/NN', 'cozy/JJ', 'winter/NN']"
Visited there while on vacation and reading the reviews.,1,visit there vacation read reviews,VB RB NN VB NN,"['visit/VB', 'there/RB', 'vacation/NN', 'read/VB', 'reviews/NN']"
"Still, any quibbles about the bill were off-set by the pour-your-own measures of liquers which were courtesey of the house...",1,still quibble bill be off set pour own measure liquer be courtesey house,RB NN NN VB RB NN NN JJ NN NN VB NN NN,"['still/RB', 'quibble/NN', 'bill/NN', 'be/VB', 'off/RB', 'set/NN', 'pour/NN', 'own/JJ', 'measure/NN', 'liquer/NN', 'be/VB', 'courtesey/NN', 'house/NN']"
i would just ask for no oil next time.,1,just ask oil next time,RB VB NN JJ NN,"['just/RB', 'ask/VB', 'oil/NN', 'next/JJ', 'time/NN']"
"If only they delivered, they'd make a mint!",1,only deliver make mint,RB VB VB NN,"['only/RB', 'deliver/VB', 'make/VB', 'mint/NN']"
What's the difference between the two?,1,difference,NN,['difference/NN']
"Service is not exactly five star, but thats not really a big deal.",1,service be not exactly star that not really big deal,NN VB RB RB NN VB RB RB JJ NN,"['service/NN', 'be/VB', 'not/RB', 'exactly/RB', 'star/NN', 'that/VB', 'not/RB', 'really/RB', 'big/JJ', 'deal/NN']"
Food was good not great not worth the wait or another visit,1,food be good not great not wait visit,NN VB JJ RB JJ RB NN NN,"['food/NN', 'be/VB', 'good/JJ', 'not/RB', 'great/JJ', 'not/RB', 'wait/NN', 'visit/NN']"
I came into the city to try out this restaurant because a friend had recommended it to my husband.,1,come city try out restaurant friend have recommend husband,VB NN VB RB NN NN VB VB NN,"['come/VB', 'city/NN', 'try/VB', 'out/RB', 'restaurant/NN', 'friend/NN', 'have/VB', 'recommend/VB', 'husband/NN']"
"It costs $2 extra to turn a regular roll into an inside-out roll, but the roll more than triples in size, and that's not just from the rice.",1,cost extra turn regular roll inside roll roll more triple size not just rice,VB JJ VB JJ NN NN NN NN RB NN NN RB RB NN,"['cost/VB', 'extra/JJ', 'turn/VB', 'regular/JJ', 'roll/NN', 'inside/NN', 'roll/NN', 'roll/NN', 'more/RB', 'triple/NN', 'size/NN', 'not/RB', 'just/RB', 'rice/NN']"
I asked the chef what he recommends and he asked me if I like Uni. (,1,ask chef recommend ask uni,VB NN VB VB JJ,"['ask/VB', 'chef/NN', 'recommend/VB', 'ask/VB', 'uni/JJ']"
"However, go for the ambience, and consider the food just a companion for a trip across the world!",1,however go ambience consider food just companion trip world,RB VB NN VB NN RB NN NN NN,"['however/RB', 'go/VB', 'ambience/NN', 'consider/VB', 'food/NN', 'just/RB', 'companion/NN', 'trip/NN', 'world/NN']"
"My husband and I both ordered the Steak, medium.",1,husband order steak medium,NN VB NN NN,"['husband/NN', 'order/VB', 'steak/NN', 'medium/NN']"
"Yeah the crowd can take it a bit seriously, but it shouldn't.",1,crowd take bit seriously shouldn,NN VB NN RB VB,"['crowd/NN', 'take/VB', 'bit/NN', 'seriously/RB', 'shouldn/VB']"
Everything we had was good or ok....but definitely nothing great.,1,everything have be good definitely nothing great,NN VB VB JJ RB NN JJ,"['everything/NN', 'have/VB', 'be/VB', 'good/JJ', 'definitely/RB', 'nothing/NN', 'great/JJ']"
sometimes i get good food and ok service.,1,sometimes get good food service,RB VB JJ NN NN,"['sometimes/RB', 'get/VB', 'good/JJ', 'food/NN', 'service/NN']"
really depends on your luck!,1,really depend luck,RB VB NN,"['really/RB', 'depend/VB', 'luck/NN']"
