sentence,sentiment,lem_words,lem_tags,word_tags
"Having hunted around for a quiet, romantic, yet not hideously expensive restaurant I stumbled across reviews for La Lanterna and gave it a shot.",1,have hunt quiet romantic yet not hideously expensive restaurant stumble reviews la lanterna give shot,VB VB JJ JJ RB RB RB JJ NN VB NN NN NN VB NN,"['have/VB', 'hunt/VB', 'quiet/JJ', 'romantic/JJ', 'yet/RB', 'not/RB', 'hideously/RB', 'expensive/JJ', 'restaurant/NN', 'stumble/VB', 'reviews/NN', 'la/NN', 'lanterna/NN', 'give/VB', 'shot/NN']"
Arigato Gozimas Yuka!,1,arigato gozimas yuka,NN NN NN,"['arigato/NN', 'gozimas/NN', 'yuka/NN']"
I went there in late afternoon for some bite size food and refleshment with my date.,1,go there late afternoon bite size food refleshment date,VB RB JJ NN JJ NN NN NN NN,"['go/VB', 'there/RB', 'late/JJ', 'afternoon/NN', 'bite/JJ', 'size/NN', 'food/NN', 'refleshment/NN', 'date/NN']"
"It costs $2 extra to turn a regular roll into an inside-out roll, but the roll more than triples in size, and that's not just from the rice.",1,cost extra turn regular roll inside roll roll more triple size not just rice,VB JJ VB JJ NN NN NN NN RB NN NN RB RB NN,"['cost/VB', 'extra/JJ', 'turn/VB', 'regular/JJ', 'roll/NN', 'inside/NN', 'roll/NN', 'roll/NN', 'more/RB', 'triple/NN', 'size/NN', 'not/RB', 'just/RB', 'rice/NN']"
Amma is nothing special.,1,amma be nothing special,NN VB NN JJ,"['amma/NN', 'be/VB', 'nothing/NN', 'special/JJ']"
We got a little tipsy from the sake but isn't that what Saturday nights with the girlfriends are all about?,1,get little tipsy sake isn saturday night girlfriend be about,VB JJ JJ NN JJ NN NN NN VB RB,"['get/VB', 'little/JJ', 'tipsy/JJ', 'sake/NN', 'isn/JJ', 'saturday/NN', 'night/NN', 'girlfriend/NN', 'be/VB', 'about/RB']"
I have eaten a lot of pizza here.,1,have eat lot pizza here,VB VB NN NN RB,"['have/VB', 'eat/VB', 'lot/NN', 'pizza/NN', 'here/RB']"
I went there with my friend last saturday.,1,go there friend last saturday,VB RB NN JJ NN,"['go/VB', 'there/RB', 'friend/NN', 'last/JJ', 'saturday/NN']"
Please be aware that it's CASH or AMEX only!,1,be aware cash amex only,VB JJ NN RB RB,"['be/VB', 'aware/JJ', 'cash/NN', 'amex/RB', 'only/RB']"
I haven't been to the other locations.,1,haven be other location,NN VB JJ NN,"['haven/NN', 'be/VB', 'other/JJ', 'location/NN']"
Price no more than a Jersey deli but way better.,1,price no more jersey deli way better,NN RB JJ NN NN NN RB,"['price/NN', 'no/RB', 'more/JJ', 'jersey/NN', 'deli/NN', 'way/NN', 'better/RB']"
I love Indian food and consider myself to be quite an expert on it.,1,love indian food consider be quite expert,NN JJ NN VB VB RB NN,"['love/NN', 'indian/JJ', 'food/NN', 'consider/VB', 'be/VB', 'quite/RB', 'expert/NN']"
Sit outside in the warm weather; inside for cozy winter.,1,sit outside warm weather inside cozy winter,NN NN JJ NN NN JJ NN,"['sit/NN', 'outside/NN', 'warm/JJ', 'weather/NN', 'inside/NN', 'cozy/JJ', 'winter/NN']"
"those rolls were big, but not good and sashimi wasn't fresh.",1,roll be big not good sashimi wasn fresh,NN VB JJ RB JJ NN VB JJ,"['roll/NN', 'be/VB', 'big/JJ', 'not/RB', 'good/JJ', 'sashimi/NN', 'wasn/VB', 'fresh/JJ']"
I think the stuff was better than Disney.,1,think stuff be better disney,VB NN VB RB NN,"['think/VB', 'stuff/NN', 'be/VB', 'better/RB', 'disney/NN']"
I thought going to Jimmys would give me a real Domincan exprience.,1,think go jimmy give real domincan exprience,VB VB NN VB JJ NN NN,"['think/VB', 'go/VB', 'jimmy/NN', 'give/VB', 'real/JJ', 'domincan/NN', 'exprience/NN']"
"The menu consisted of standard brassiere food, better then places like Balthazar etc.",1,menu consist standard brassiere food better then place balthazar etc,NN VB JJ NN NN RB RB VB NN NN,"['menu/NN', 'consist/VB', 'standard/JJ', 'brassiere/NN', 'food/NN', 'better/RB', 'then/RB', 'place/VB', 'balthazar/NN', 'etc/NN']"
"With the exception of our lemon salad that had so much pepper on it that our eyes started watering, the food here was decent, not great.",1,exception lemon salad have so much pepper eye start food here be decent not great,NN NN NN VB RB JJ NN NN VB NN RB VB JJ RB JJ,"['exception/NN', 'lemon/NN', 'salad/NN', 'have/VB', 'so/RB', 'much/JJ', 'pepper/NN', 'eye/NN', 'start/VB', 'food/NN', 'here/RB', 'be/VB', 'decent/JJ', 'not/RB', 'great/JJ']"
"That place was awesome,,,  sally !",1,place be awesome sally,NN VB JJ VB,"['place/NN', 'be/VB', 'awesome/JJ', 'sally/VB']"
"Being serious sushi lovers, we sat at the sushi bar to be closer to the action.",1,be serious sushi lover sit sushi bar be closer action,VB JJ NN NN VB NN NN VB JJ NN,"['be/VB', 'serious/JJ', 'sushi/NN', 'lover/NN', 'sit/VB', 'sushi/NN', 'bar/NN', 'be/VB', 'closer/JJ', 'action/NN']"
I lived in Maine for ten years and grew up on fish.,1,live maine year grow fish,VB NN NN VB NN,"['live/VB', 'maine/NN', 'year/NN', 'grow/VB', 'fish/NN']"
Kind of a small place but I guess if they are not too busy might be able to fit a group or kids.,1,kind small place guess be not too busy be able fit group kid,NN JJ NN NN VB RB RB JJ VB JJ VB NN NN,"['kind/NN', 'small/JJ', 'place/NN', 'guess/NN', 'be/VB', 'not/RB', 'too/RB', 'busy/JJ', 'be/VB', 'able/JJ', 'fit/VB', 'group/NN', 'kid/NN']"
"I love Ess-a-bagel, but I live on the west side, so I often go to Murray's for convenience.",1,love ess bagel live west side often go murray convenience,NN RB NN VB JJ NN RB VB VB NN,"['love/NN', 'ess/RB', 'bagel/NN', 'live/VB', 'west/JJ', 'side/NN', 'often/RB', 'go/VB', 'murray/VB', 'convenience/NN']"
"Better than the bagel shop on the corner, but not worth going out of your way for, in my opinion.",1,better bagel shop corner not worth go way opinion,JJ NN NN JJ RB JJ VB NN NN,"['better/JJ', 'bagel/NN', 'shop/NN', 'corner/JJ', 'not/RB', 'worth/JJ', 'go/VB', 'way/NN', 'opinion/NN']"
"Downtown Dinner 2002 - Prixe fix: Appetizers were ok, waiter gave me poor suggestion..try the potato stuff kanish best one.",1,downtown dinner fix appetizer be waiter give poor suggestion try potato stuff kanish best,JJ NN VB NN VB NN VB JJ NN VB NN NN VB RB,"['downtown/JJ', 'dinner/NN', 'fix/VB', 'appetizer/NN', 'be/VB', 'waiter/NN', 'give/VB', 'poor/JJ', 'suggestion/NN', 'try/VB', 'potato/NN', 'stuff/NN', 'kanish/VB', 'best/RB']"
I had Filet Mignon with garlic mash.,1,have filet mignon garlic mash,VB NN NN NN NN,"['have/VB', 'filet/NN', 'mignon/NN', 'garlic/NN', 'mash/NN']"
My friends and I were on vacation in NY and was referred to Chance by a friend.,1,friend be vacation ny be refer chance friend,NN VB NN NN VB VB NN NN,"['friend/NN', 'be/VB', 'vacation/NN', 'ny/NN', 'be/VB', 'refer/VB', 'chance/NN', 'friend/NN']"
"Compared to Ess-a, Tal offers a less doughy bagel!",1,compare es tal offer less doughy bagel,VB VB NN NN JJ JJ NN,"['compare/VB', 'es/VB', 'tal/NN', 'offer/NN', 'less/JJ', 'doughy/JJ', 'bagel/NN']"
Stuffing yourself with Japanese food is a rare thing.,1,stuff japanese food be rare thing,VB JJ NN VB JJ NN,"['stuff/VB', 'japanese/JJ', 'food/NN', 'be/VB', 'rare/JJ', 'thing/NN']"
"Service is not exactly five star, but thats not really a big deal.",1,service be not exactly star that not really big deal,NN VB RB RB NN VB RB RB JJ NN,"['service/NN', 'be/VB', 'not/RB', 'exactly/RB', 'star/NN', 'that/VB', 'not/RB', 'really/RB', 'big/JJ', 'deal/NN']"
"those rolls were big, but not good and sashimi wasn't fresh.",1,roll be big not good sashimi wasn fresh,NN VB JJ RB JJ NN VB JJ,"['roll/NN', 'be/VB', 'big/JJ', 'not/RB', 'good/JJ', 'sashimi/NN', 'wasn/VB', 'fresh/JJ']"
Arigato Gozimas Yuka!,1,arigato gozimas yuka,NN NN NN,"['arigato/NN', 'gozimas/NN', 'yuka/NN']"
"Compared to other shabu restaurants around town, this places wins hands-down.",1,compare other shabu restaurant town place win hand,VB JJ NN NN NN NN VB NN,"['compare/VB', 'other/JJ', 'shabu/NN', 'restaurant/NN', 'town/NN', 'place/NN', 'win/VB', 'hand/NN']"
"While it's not Nobu, it sure is a great deal and you definitely will leave feeling satisfied and full.",1,not nobu sure be great deal definitely leave feeling satisfy full,RB JJ RB VB JJ NN RB VB NN VB JJ,"['not/RB', 'nobu/JJ', 'sure/RB', 'be/VB', 'great/JJ', 'deal/NN', 'definitely/RB', 'leave/VB', 'feeling/NN', 'satisfy/VB', 'full/JJ']"
"You'll pay at least double at any other Italian restaurant in the city, and most still don't compare.",1,ll pay least double other italian restaurant city most still don compare,VB NN JJ JJ JJ JJ NN NN RB RB VB VB,"['ll/VB', 'pay/NN', 'least/JJ', 'double/JJ', 'other/JJ', 'italian/JJ', 'restaurant/NN', 'city/NN', 'most/RB', 'still/RB', 'don/VB', 'compare/VB']"
esp. during happy hour!,1,esp happy hour,NN JJ NN,"['esp/NN', 'happy/JJ', 'hour/NN']"
I love Indian food and consider myself to be quite an expert on it.,1,love indian food consider be quite expert,NN JJ NN VB VB RB NN,"['love/NN', 'indian/JJ', 'food/NN', 'consider/VB', 'be/VB', 'quite/RB', 'expert/NN']"
Once for dinner and once for brunch.,1,once dinner once brunch,RB NN RB NN,"['once/RB', 'dinner/NN', 'once/RB', 'brunch/NN']"
enough said!,1,enough say,RB VB,"['enough/RB', 'say/VB']"
We got most of it back at home with us.,1,get most back home,VB JJ RB NN,"['get/VB', 'most/JJ', 'back/RB', 'home/NN']"
I have eaten at many pizza places around NYC and this is hands down the worst.,1,have eat many pizza place nyc be hand worst,VB VB JJ NN NN NN VB NN JJ,"['have/VB', 'eat/VB', 'many/JJ', 'pizza/NN', 'place/NN', 'nyc/NN', 'be/VB', 'hand/NN', 'worst/JJ']"
"I have never eaten in the restaurant, however, upon reading the reviews I got take out last week.",1,have never eat restaurant however read reviews get take last week,VB RB VB NN RB VB NN VB NN JJ NN,"['have/VB', 'never/RB', 'eat/VB', 'restaurant/NN', 'however/RB', 'read/VB', 'reviews/NN', 'get/VB', 'take/NN', 'last/JJ', 'week/NN']"
"Service is not exactly five star, but thats not really a big deal.",1,service be not exactly star that not really big deal,NN VB RB RB NN VB RB RB JJ NN,"['service/NN', 'be/VB', 'not/RB', 'exactly/RB', 'star/NN', 'that/VB', 'not/RB', 'really/RB', 'big/JJ', 'deal/NN']"
"However, if you want great food at a great price and don't mind the decor, you can't beat this place.",1,however want great food great price don mind decor beat place,RB VB JJ NN JJ NN VB VB NN NN NN,"['however/RB', 'want/VB', 'great/JJ', 'food/NN', 'great/JJ', 'price/NN', 'don/VB', 'mind/VB', 'decor/NN', 'beat/NN', 'place/NN']"
"My friends settled for rice dishes, but we came back the following day to try the dim sum, which was good...not outstanding, but good.",1,friend settle rice dish come back following day try dim sum be good not outstanding good,NN VB NN NN VB RB JJ NN VB JJ NN VB JJ RB JJ JJ,"['friend/NN', 'settle/VB', 'rice/NN', 'dish/NN', 'come/VB', 'back/RB', 'following/JJ', 'day/NN', 'try/VB', 'dim/JJ', 'sum/NN', 'be/VB', 'good/JJ', 'not/RB', 'outstanding/JJ', 'good/JJ']"
Was there Friday night.,1,be there friday night,VB RB JJ NN,"['be/VB', 'there/RB', 'friday/JJ', 'night/NN']"
I know because I live nearby.,1,know live nearby,RB JJ NN,"['know/RB', 'live/JJ', 'nearby/NN']"
I have to agree with the previous reviewer.,1,have agree previous reviewer,VB VB JJ NN,"['have/VB', 'agree/VB', 'previous/JJ', 'reviewer/NN']"
I've eaten at many different Indian restaurants.,1,have eat many different indian restaurant,VB VB JJ JJ JJ NN,"['have/VB', 'eat/VB', 'many/JJ', 'different/JJ', 'indian/JJ', 'restaurant/NN']"
the food is decent.,1,food be decent,NN VB JJ,"['food/NN', 'be/VB', 'decent/JJ']"
I asked the chef what he recommends and he asked me if I like Uni. (,1,ask chef recommend ask uni,VB NN VB VB JJ,"['ask/VB', 'chef/NN', 'recommend/VB', 'ask/VB', 'uni/JJ']"
We had Lava Cake... we ordered when our food came it takes at least a 1/2 to make it. ,1,have lava cake order food come take least make,VB NN NN VB NN VB VB JJ VB,"['have/VB', 'lava/NN', 'cake/NN', 'order/VB', 'food/NN', 'come/VB', 'take/VB', 'least/JJ', 'make/VB']"
However it is the ONLY Taiwanese restaurant in town.,1,however be only taiwanese restaurant town,RB VB JJ JJ NN NN,"['however/RB', 'be/VB', 'only/JJ', 'taiwanese/JJ', 'restaurant/NN', 'town/NN']"
Amma is nothing special.,1,amma be nothing special,NN VB NN JJ,"['amma/NN', 'be/VB', 'nothing/NN', 'special/JJ']"
instead ordered an ice cold beer which to me works with indian.,1,instead order ice cold beer work indian,RB VB NN JJ NN VB JJ,"['instead/RB', 'order/VB', 'ice/NN', 'cold/JJ', 'beer/NN', 'work/VB', 'indian/JJ']"
Visited there while on vacation and reading the reviews.,1,visit there vacation read reviews,VB RB NN VB NN,"['visit/VB', 'there/RB', 'vacation/NN', 'read/VB', 'reviews/NN']"
"I have never eaten in the restaurant, however, upon reading the reviews I got take out last week.",1,have never eat restaurant however read reviews get take last week,VB RB VB NN RB VB NN VB NN JJ NN,"['have/VB', 'never/RB', 'eat/VB', 'restaurant/NN', 'however/RB', 'read/VB', 'reviews/NN', 'get/VB', 'take/NN', 'last/JJ', 'week/NN']"
"Rude service, medicore food...there are tons of restaurants in NY...stay away from this one",1,rude service medicore food be ton restaurant ny stay away one,JJ NN JJ NN VB NN NN NN VB RB NN,"['rude/JJ', 'service/NN', 'medicore/JJ', 'food/NN', 'be/VB', 'ton/NN', 'restaurant/NN', 'ny/NN', 'stay/VB', 'away/RB', 'one/NN']"
"When I'm feeling stressed by the noise and congestion around my office, I head for Cafe St. Bart's.",1,feeling stress noise congestion office head cafe st bart,NN VB NN NN NN NN NN NN NN,"['feeling/NN', 'stress/VB', 'noise/NN', 'congestion/NN', 'office/NN', 'head/NN', 'cafe/NN', 'st/NN', 'bart/NN']"
"Food was okay, nothing great.",1,food be okay nothing great,NN VB JJ NN JJ,"['food/NN', 'be/VB', 'okay/JJ', 'nothing/NN', 'great/JJ']"
I have to agree with the previous reviewer.,1,have agree previous reviewer,VB VB JJ NN,"['have/VB', 'agree/VB', 'previous/JJ', 'reviewer/NN']"
"Among all of the new 5th avenue restaurants, this offers by far one of the best values for your money.",1,new avenue restaurant offer far best value money,JJ NN NN NN RB JJ NN NN,"['new/JJ', 'avenue/NN', 'restaurant/NN', 'offer/NN', 'far/RB', 'best/JJ', 'value/NN', 'money/NN']"
"A large is $20, and toppings are about $3 each.",1,large be topping be,JJ VB NN VB,"['large/JJ', 'be/VB', 'topping/NN', 'be/VB']"
I went there in late afternoon for some bite size food and refleshment with my date.,1,go there late afternoon bite size food refleshment date,VB RB JJ NN JJ NN NN NN NN,"['go/VB', 'there/RB', 'late/JJ', 'afternoon/NN', 'bite/JJ', 'size/NN', 'food/NN', 'refleshment/NN', 'date/NN']"
Just ignore the trendy wannabes.,1,just ignore trendy wannabe,RB VB JJ NN,"['just/RB', 'ignore/VB', 'trendy/JJ', 'wannabe/NN']"
"Of course, it is crowded but who cares.",1,course be crowd care,NN VB VB VB,"['course/NN', 'be/VB', 'crowd/VB', 'care/VB']"
"No, really.",1,really,RB,['really/RB']
"The menu consisted of standard brassiere food, better then places like Balthazar etc.",1,menu consist standard brassiere food better then place balthazar etc,NN VB JJ NN NN RB RB VB NN NN,"['menu/NN', 'consist/VB', 'standard/JJ', 'brassiere/NN', 'food/NN', 'better/RB', 'then/RB', 'place/VB', 'balthazar/NN', 'etc/NN']"
I went there with my friend last saturday.,1,go there friend last saturday,VB RB NN JJ NN,"['go/VB', 'there/RB', 'friend/NN', 'last/JJ', 'saturday/NN']"
"Next time, we wouldn't dare ordering anything else other than some simple Asian appetizers and drinks.",1,next time wouldn dare order anything else other simple asian appetizer drink,JJ NN VB VB VB NN RB JJ JJ NN NN NN,"['next/JJ', 'time/NN', 'wouldn/VB', 'dare/VB', 'order/VB', 'anything/NN', 'else/RB', 'other/JJ', 'simple/JJ', 'asian/NN', 'appetizer/NN', 'drink/NN']"
I work around the corner and tried it with a colleague for the first time.,1,work corner try colleague first time,NN NN VB NN JJ NN,"['work/NN', 'corner/NN', 'try/VB', 'colleague/NN', 'first/JJ', 'time/NN']"
enough said!,1,enough say,RB VB,"['enough/RB', 'say/VB']"
Will give it another chance before I write it off.,1,give chance,VB NN,"['give/VB', 'chance/NN']"
The restaurant is cute but not upscale.,1,restaurant be cute not upscale,NN VB JJ RB NN,"['restaurant/NN', 'be/VB', 'cute/JJ', 'not/RB', 'upscale/NN']"
"It costs $2 extra to turn a regular roll into an inside-out roll, but the roll more than triples in size, and that's not just from the rice.",1,cost extra turn regular roll inside roll roll more triple size not just rice,VB JJ VB JJ NN NN NN NN RB NN NN RB RB NN,"['cost/VB', 'extra/JJ', 'turn/VB', 'regular/JJ', 'roll/NN', 'inside/NN', 'roll/NN', 'roll/NN', 'more/RB', 'triple/NN', 'size/NN', 'not/RB', 'just/RB', 'rice/NN']"
"I've had the lunch buffet at Chennai a couple of times, when I have been in the neighborhood.",1,ve have lunch buffet chennai couple time have be neighborhood,NN VB NN NN NN NN NN VB VB NN,"['ve/NN', 'have/VB', 'lunch/NN', 'buffet/NN', 'chennai/NN', 'couple/NN', 'time/NN', 'have/VB', 'be/VB', 'neighborhood/NN']"
Kind of a small place but I guess if they are not too busy might be able to fit a group or kids.,1,kind small place guess be not too busy be able fit group kid,NN JJ NN NN VB RB RB JJ VB JJ VB NN NN,"['kind/NN', 'small/JJ', 'place/NN', 'guess/NN', 'be/VB', 'not/RB', 'too/RB', 'busy/JJ', 'be/VB', 'able/JJ', 'fit/VB', 'group/NN', 'kid/NN']"
As a student in NYU i need a place to eat after a hard day of work so usually i just go to any indian restraunt near by. ,1,student nyu need place eat hard day work so usually just go indian restraunt,NN NN VB NN VB JJ NN NN RB RB RB VB JJ NN,"['student/NN', 'nyu/NN', 'need/VB', 'place/NN', 'eat/VB', 'hard/JJ', 'day/NN', 'work/NN', 'so/RB', 'usually/RB', 'just/RB', 'go/VB', 'indian/JJ', 'restraunt/NN']"
Kind of a small place but I guess if they are not too busy might be able to fit a group or kids.,1,kind small place guess be not too busy be able fit group kid,NN JJ NN NN VB RB RB JJ VB JJ VB NN NN,"['kind/NN', 'small/JJ', 'place/NN', 'guess/NN', 'be/VB', 'not/RB', 'too/RB', 'busy/JJ', 'be/VB', 'able/JJ', 'fit/VB', 'group/NN', 'kid/NN']"
Was there Friday night.,1,be there friday night,VB RB JJ NN,"['be/VB', 'there/RB', 'friday/JJ', 'night/NN']"
"I was in love with Pongsri on 48th, but compared to Suan it is slow in service and overpriced.",1,be love pongsri compare suan be slow service overpriced,VB NN NN VB VB VB JJ NN JJ,"['be/VB', 'love/NN', 'pongsri/NN', 'compare/VB', 'suan/VB', 'be/VB', 'slow/JJ', 'service/NN', 'overpriced/JJ']"
After passing by this restaurant for sometime I finally decided to go in and have dinner.,1,pass restaurant sometime finally decide go have dinner,VB NN RB RB VB VB VB NN,"['pass/VB', 'restaurant/NN', 'sometime/RB', 'finally/RB', 'decide/VB', 'go/VB', 'have/VB', 'dinner/NN']"
I had a huge pastrami sandwich on a roll.,1,have huge pastrami sandwich roll,VB JJ NN NN NN,"['have/VB', 'huge/JJ', 'pastrami/NN', 'sandwich/NN', 'roll/NN']"
"Still, any quibbles about the bill were off-set by the pour-your-own measures of liquers which were courtesey of the house...",1,still quibble bill be off set pour own measure liquer be courtesey house,RB NN NN VB RB NN NN JJ NN NN VB NN NN,"['still/RB', 'quibble/NN', 'bill/NN', 'be/VB', 'off/RB', 'set/NN', 'pour/NN', 'own/JJ', 'measure/NN', 'liquer/NN', 'be/VB', 'courtesey/NN', 'house/NN']"
My girlfiends and I ate at O.G. again last night.,1,girlfiend eat again last night,NN VB RB JJ NN,"['girlfiend/NN', 'eat/VB', 'again/RB', 'last/JJ', 'night/NN']"
As a student in NYU i need a place to eat after a hard day of work so usually i just go to any indian restraunt near by. ,1,student nyu need place eat hard day work so usually just go indian restraunt,NN NN VB NN VB JJ NN NN RB RB RB VB JJ NN,"['student/NN', 'nyu/NN', 'need/VB', 'place/NN', 'eat/VB', 'hard/JJ', 'day/NN', 'work/NN', 'so/RB', 'usually/RB', 'just/RB', 'go/VB', 'indian/JJ', 'restraunt/NN']"
I came here with my boyfriend for our anniversary because it was highly recommended to him by a friend.,1,come here boyfriend anniversary be highly recommend friend,VB RB NN NN VB RB VB NN,"['come/VB', 'here/RB', 'boyfriend/NN', 'anniversary/NN', 'be/VB', 'highly/RB', 'recommend/VB', 'friend/NN']"
After passing by this restaurant for sometime I finally decided to go in and have dinner.,1,pass restaurant sometime finally decide go have dinner,VB NN RB RB VB VB VB NN,"['pass/VB', 'restaurant/NN', 'sometime/RB', 'finally/RB', 'decide/VB', 'go/VB', 'have/VB', 'dinner/NN']"
I'm sure I'll return for a final judgement tho.,1,sure ll return final judgement tho,JJ NN NN JJ NN NN,"['sure/JJ', 'll/NN', 'return/NN', 'final/JJ', 'judgement/NN', 'tho/NN']"
Food was good not great not worth the wait or another visit,1,food be good not great not wait visit,NN VB JJ RB JJ RB NN NN,"['food/NN', 'be/VB', 'good/JJ', 'not/RB', 'great/JJ', 'not/RB', 'wait/NN', 'visit/NN']"
I sometimes see the waiters don't have enough knowledge of their dishes.,1,sometimes see waiter don have enough knowledge dish,RB VB NN VB VB JJ NN NN,"['sometimes/RB', 'see/VB', 'waiter/NN', 'don/VB', 'have/VB', 'enough/JJ', 'knowledge/NN', 'dish/NN']"
"Better than the bagel shop on the corner, but not worth going out of your way for, in my opinion.",1,better bagel shop corner not worth go way opinion,JJ NN NN JJ RB JJ VB NN NN,"['better/JJ', 'bagel/NN', 'shop/NN', 'corner/JJ', 'not/RB', 'worth/JJ', 'go/VB', 'way/NN', 'opinion/NN']"
Have the iced tea.,1,have iced tea,VB JJ NN,"['have/VB', 'iced/JJ', 'tea/NN']"
"With the exception of our lemon salad that had so much pepper on it that our eyes started watering, the food here was decent, not great.",1,exception lemon salad have so much pepper eye start food here be decent not great,NN NN NN VB RB JJ NN NN VB NN RB VB JJ RB JJ,"['exception/NN', 'lemon/NN', 'salad/NN', 'have/VB', 'so/RB', 'much/JJ', 'pepper/NN', 'eye/NN', 'start/VB', 'food/NN', 'here/RB', 'be/VB', 'decent/JJ', 'not/RB', 'great/JJ']"
"Next time, we wouldn't dare ordering anything else other than some simple Asian appetizers and drinks.",1,next time wouldn dare order anything else other simple asian appetizer drink,JJ NN VB VB VB NN RB JJ JJ NN NN NN,"['next/JJ', 'time/NN', 'wouldn/VB', 'dare/VB', 'order/VB', 'anything/NN', 'else/RB', 'other/JJ', 'simple/JJ', 'asian/NN', 'appetizer/NN', 'drink/NN']"
The two star chefs left quite some time ago to open their own place.,1,star chef left quite time open own place,NN NN VB RB NN VB JJ NN,"['star/NN', 'chef/NN', 'left/VB', 'quite/RB', 'time/NN', 'open/VB', 'own/JJ', 'place/NN']"
We ate outside at Haru's Sake bar because Haru's restaurant next door was overflowing.,1,eat outside haru sake bar haru restaurant next door be overflow,VB JJ NN NN NN NN NN JJ NN VB VB,"['eat/VB', 'outside/JJ', 'haru/NN', 'sake/NN', 'bar/NN', 'haru/NN', 'restaurant/NN', 'next/JJ', 'door/NN', 'be/VB', 'overflow/VB']"
Went to Cafe Spice with 4 of my friends on a saturday night.,1,go cafe spice friend saturday night,VB NN NN NN NN NN,"['go/VB', 'cafe/NN', 'spice/NN', 'friend/NN', 'saturday/NN', 'night/NN']"
less wait time for me!,1,less wait time,JJ JJ NN,"['less/JJ', 'wait/JJ', 'time/NN']"
I stumbled upon this second floor walk-up two Fridays ago when I was with two friends in town from L.A. ,1,stumble second floor walk friday be friend town,VB JJ NN VB NN VB NN NN,"['stumble/VB', 'second/JJ', 'floor/NN', 'walk/VB', 'friday/NN', 'be/VB', 'friend/NN', 'town/NN']"
"However, if you want great food at a great price and don't mind the decor, you can't beat this place.",1,however want great food great price don mind decor beat place,RB VB JJ NN JJ NN VB VB NN NN NN,"['however/RB', 'want/VB', 'great/JJ', 'food/NN', 'great/JJ', 'price/NN', 'don/VB', 'mind/VB', 'decor/NN', 'beat/NN', 'place/NN']"
really depends on your luck!,1,really depend luck,RB VB NN,"['really/RB', 'depend/VB', 'luck/NN']"
I don't get it either.,1,don get,VB VB,"['don/VB', 'get/VB']"
"As many other reviewers noticed, your order is often slow to arrive - this is particularly true in the evening but is not a problem during lunch time.",1,many other reviewer notice order be often slow arrive be particularly true evening be not problem lunch time,JJ JJ NN VB NN VB RB JJ VB VB RB JJ NN VB RB NN NN NN,"['many/JJ', 'other/JJ', 'reviewer/NN', 'notice/VB', 'order/NN', 'be/VB', 'often/RB', 'slow/JJ', 'arrive/VB', 'be/VB', 'particularly/RB', 'true/JJ', 'evening/NN', 'be/VB', 'not/RB', 'problem/NN', 'lunch/NN', 'time/NN']"
"I love Ess-a-bagel, but I live on the west side, so I often go to Murray's for convenience.",1,love ess bagel live west side often go murray convenience,NN RB NN VB JJ NN RB VB VB NN,"['love/NN', 'ess/RB', 'bagel/NN', 'live/VB', 'west/JJ', 'side/NN', 'often/RB', 'go/VB', 'murray/VB', 'convenience/NN']"
instead ordered an ice cold beer which to me works with indian.,1,instead order ice cold beer work indian,RB VB NN JJ NN VB JJ,"['instead/RB', 'order/VB', 'ice/NN', 'cold/JJ', 'beer/NN', 'work/VB', 'indian/JJ']"
Moderate prices.,1,moderate price,JJ NN,"['moderate/JJ', 'price/NN']"
"The tables are crammed way too close, the menu is typical of any Italian restaurant, and the wine list is simply overpriced.",1,table be cram way too close menu be typical italian restaurant wine list be simply overpriced,NN VB VB NN RB RB NN VB JJ JJ NN NN NN VB RB JJ,"['table/NN', 'be/VB', 'cram/VB', 'way/NN', 'too/RB', 'close/RB', 'menu/NN', 'be/VB', 'typical/JJ', 'italian/JJ', 'restaurant/NN', 'wine/NN', 'list/NN', 'be/VB', 'simply/RB', 'overpriced/JJ']"
"Rude service, medicore food...there are tons of restaurants in NY...stay away from this one",1,rude service medicore food be ton restaurant ny stay away one,JJ NN JJ NN VB NN NN NN VB RB NN,"['rude/JJ', 'service/NN', 'medicore/JJ', 'food/NN', 'be/VB', 'ton/NN', 'restaurant/NN', 'ny/NN', 'stay/VB', 'away/RB', 'one/NN']"
Service is average.,1,service be average,NN VB JJ,"['service/NN', 'be/VB', 'average/JJ']"
I lived in Maine for ten years and grew up on fish.,1,live maine year grow fish,VB NN NN VB NN,"['live/VB', 'maine/NN', 'year/NN', 'grow/VB', 'fish/NN']"
