sentence,sentiment,lem_words,lem_tags,word_tags
"They are not helpful in the least and will give you the grand run around so by the time the event date rolls around you will not only regret chosing this place, but also become hostile!",0,be not helpful least give grand run around so time event date roll not only regret chose place also become hostile,VB RB JJ JJ VB JJ NN RB RB NN NN NN NN RB RB VB VB NN RB VB JJ,"['be/VB', 'not/RB', 'helpful/JJ', 'least/JJ', 'give/VB', 'grand/JJ', 'run/NN', 'around/RB', 'so/RB', 'time/NN', 'event/NN', 'date/NN', 'roll/NN', 'not/RB', 'only/RB', 'regret/VB', 'chose/VB', 'place/NN', 'also/RB', 'become/VB', 'hostile/JJ']"
I was very disappointed with this restaurant.,0,be very disappoint restaurant,VB RB VB NN,"['be/VB', 'very/RB', 'disappoint/VB', 'restaurant/NN']"
"Despite a slightly limited menu, everything prepared is done to perfection, ultra fresh and a work of food art.",0,slightly limited menu everything prepare be do perfection ultra fresh work food art,RB JJ NN NN VB VB VB NN JJ JJ NN NN NN,"['slightly/RB', 'limited/JJ', 'menu/NN', 'everything/NN', 'prepare/VB', 'be/VB', 'do/VB', 'perfection/NN', 'ultra/JJ', 'fresh/JJ', 'work/NN', 'food/NN', 'art/NN']"
"The staff has been nice, but they seemed really stressed and the unisex bathroom needs to be cleaned more often.",0,staff have be nice seem really stressed unisex bathroom need be clean more often,NN VB VB JJ VB RB JJ NN NN NN VB VB RB RB,"['staff/NN', 'have/VB', 'be/VB', 'nice/JJ', 'seem/VB', 'really/RB', 'stressed/JJ', 'unisex/NN', 'bathroom/NN', 'need/NN', 'be/VB', 'clean/VB', 'more/RB', 'often/RB']"
"Overall, not worth the money.",0,overall not money,JJ RB NN,"['overall/JJ', 'not/RB', 'money/NN']"
We were seated outside and the waiter spilled red wine and hot tea on myself and my date.,0,be seat outside waiter spil red wine hot tea date,VB VB JJ NN VB JJ NN JJ NN NN,"['be/VB', 'seat/VB', 'outside/JJ', 'waiter/NN', 'spil/VB', 'red/JJ', 'wine/NN', 'hot/JJ', 'tea/NN', 'date/NN']"
Fish was overdone.,0,fish be overdo,NN VB VB,"['fish/NN', 'be/VB', 'overdo/VB']"
We were seated outside and the waiter spilled red wine and hot tea on myself and my date.,0,be seat outside waiter spil red wine hot tea date,VB VB JJ NN VB JJ NN JJ NN NN,"['be/VB', 'seat/VB', 'outside/JJ', 'waiter/NN', 'spil/VB', 'red/JJ', 'wine/NN', 'hot/JJ', 'tea/NN', 'date/NN']"
I'm not picky - but it was actually gross.,0,not picky be actually gross,RB JJ VB RB JJ,"['not/RB', 'picky/JJ', 'be/VB', 'actually/RB', 'gross/JJ']"
"The entree was bland and small, dessert was not inspired.",0,entree be bland small dessert be not inspire,NN VB JJ JJ NN VB RB VB,"['entree/NN', 'be/VB', 'bland/JJ', 'small/JJ', 'dessert/NN', 'be/VB', 'not/RB', 'inspire/VB']"
This place is incredibly tiny.,0,place be incredibly tiny,NN VB RB JJ,"['place/NN', 'be/VB', 'incredibly/RB', 'tiny/JJ']"
"Even though its good seafood, the prices are too high.",0,even good seafood price be too high,RB JJ NN NN VB RB JJ,"['even/RB', 'good/JJ', 'seafood/NN', 'price/NN', 'be/VB', 'too/RB', 'high/JJ']"
"The food was not fresh, the sauces were bland and very oily.",0,food be not fresh sauce be bland very oily,NN VB RB JJ NN VB JJ RB JJ,"['food/NN', 'be/VB', 'not/RB', 'fresh/JJ', 'sauce/NN', 'be/VB', 'bland/JJ', 'very/RB', 'oily/JJ']"
And I hate to say this but I doubt I'll ever go back. ,0,hate say doubt ll ever go back,NN VB NN NN RB VB RB,"['hate/NN', 'say/VB', 'doubt/NN', 'll/NN', 'ever/RB', 'go/VB', 'back/RB']"
"The place is small and intimate and you may feel a little crowded, but the service is excellent and it's great for friends out, a romantic date, or a special occassion.",0,place be small intimate feel little crowded service be excellent great friend romantic date special occassion,NN VB JJ JJ VB JJ JJ NN VB JJ JJ NN JJ NN JJ NN,"['place/NN', 'be/VB', 'small/JJ', 'intimate/JJ', 'feel/VB', 'little/JJ', 'crowded/JJ', 'service/NN', 'be/VB', 'excellent/JJ', 'great/JJ', 'friend/NN', 'romantic/JJ', 'date/NN', 'special/JJ', 'occassion/NN']"
Murray won't do it.,0,murray win do,JJ VB VB,"['murray/JJ', 'win/VB', 'do/VB']"
Tiny dessert was $8.00...just plain overpriced for what it is.,0,tiny dessert be just plain overpriced be,JJ NN VB RB RB JJ VB,"['tiny/JJ', 'dessert/NN', 'be/VB', 'just/RB', 'plain/RB', 'overpriced/JJ', 'be/VB']"
The only problem is that the manager is a complete incompetent.,0,only problem be manager be complete incompetent,JJ NN VB NN VB JJ JJ,"['only/JJ', 'problem/NN', 'be/VB', 'manager/NN', 'be/VB', 'complete/JJ', 'incompetent/JJ']"
"My husbands was perfect, my was well done and dry.",0,husband be perfect be well do dry,NN VB JJ VB RB VB JJ,"['husband/NN', 'be/VB', 'perfect/JJ', 'be/VB', 'well/RB', 'do/VB', 'dry/JJ']"
"It's boring on the inside, and our sushi was pretty below average... the tuna was soggy and the other rolls had no flavor.",0,bore inside sushi be pretty average tuna be soggy other roll have flavor,VB NN NN VB RB VB NN VB JJ JJ NN VB NN,"['bore/VB', 'inside/NN', 'sushi/NN', 'be/VB', 'pretty/RB', 'average/VB', 'tuna/NN', 'be/VB', 'soggy/JJ', 'other/JJ', 'roll/NN', 'have/VB', 'flavor/NN']"
Traditional French decour was pleasant though the hall was rather noisy - the restaurant was full and we had to raise our voices to be able to maintain a conversation.,0,traditional french decour be pleasant hall be rather noisy restaurant be full have raise voice be able maintain conversation,JJ JJ NN VB JJ NN VB RB JJ NN VB JJ VB VB NN VB JJ VB NN,"['traditional/JJ', 'french/JJ', 'decour/NN', 'be/VB', 'pleasant/JJ', 'hall/NN', 'be/VB', 'rather/RB', 'noisy/JJ', 'restaurant/NN', 'be/VB', 'full/JJ', 'have/VB', 'raise/VB', 'voice/NN', 'be/VB', 'able/JJ', 'maintain/VB', 'conversation/NN']"
"Immediately after we paid, the waiter took the money and said, okay, you guys are outta here.",0,immediately paid waiter take money say okay guy be here,RB VB NN VB NN VB JJ NN VB RB,"['immediately/RB', 'paid/VB', 'waiter/NN', 'take/VB', 'money/NN', 'say/VB', 'okay/JJ', 'guy/NN', 'be/VB', 'here/RB']"
The lobster sandwich is $24 and although it was good it was not nearly enough to warrant that price.,0,lobster sandwich be be good be not nearly enough warrant price,NN NN VB VB JJ VB RB RB JJ VB NN,"['lobster/NN', 'sandwich/NN', 'be/VB', 'be/VB', 'good/JJ', 'be/VB', 'not/RB', 'nearly/RB', 'enough/JJ', 'warrant/VB', 'price/NN']"
Dessert is a joke...dont bother,0,dessert be joke dont,NN VB NN VB,"['dessert/NN', 'be/VB', 'joke/NN', 'dont/VB']"
I've waited over one hour for food.,0,ve wait hour food,NN VB NN NN,"['ve/NN', 'wait/VB', 'hour/NN', 'food/NN']"
"A gentleman, maybe the manager, came to our table, and without so much as a smile or greeting asked for our order.",0,gentleman maybe manager come table so much smile greeting ask order,NN RB NN VB NN RB JJ NN NN VB NN,"['gentleman/NN', 'maybe/RB', 'manager/NN', 'come/VB', 'table/NN', 'so/RB', 'much/JJ', 'smile/NN', 'greeting/NN', 'ask/VB', 'order/NN']"
"First of all, this place is *not* romantic, as claimed by Citysearch's editorial review.",0,first place be not romantic claim citysearch editorial review,JJ NN VB RB JJ VB NN NN NN,"['first/JJ', 'place/NN', 'be/VB', 'not/RB', 'romantic/JJ', 'claim/VB', 'citysearch/NN', 'editorial/NN', 'review/NN']"
"Then, to top things off, she dropped used silverware on my boyfriend's jacket and did not stop to apologize or clean the mess that was left on clothes. ",0,then top thing drop used silverware boyfriend jacket do not stop apologize clean mess be left clothe,RB VB NN VB JJ NN NN NN VB RB VB VB VB NN VB VB NN,"['then/RB', 'top/VB', 'thing/NN', 'drop/VB', 'used/JJ', 'silverware/NN', 'boyfriend/NN', 'jacket/NN', 'do/VB', 'not/RB', 'stop/VB', 'apologize/VB', 'clean/VB', 'mess/NN', 'be/VB', 'left/VB', 'clothe/NN']"
"The food arrived 20 minutes after I called, cold and soggy.",0,food arrived minute call cold soggy,NN JJ NN VB JJ JJ,"['food/NN', 'arrived/JJ', 'minute/NN', 'call/VB', 'cold/JJ', 'soggy/JJ']"
"the only things u could really taste are the very salty soy sauce (even its low sodium), the vinegar-soaked rice, and the scallion on top of the fish. ",0,only thing really taste be very salty soy sauce even low sodium vinegar soak rice scallion top fish,JJ NN RB NN VB RB JJ NN NN RB JJ NN NN VB NN NN NN NN,"['only/JJ', 'thing/NN', 'really/RB', 'taste/NN', 'be/VB', 'very/RB', 'salty/JJ', 'soy/NN', 'sauce/NN', 'even/RB', 'low/JJ', 'sodium/NN', 'vinegar/NN', 'soak/VB', 'rice/NN', 'scallion/NN', 'top/NN', 'fish/NN']"
The service was the only thing good about this restaurant.,0,service be only thing good restaurant,NN VB JJ NN JJ NN,"['service/NN', 'be/VB', 'only/JJ', 'thing/NN', 'good/JJ', 'restaurant/NN']"
"The decor is night tho...but they REALLY need to clean that vent in the ceiling...its quite un-appetizing, and kills your effort to make this place look sleek and modern.",0,decor be night tho really need clean vent ceiling quite appetizing kill effort make place look sleek modern,NN VB NN NN RB VB VB NN NN RB JJ VB NN VB NN VB JJ JJ,"['decor/NN', 'be/VB', 'night/NN', 'tho/NN', 'really/RB', 'need/VB', 'clean/VB', 'vent/NN', 'ceiling/NN', 'quite/RB', 'appetizing/JJ', 'kill/VB', 'effort/NN', 'make/VB', 'place/NN', 'look/VB', 'sleek/JJ', 'modern/JJ']"
"Yes, they use fancy ingredients, but even fancy ingredients don't make for good pizza unless someone knows how to get the crust right.",0,yes use fancy ingredient even fancy ingredient don make good pizza someone know get crust right,RB VB JJ NN RB JJ NN VB VB JJ NN NN VB VB NN RB,"['yes/RB', 'use/VB', 'fancy/JJ', 'ingredient/NN', 'even/RB', 'fancy/JJ', 'ingredient/NN', 'don/VB', 'make/VB', 'good/JJ', 'pizza/NN', 'someone/NN', 'know/VB', 'get/VB', 'crust/NN', 'right/RB']"
"Downtown Dinner 2002 - Prixe fix: Appetizers were ok, waiter gave me poor suggestion..try the potato stuff kanish best one.",0,downtown dinner fix appetizer be waiter give poor suggestion try potato stuff kanish best,JJ NN VB NN VB NN VB JJ NN VB NN NN VB RB,"['downtown/JJ', 'dinner/NN', 'fix/VB', 'appetizer/NN', 'be/VB', 'waiter/NN', 'give/VB', 'poor/JJ', 'suggestion/NN', 'try/VB', 'potato/NN', 'stuff/NN', 'kanish/VB', 'best/RB']"
"Yes, they use fancy ingredients, but even fancy ingredients don't make for good pizza unless someone knows how to get the crust right.",0,yes use fancy ingredient even fancy ingredient don make good pizza someone know get crust right,RB VB JJ NN RB JJ NN VB VB JJ NN NN VB VB NN RB,"['yes/RB', 'use/VB', 'fancy/JJ', 'ingredient/NN', 'even/RB', 'fancy/JJ', 'ingredient/NN', 'don/VB', 'make/VB', 'good/JJ', 'pizza/NN', 'someone/NN', 'know/VB', 'get/VB', 'crust/NN', 'right/RB']"
"For the people who want great food plus great service, Roxy is a place to AVOID!",0,person want great food great service roxy be place avoid,NN VB JJ NN JJ NN NN VB NN VB,"['person/NN', 'want/VB', 'great/JJ', 'food/NN', 'great/JJ', 'service/NN', 'roxy/NN', 'be/VB', 'place/NN', 'avoid/VB']"
They wouldnt even let me finish my glass of wine before offering another.,0,wouldnt even let finish glass wine offer,VB RB VB VB NN NN VB,"['wouldnt/VB', 'even/RB', 'let/VB', 'finish/VB', 'glass/NN', 'wine/NN', 'offer/VB']"
Fish was overdone.,0,fish be overdo,NN VB VB,"['fish/NN', 'be/VB', 'overdo/VB']"
NO PIZZA 33 for me!,0,pizza,NN,['pizza/NN']
Mine was a little burnt but still delicious with goat cheese and panchetta (raddichio was kind of bitter though).,0,mine be little burnt still delicious goat cheese panchetta raddichio be kind bitter,NN VB JJ JJ RB JJ NN NN VB NN VB NN JJ,"['mine/NN', 'be/VB', 'little/JJ', 'burnt/JJ', 'still/RB', 'delicious/JJ', 'goat/NN', 'cheese/NN', 'panchetta/VB', 'raddichio/NN', 'be/VB', 'kind/NN', 'bitter/JJ']"
"Skip this restaurant, it's a big disappointment.",0,skip restaurant big disappointment,NN NN JJ NN,"['skip/NN', 'restaurant/NN', 'big/JJ', 'disappointment/NN']"
"Rude service, medicore food...there are tons of restaurants in NY...stay away from this one",0,rude service medicore food be ton restaurant ny stay away one,JJ NN JJ NN VB NN NN NN VB RB NN,"['rude/JJ', 'service/NN', 'medicore/JJ', 'food/NN', 'be/VB', 'ton/NN', 'restaurant/NN', 'ny/NN', 'stay/VB', 'away/RB', 'one/NN']"
The soup for the udon was soy sauce and water.,0,soup be soy sauce water,NN VB NN NN NN,"['soup/NN', 'be/VB', 'soy/NN', 'sauce/NN', 'water/NN']"
please don't fool us.,0,please don fool,VB VB NN,"['please/VB', 'don/VB', 'fool/NN']"
Somehow working the italian charm with constant mille grazie does not constitute proper service.,0,somehow italian charm constant mille grazie do not constitute proper service,RB JJ NN JJ NN NN VB RB JJ JJ NN,"['somehow/RB', 'italian/JJ', 'charm/NN', 'constant/JJ', 'mille/NN', 'grazie/NN', 'do/VB', 'not/RB', 'constitute/JJ', 'proper/JJ', 'service/NN']"
I just don't understand all the hype...,0,just don understand hype,RB VB VB NN,"['just/RB', 'don/VB', 'understand/VB', 'hype/NN']"
The lobster sandwich is $24 and although it was good it was not nearly enough to warrant that price.,0,lobster sandwich be be good be not nearly enough warrant price,NN NN VB VB JJ VB RB RB JJ VB NN,"['lobster/NN', 'sandwich/NN', 'be/VB', 'be/VB', 'good/JJ', 'be/VB', 'not/RB', 'nearly/RB', 'enough/JJ', 'warrant/VB', 'price/NN']"
But the staff was so horrible to us.,0,staff be so horrible,NN VB RB JJ,"['staff/NN', 'be/VB', 'so/RB', 'horrible/JJ']"
Ravioli was good...but I have to say that I found everything a bit overpriced.,0,ravioli be good have say find everything bit overpriced,NN VB JJ VB VB VB NN NN JJ,"['ravioli/NN', 'be/VB', 'good/JJ', 'have/VB', 'say/VB', 'find/VB', 'everything/NN', 'bit/NN', 'overpriced/JJ']"
NO PIZZA 33 for me!,0,pizza,NN,['pizza/NN']
"After all that, they complained to me about the small tip.",0,complain small tip,VB JJ NN,"['complain/VB', 'small/JJ', 'tip/NN']"
I'm not picky - but it was actually gross.,0,not picky be actually gross,RB JJ VB RB JJ,"['not/RB', 'picky/JJ', 'be/VB', 'actually/RB', 'gross/JJ']"
They should have called it mascarpone with chocolate chips-good but a far cry from what the name implies.,0,have call mascarpone chocolate chip good far cry name imply,VB VB NN NN NN JJ RB VB NN VB,"['have/VB', 'call/VB', 'mascarpone/NN', 'chocolate/NN', 'chip/NN', 'good/JJ', 'far/RB', 'cry/VB', 'name/NN', 'imply/VB']"
It was $14 not really bad for a pound of Pastrami-but it didn't have much taste-I've had better for less elsewhere!,0,be not really bad pound pastrami didn have much taste ve have better less elsewhere,VB RB RB JJ NN NN VB VB JJ NN NN VB RB JJ RB,"['be/VB', 'not/RB', 'really/RB', 'bad/JJ', 'pound/NN', 'pastrami/NN', 'didn/VB', 'have/VB', 'much/JJ', 'taste/NN', 've/NN', 'have/VB', 'better/RB', 'less/JJ', 'elsewhere/RB']"
We ordered some beef and noodle soup dishes from the Thai section of the menu but nothing we got was Thai.,0,order beef noodle soup dish thai section menu nothing get be thai,VB NN JJ NN NN NN NN NN NN VB VB NN,"['order/VB', 'beef/NN', 'noodle/JJ', 'soup/NN', 'dish/NN', 'thai/NN', 'section/NN', 'menu/NN', 'nothing/NN', 'get/VB', 'be/VB', 'thai/NN']"
I/we will never go back to this place again.,0,never go back place again,RB VB RB NN RB,"['never/RB', 'go/VB', 'back/RB', 'place/NN', 'again/RB']"
We were very disappointed.,0,be very disappointed,VB RB JJ,"['be/VB', 'very/RB', 'disappointed/JJ']"
"Moules were excellent, lobster ravioli was VERY salty!",0,moule be excellent lobster ravioli be very salty,NN VB JJ NN NN VB RB JJ,"['moule/NN', 'be/VB', 'excellent/JJ', 'lobster/NN', 'ravioli/NN', 'be/VB', 'very/RB', 'salty/JJ']"
Traditional French decour was pleasant though the hall was rather noisy - the restaurant was full and we had to raise our voices to be able to maintain a conversation.,0,traditional french decour be pleasant hall be rather noisy restaurant be full have raise voice be able maintain conversation,JJ JJ NN VB JJ NN VB RB JJ NN VB JJ VB VB NN VB JJ VB NN,"['traditional/JJ', 'french/JJ', 'decour/NN', 'be/VB', 'pleasant/JJ', 'hall/NN', 'be/VB', 'rather/RB', 'noisy/JJ', 'restaurant/NN', 'be/VB', 'full/JJ', 'have/VB', 'raise/VB', 'voice/NN', 'be/VB', 'able/JJ', 'maintain/VB', 'conversation/NN']"
Tiny dessert was $8.00...just plain overpriced for what it is.,0,tiny dessert be just plain overpriced be,JJ NN VB RB RB JJ VB,"['tiny/JJ', 'dessert/NN', 'be/VB', 'just/RB', 'plain/RB', 'overpriced/JJ', 'be/VB']"
"Well, this place is so Ghetto its not even funny.",0,well place be ghetto not even funny,RB NN VB NN RB RB JJ,"['well/RB', 'place/NN', 'be/VB', 'ghetto/NN', 'not/RB', 'even/RB', 'funny/JJ']"
"The decor is night tho...but they REALLY need to clean that vent in the ceiling...its quite un-appetizing, and kills your effort to make this place look sleek and modern.",0,decor be night tho really need clean vent ceiling quite appetizing kill effort make place look sleek modern,NN VB NN NN RB VB VB NN NN RB JJ VB NN VB NN VB JJ JJ,"['decor/NN', 'be/VB', 'night/NN', 'tho/NN', 'really/RB', 'need/VB', 'clean/VB', 'vent/NN', 'ceiling/NN', 'quite/RB', 'appetizing/JJ', 'kill/VB', 'effort/NN', 'make/VB', 'place/NN', 'look/VB', 'sleek/JJ', 'modern/JJ']"
not sure why this restaurant would be rated that highly.,0,not sure restaurant be rate highly,RB JJ NN VB VB RB,"['not/RB', 'sure/JJ', 'restaurant/NN', 'be/VB', 'rate/VB', 'highly/RB']"
We ordered some beef and noodle soup dishes from the Thai section of the menu but nothing we got was Thai.,0,order beef noodle soup dish thai section menu nothing get be thai,VB NN JJ NN NN NN NN NN NN VB VB NN,"['order/VB', 'beef/NN', 'noodle/JJ', 'soup/NN', 'dish/NN', 'thai/NN', 'section/NN', 'menu/NN', 'nothing/NN', 'get/VB', 'be/VB', 'thai/NN']"
"The food is decent at best, and the ambience, well, it's a matter of opinion, some may consider it to be a sweet thing, I thought it was just annoying.",0,food be decent best ambience well matter opinion consider be sweet thing think be just annoying,NN VB JJ JJ NN RB NN NN VB VB JJ NN VB VB RB JJ,"['food/NN', 'be/VB', 'decent/JJ', 'best/JJ', 'ambience/NN', 'well/RB', 'matter/NN', 'opinion/NN', 'consider/VB', 'be/VB', 'sweet/JJ', 'thing/NN', 'think/VB', 'be/VB', 'just/RB', 'annoying/JJ']"
"The waitress, seems to be more concerned of looking good than actually waitressing.",0,waitress seem be more concerned look good actually waitressing,NN VB VB RB JJ VB JJ RB JJ,"['waitress/NN', 'seem/VB', 'be/VB', 'more/RB', 'concerned/JJ', 'look/VB', 'good/JJ', 'actually/RB', 'waitressing/JJ']"
This place is incredibly tiny.,0,place be incredibly tiny,NN VB RB JJ,"['place/NN', 'be/VB', 'incredibly/RB', 'tiny/JJ']"
"Cute place, nice wait staff but would never go there again.",0,cute place nice wait staff never go there again,JJ NN JJ NN NN RB VB RB RB,"['cute/JJ', 'place/NN', 'nice/JJ', 'wait/NN', 'staff/NN', 'never/RB', 'go/VB', 'there/RB', 'again/RB']"
"The rest of the dim sum, though pricey by Chinatown standards, is worth it.",0,rest dim sum pricey chinatown standard be worth,NN JJ NN JJ JJ NN VB JJ,"['rest/NN', 'dim/JJ', 'sum/NN', 'pricey/JJ', 'chinatown/JJ', 'standard/NN', 'be/VB', 'worth/JJ']"
They smell like they stuff them with old canned vegetables like the spinach mushroom calzone.,0,smell stuff old canned vegetable spinach mushroom calzone,VB NN JJ JJ NN NN NN NN,"['smell/VB', 'stuff/NN', 'old/JJ', 'canned/JJ', 'vegetable/NN', 'spinach/NN', 'mushroom/NN', 'calzone/NN']"
"I have reservations about the all you can eat deal, however -- the choices are fairly limited and you can probably order more food than you can eat for less than $18 by just going off the menu.",0,have reservation all eat deal however choice be fairly limit probably order more food eat less just go menu,VB NN RB VB NN RB NN VB RB VB RB NN JJ NN VB JJ RB VB NN,"['have/VB', 'reservation/NN', 'all/RB', 'eat/VB', 'deal/NN', 'however/RB', 'choice/NN', 'be/VB', 'fairly/RB', 'limit/VB', 'probably/RB', 'order/NN', 'more/JJ', 'food/NN', 'eat/VB', 'less/JJ', 'just/RB', 'go/VB', 'menu/NN']"
"We did tip, I guess the model/waitress just wanted more and complained to the manager.",0,do tip guess model waitress just want more complain manager,VB NN NN NN NN RB VB RB VB NN,"['do/VB', 'tip/NN', 'guess/NN', 'model/NN', 'waitress/NN', 'just/RB', 'want/VB', 'more/RB', 'complain/VB', 'manager/NN']"
"We ordered the special, grilled branzino, that was so infused with bone, it was difficult to eat.",0,order special grilled branzino be so infuse bone be difficult eat,VB JJ JJ NN VB RB VB NN VB JJ VB,"['order/VB', 'special/JJ', 'grilled/JJ', 'branzino/NN', 'be/VB', 'so/RB', 'infuse/VB', 'bone/NN', 'be/VB', 'difficult/JJ', 'eat/VB']"
skip dessert.,0,skip dessert,NN NN,"['skip/NN', 'dessert/NN']"
DO not try unless you're just going there to hang out like the rest of the hipsters who apparently have no sense of taste.,0,do not try re just go there hang out rest hipster apparently have sense taste,VB RB VB NN RB VB RB VB RB NN NN RB VB NN NN,"['do/VB', 'not/RB', 'try/VB', 're/NN', 'just/RB', 'go/VB', 'there/RB', 'hang/VB', 'out/RB', 'rest/NN', 'hipster/NN', 'apparently/RB', 'have/VB', 'sense/NN', 'taste/NN']"
We ordered some beef and noodle soup dishes from the Thai section of the menu but nothing we got was Thai.,0,order beef noodle soup dish thai section menu nothing get be thai,VB NN JJ NN NN NN NN NN NN VB VB NN,"['order/VB', 'beef/NN', 'noodle/JJ', 'soup/NN', 'dish/NN', 'thai/NN', 'section/NN', 'menu/NN', 'nothing/NN', 'get/VB', 'be/VB', 'thai/NN']"
Someone else recommended the dessert - we also left that.,0,someone else recommend dessert also left,NN RB VB NN RB VB,"['someone/NN', 'else/RB', 'recommend/VB', 'dessert/NN', 'also/RB', 'left/VB']"
"Moules were excellent, lobster ravioli was VERY salty!",0,moule be excellent lobster ravioli be very salty,NN VB JJ NN NN VB RB JJ,"['moule/NN', 'be/VB', 'excellent/JJ', 'lobster/NN', 'ravioli/NN', 'be/VB', 'very/RB', 'salty/JJ']"
"Yes, they use fancy ingredients, but even fancy ingredients don't make for good pizza unless someone knows how to get the crust right.",0,yes use fancy ingredient even fancy ingredient don make good pizza someone know get crust right,RB VB JJ NN RB JJ NN VB VB JJ NN NN VB VB NN RB,"['yes/RB', 'use/VB', 'fancy/JJ', 'ingredient/NN', 'even/RB', 'fancy/JJ', 'ingredient/NN', 'don/VB', 'make/VB', 'good/JJ', 'pizza/NN', 'someone/NN', 'know/VB', 'get/VB', 'crust/NN', 'right/RB']"
Not one of our meals was edible - bland and/or made with weird rosemary or orange flavoring.,0,not meal be edible bland make weird rosemary orange flavoring,RB NN VB JJ JJ VB JJ NN JJ NN,"['not/RB', 'meal/NN', 'be/VB', 'edible/JJ', 'bland/JJ', 'make/VB', 'weird/JJ', 'rosemary/NN', 'orange/JJ', 'flavoring/NN']"
The place is small and cramped but the food is fantastic.,0,place be small cramped food be fantastic,NN VB JJ JJ NN VB JJ,"['place/NN', 'be/VB', 'small/JJ', 'cramped/JJ', 'food/NN', 'be/VB', 'fantastic/JJ']"
"For the people who want great food plus great service, Roxy is a place to AVOID!",0,person want great food great service roxy be place avoid,NN VB JJ NN JJ NN NN VB NN VB,"['person/NN', 'want/VB', 'great/JJ', 'food/NN', 'great/JJ', 'service/NN', 'roxy/NN', 'be/VB', 'place/NN', 'avoid/VB']"
Never again!,0,never again,RB RB,"['never/RB', 'again/RB']"
This place is not worth the prices.,0,place be not price,NN VB RB NN,"['place/NN', 'be/VB', 'not/RB', 'price/NN']"
They smell like they stuff them with old canned vegetables like the spinach mushroom calzone.,0,smell stuff old canned vegetable spinach mushroom calzone,VB NN JJ JJ NN NN NN NN,"['smell/VB', 'stuff/NN', 'old/JJ', 'canned/JJ', 'vegetable/NN', 'spinach/NN', 'mushroom/NN', 'calzone/NN']"
I don't think I would go again.,0,don think go again,VB VB VB RB,"['don/VB', 'think/VB', 'go/VB', 'again/RB']"
It's definately not a place to go if you want to impress someone.,0,definately not place go want impress someone,RB RB NN VB VB VB NN,"['definately/RB', 'not/RB', 'place/NN', 'go/VB', 'want/VB', 'impress/VB', 'someone/NN']"
"The svc can be a bit rude at times, esp if you have big group, but overall the restaurant is a must!",0,svc be bit rude time esp have big group restaurant be,NN VB JJ JJ NN RB VB JJ NN NN VB,"['svc/NN', 'be/VB', 'bit/JJ', 'rude/JJ', 'time/NN', 'esp/RB', 'have/VB', 'big/JJ', 'group/NN', 'restaurant/NN', 'be/VB']"
I would say that all was fine and tasty but the heaviness on my stomach someting that i can't not mention or undermine.,0,say be fine tasty heaviness stomach somete not undermine,VB VB JJ JJ NN NN VB RB NN,"['say/VB', 'be/VB', 'fine/JJ', 'tasty/JJ', 'heaviness/NN', 'stomach/NN', 'somete/VB', 'not/RB', 'undermine/NN']"
Never again!,0,never again,RB RB,"['never/RB', 'again/RB']"
The worst excuse for Japanese food I've ever encountered.,0,worst excuse japanese food ve ever encounter,JJ NN JJ NN NN RB VB,"['worst/JJ', 'excuse/NN', 'japanese/JJ', 'food/NN', 've/NN', 'ever/RB', 'encounter/VB']"
Not worth it.,0,not worth,RB JJ,"['not/RB', 'worth/JJ']"
He offers subpar service and has no personality.,0,offer subpar service have personality,VB JJ NN VB NN,"['offer/VB', 'subpar/JJ', 'service/NN', 'have/VB', 'personality/NN']"
The portions are small but being that the food was so good makes up for that.,0,portion be small be food be so good make,NN VB JJ VB NN VB RB JJ VB,"['portion/NN', 'be/VB', 'small/JJ', 'be/VB', 'food/NN', 'be/VB', 'so/RB', 'good/JJ', 'make/VB']"
Never again!,0,never again,RB RB,"['never/RB', 'again/RB']"
I was here a few weeks back and we had the worst customer service experience at a restaurant ever.,0,be here few week back have worst customer service experience restaurant ever,VB RB JJ NN RB VB JJ NN NN NN NN RB,"['be/VB', 'here/RB', 'few/JJ', 'week/NN', 'back/RB', 'have/VB', 'worst/JJ', 'customer/NN', 'service/NN', 'experience/NN', 'restaurant/NN', 'ever/RB']"
the all-u-can-eat sushi is definitely in very poor quality.,0,all eat sushi be definitely very poor quality,RB VB NN VB RB RB JJ NN,"['all/RB', 'eat/VB', 'sushi/NN', 'be/VB', 'definitely/RB', 'very/RB', 'poor/JJ', 'quality/NN']"
