sentence,sentiment,lem_words,lem_tags,word_tags
Went to Cafe Spice with 4 of my friends on a saturday night.,1,go cafe spice friend saturday night,VB NN NN NN NN NN,"['go/VB', 'cafe/NN', 'spice/NN', 'friend/NN', 'saturday/NN', 'night/NN']"
Visited there while on vacation and reading the reviews.,1,visit there vacation read reviews,VB RB NN VB NN,"['visit/VB', 'there/RB', 'vacation/NN', 'read/VB', 'reviews/NN']"
the food is decent.,1,food be decent,NN VB JJ,"['food/NN', 'be/VB', 'decent/JJ']"
We arrived on time for our reservation and seated promptly.,1,arrive time reservation seat promptly,VB NN NN VB RB,"['arrive/VB', 'time/NN', 'reservation/NN', 'seat/VB', 'promptly/RB']"
They are opening two more places as i saw a flyer there one in Yonkers which is a restraunt and banquet hall and another one in parsipanny new jersey.,1,be open more place see flyer there yonker be restraunt banquet hall one parsipanny new jersey,VB VB JJ NN VB NN RB NN VB NN NN NN NN JJ JJ NN,"['be/VB', 'open/VB', 'more/JJ', 'place/NN', 'see/VB', 'flyer/NN', 'there/RB', 'yonker/NN', 'be/VB', 'restraunt/NN', 'banquet/NN', 'hall/NN', 'one/NN', 'parsipanny/JJ', 'new/JJ', 'jersey/NN']"
"(i hang out, and live, in the neighborhood..) ",1,hang out live neighborhood,NN RB VB NN,"['hang/NN', 'out/RB', 'live/VB', 'neighborhood/NN']"
P.S. Please don't tell anyone in my family i eat there.,1,please don tell anyone family eat there,VB VB NN NN NN NN RB,"['please/VB', 'don/VB', 'tell/NN', 'anyone/NN', 'family/NN', 'eat/NN', 'there/RB']"
"Being serious sushi lovers, we sat at the sushi bar to be closer to the action.",1,be serious sushi lover sit sushi bar be closer action,VB JJ NN NN VB NN NN VB JJ NN,"['be/VB', 'serious/JJ', 'sushi/NN', 'lover/NN', 'sit/VB', 'sushi/NN', 'bar/NN', 'be/VB', 'closer/JJ', 'action/NN']"
"Next time, we wouldn't dare ordering anything else other than some simple Asian appetizers and drinks.",1,next time wouldn dare order anything else other simple asian appetizer drink,JJ NN VB VB VB NN RB JJ JJ NN NN NN,"['next/JJ', 'time/NN', 'wouldn/VB', 'dare/VB', 'order/VB', 'anything/NN', 'else/RB', 'other/JJ', 'simple/JJ', 'asian/NN', 'appetizer/NN', 'drink/NN']"
Service is average.,1,service be average,NN VB JJ,"['service/NN', 'be/VB', 'average/JJ']"
"I wasn't thrilled to have to wait on line for thirty minutes, but I guess that's the price you pay for a popular place.",1,wasn thrill have wait line minute guess price pay popular place,VB VB VB VB NN NN NN NN VB JJ NN,"['wasn/VB', 'thrill/VB', 'have/VB', 'wait/VB', 'line/NN', 'minute/NN', 'guess/NN', 'price/NN', 'pay/VB', 'popular/JJ', 'place/NN']"
enough said!,1,enough say,RB VB,"['enough/RB', 'say/VB']"
"After hearing a lot of great things about the restaurant, and passing by it on a daily basis, we decided to try.",1,hear lot great thing restaurant passing daily basis decide try,VB NN JJ NN NN NN JJ NN VB VB,"['hear/VB', 'lot/NN', 'great/JJ', 'thing/NN', 'restaurant/NN', 'passing/NN', 'daily/JJ', 'basis/NN', 'decide/VB', 'try/VB']"
We got most of it back at home with us.,1,get most back home,VB JJ RB NN,"['get/VB', 'most/JJ', 'back/RB', 'home/NN']"
but ive heard a lot about this for the past 2 yrs and finally decided to eat here.,1,ive lot past yr finally decide eat here,VB NN JJ NN RB VB VB RB,"['ive/VB', 'lot/NN', 'past/JJ', 'yr/NN', 'finally/RB', 'decide/VB', 'eat/VB', 'here/RB']"
However it is the ONLY Taiwanese restaurant in town.,1,however be only taiwanese restaurant town,RB VB JJ JJ NN NN,"['however/RB', 'be/VB', 'only/JJ', 'taiwanese/JJ', 'restaurant/NN', 'town/NN']"
"As a fan of Thai, I have tried quite a few different restaurants in NYC and this one was definitely the worst.",1,fan thai have try quite few different restaurant nyc one be definitely worst,NN NN VB VB RB JJ JJ NN NN NN VB RB JJ,"['fan/NN', 'thai/NN', 'have/VB', 'try/VB', 'quite/RB', 'few/JJ', 'different/JJ', 'restaurant/NN', 'nyc/NN', 'one/NN', 'be/VB', 'definitely/RB', 'worst/JJ']"
"Compared to other shabu restaurants around town, this places wins hands-down.",1,compare other shabu restaurant town place win hand,VB JJ NN NN NN NN VB NN,"['compare/VB', 'other/JJ', 'shabu/NN', 'restaurant/NN', 'town/NN', 'place/NN', 'win/VB', 'hand/NN']"
I went there in late afternoon for some bite size food and refleshment with my date.,1,go there late afternoon bite size food refleshment date,VB RB JJ NN JJ NN NN NN NN,"['go/VB', 'there/RB', 'late/JJ', 'afternoon/NN', 'bite/JJ', 'size/NN', 'food/NN', 'refleshment/NN', 'date/NN']"
I stumbled upon this second floor walk-up two Fridays ago when I was with two friends in town from L.A. ,1,stumble second floor walk friday be friend town,VB JJ NN VB NN VB NN NN,"['stumble/VB', 'second/JJ', 'floor/NN', 'walk/VB', 'friday/NN', 'be/VB', 'friend/NN', 'town/NN']"
I am going to the mid town location next.,1,be go mid town location next,VB VB JJ NN NN RB,"['be/VB', 'go/VB', 'mid/JJ', 'town/NN', 'location/NN', 'next/RB']"
Our friends have not arrived yet.,1,friend have not arrive yet,NN VB RB VB RB,"['friend/NN', 'have/VB', 'not/RB', 'arrive/VB', 'yet/RB']"
I had Filet Mignon with garlic mash.,1,have filet mignon garlic mash,VB NN NN NN NN,"['have/VB', 'filet/NN', 'mignon/NN', 'garlic/NN', 'mash/NN']"
instead ordered an ice cold beer which to me works with indian.,1,instead order ice cold beer work indian,RB VB NN JJ NN VB JJ,"['instead/RB', 'order/VB', 'ice/NN', 'cold/JJ', 'beer/NN', 'work/VB', 'indian/JJ']"
I have eaten a lot of pizza here.,1,have eat lot pizza here,VB VB NN NN RB,"['have/VB', 'eat/VB', 'lot/NN', 'pizza/NN', 'here/RB']"
Decent wine at reasonable prices.,1,decent wine reasonable price,JJ NN JJ NN,"['decent/JJ', 'wine/NN', 'reasonable/JJ', 'price/NN']"
"Downtown Dinner 2002 - Prixe fix: Appetizers were ok, waiter gave me poor suggestion..try the potato stuff kanish best one.",1,downtown dinner fix appetizer be waiter give poor suggestion try potato stuff kanish best,JJ NN VB NN VB NN VB JJ NN VB NN NN VB RB,"['downtown/JJ', 'dinner/NN', 'fix/VB', 'appetizer/NN', 'be/VB', 'waiter/NN', 'give/VB', 'poor/JJ', 'suggestion/NN', 'try/VB', 'potato/NN', 'stuff/NN', 'kanish/VB', 'best/RB']"
"The menu consisted of standard brassiere food, better then places like Balthazar etc.",1,menu consist standard brassiere food better then place balthazar etc,NN VB JJ NN NN RB RB VB NN NN,"['menu/NN', 'consist/VB', 'standard/JJ', 'brassiere/NN', 'food/NN', 'better/RB', 'then/RB', 'place/VB', 'balthazar/NN', 'etc/NN']"
"Compared to Ess-a, Tal offers a less doughy bagel!",1,compare es tal offer less doughy bagel,VB VB NN NN JJ JJ NN,"['compare/VB', 'es/VB', 'tal/NN', 'offer/NN', 'less/JJ', 'doughy/JJ', 'bagel/NN']"
I came into the city to try out this restaurant because a friend had recommended it to my husband.,1,come city try out restaurant friend have recommend husband,VB NN VB RB NN NN VB VB NN,"['come/VB', 'city/NN', 'try/VB', 'out/RB', 'restaurant/NN', 'friend/NN', 'have/VB', 'recommend/VB', 'husband/NN']"
Please be aware that it's CASH or AMEX only!,1,be aware cash amex only,VB JJ NN RB RB,"['be/VB', 'aware/JJ', 'cash/NN', 'amex/RB', 'only/RB']"
"To celebrate a birthday, three of us went to Mare anticipating great food.",1,celebrate birthday go mare anticipate great food,VB NN VB NN VB JJ NN,"['celebrate/VB', 'birthday/NN', 'go/VB', 'mare/NN', 'anticipate/VB', 'great/JJ', 'food/NN']"
"Among all of the new 5th avenue restaurants, this offers by far one of the best values for your money.",1,new avenue restaurant offer far best value money,JJ NN NN NN RB JJ NN NN,"['new/JJ', 'avenue/NN', 'restaurant/NN', 'offer/NN', 'far/RB', 'best/JJ', 'value/NN', 'money/NN']"
"As a fan of Thai, I have tried quite a few different restaurants in NYC and this one was definitely the worst.",1,fan thai have try quite few different restaurant nyc one be definitely worst,NN NN VB VB RB JJ JJ NN NN NN VB RB JJ,"['fan/NN', 'thai/NN', 'have/VB', 'try/VB', 'quite/RB', 'few/JJ', 'different/JJ', 'restaurant/NN', 'nyc/NN', 'one/NN', 'be/VB', 'definitely/RB', 'worst/JJ']"
Much more reasonably priced too!,1,much more reasonably price too,RB RB RB VB RB,"['much/RB', 'more/RB', 'reasonably/RB', 'price/VB', 'too/RB']"
We visited Orsay during NY Restaurant Week and tried their $35 menu.,1,visit orsay ny restaurant week try menu,VB JJ JJ NN NN VB NN,"['visit/VB', 'orsay/JJ', 'ny/JJ', 'restaurant/NN', 'week/NN', 'try/VB', 'menu/NN']"
We all ordered different entrees so we could share.,1,ordered different entree share,JJ JJ NN NN,"['ordered/JJ', 'different/JJ', 'entree/NN', 'share/NN']"
"While it's not Nobu, it sure is a great deal and you definitely will leave feeling satisfied and full.",1,not nobu sure be great deal definitely leave feeling satisfy full,RB JJ RB VB JJ NN RB VB NN VB JJ,"['not/RB', 'nobu/JJ', 'sure/RB', 'be/VB', 'great/JJ', 'deal/NN', 'definitely/RB', 'leave/VB', 'feeling/NN', 'satisfy/VB', 'full/JJ']"
"we were tired and cold when we got to the restaurant, then we sat down to begin ordering appetizers.",1,be tired cold get restaurant then sit begin order appetizer,VB JJ JJ VB NN RB VB VB VB NN,"['be/VB', 'tired/JJ', 'cold/JJ', 'get/VB', 'restaurant/NN', 'then/RB', 'sit/VB', 'begin/VB', 'order/VB', 'appetizer/NN']"
"You'll pay at least double at any other Italian restaurant in the city, and most still don't compare.",1,ll pay least double other italian restaurant city most still don compare,VB NN JJ JJ JJ JJ NN NN RB RB VB VB,"['ll/VB', 'pay/NN', 'least/JJ', 'double/JJ', 'other/JJ', 'italian/JJ', 'restaurant/NN', 'city/NN', 'most/RB', 'still/RB', 'don/VB', 'compare/VB']"
I'm sure I'll return for a final judgement tho.,1,sure ll return final judgement tho,JJ NN NN JJ NN NN,"['sure/JJ', 'll/NN', 'return/NN', 'final/JJ', 'judgement/NN', 'tho/NN']"
Everything we had was good or ok....but definitely nothing great.,1,everything have be good definitely nothing great,NN VB VB JJ RB NN JJ,"['everything/NN', 'have/VB', 'be/VB', 'good/JJ', 'definitely/RB', 'nothing/NN', 'great/JJ']"
"those rolls were big, but not good and sashimi wasn't fresh.",1,roll be big not good sashimi wasn fresh,NN VB JJ RB JJ NN VB JJ,"['roll/NN', 'be/VB', 'big/JJ', 'not/RB', 'good/JJ', 'sashimi/NN', 'wasn/VB', 'fresh/JJ']"
"Compared to Ess-a, Tal offers a less doughy bagel!",1,compare es tal offer less doughy bagel,VB VB NN NN JJ JJ NN,"['compare/VB', 'es/VB', 'tal/NN', 'offer/NN', 'less/JJ', 'doughy/JJ', 'bagel/NN']"
"As many other reviewers noticed, your order is often slow to arrive - this is particularly true in the evening but is not a problem during lunch time.",1,many other reviewer notice order be often slow arrive be particularly true evening be not problem lunch time,JJ JJ NN VB NN VB RB JJ VB VB RB JJ NN VB RB NN NN NN,"['many/JJ', 'other/JJ', 'reviewer/NN', 'notice/VB', 'order/NN', 'be/VB', 'often/RB', 'slow/JJ', 'arrive/VB', 'be/VB', 'particularly/RB', 'true/JJ', 'evening/NN', 'be/VB', 'not/RB', 'problem/NN', 'lunch/NN', 'time/NN']"
"You'll pay at least double at any other Italian restaurant in the city, and most still don't compare.",1,ll pay least double other italian restaurant city most still don compare,VB NN JJ JJ JJ JJ NN NN RB RB VB VB,"['ll/VB', 'pay/NN', 'least/JJ', 'double/JJ', 'other/JJ', 'italian/JJ', 'restaurant/NN', 'city/NN', 'most/RB', 'still/RB', 'don/VB', 'compare/VB']"
Kind of a small place but I guess if they are not too busy might be able to fit a group or kids.,1,kind small place guess be not too busy be able fit group kid,NN JJ NN NN VB RB RB JJ VB JJ VB NN NN,"['kind/NN', 'small/JJ', 'place/NN', 'guess/NN', 'be/VB', 'not/RB', 'too/RB', 'busy/JJ', 'be/VB', 'able/JJ', 'fit/VB', 'group/NN', 'kid/NN']"
"Rao is a good restaurant, but it's nothing special.",1,rao be good restaurant nothing special,NN VB JJ NN NN JJ,"['rao/NN', 'be/VB', 'good/JJ', 'restaurant/NN', 'nothing/NN', 'special/JJ']"
"Service is not exactly five star, but thats not really a big deal.",1,service be not exactly star that not really big deal,NN VB RB RB NN VB RB RB JJ NN,"['service/NN', 'be/VB', 'not/RB', 'exactly/RB', 'star/NN', 'that/VB', 'not/RB', 'really/RB', 'big/JJ', 'deal/NN']"
I had a huge pastrami sandwich on a roll.,1,have huge pastrami sandwich roll,VB JJ NN NN NN,"['have/VB', 'huge/JJ', 'pastrami/NN', 'sandwich/NN', 'roll/NN']"
"I love Ess-a-bagel, but I live on the west side, so I often go to Murray's for convenience.",1,love ess bagel live west side often go murray convenience,NN RB NN VB JJ NN RB VB VB NN,"['love/NN', 'ess/RB', 'bagel/NN', 'live/VB', 'west/JJ', 'side/NN', 'often/RB', 'go/VB', 'murray/VB', 'convenience/NN']"
"From the street it looks very hidden, and is actually an old warehouse.",1,street look very hidden be actually old warehouse,NN VB RB JJ VB RB JJ NN,"['street/NN', 'look/VB', 'very/RB', 'hidden/JJ', 'be/VB', 'actually/RB', 'old/JJ', 'warehouse/NN']"
"Having hunted around for a quiet, romantic, yet not hideously expensive restaurant I stumbled across reviews for La Lanterna and gave it a shot.",1,have hunt quiet romantic yet not hideously expensive restaurant stumble reviews la lanterna give shot,VB VB JJ JJ RB RB RB JJ NN VB NN NN NN VB NN,"['have/VB', 'hunt/VB', 'quiet/JJ', 'romantic/JJ', 'yet/RB', 'not/RB', 'hideously/RB', 'expensive/JJ', 'restaurant/NN', 'stumble/VB', 'reviews/NN', 'la/NN', 'lanterna/NN', 'give/VB', 'shot/NN']"
I stumbled upon this second floor walk-up two Fridays ago when I was with two friends in town from L.A. ,1,stumble second floor walk friday be friend town,VB JJ NN VB NN VB NN NN,"['stumble/VB', 'second/JJ', 'floor/NN', 'walk/VB', 'friday/NN', 'be/VB', 'friend/NN', 'town/NN']"
"As we were leaving, the couple standing by the door said to another waiter, we're not in a hurry.",1,be leave couple standing door say waiter re not hurry,VB VB NN NN NN VB NN NN RB NN,"['be/VB', 'leave/VB', 'couple/NN', 'standing/NN', 'door/NN', 'say/VB', 'waiter/NN', 're/NN', 'not/RB', 'hurry/NN']"
Moderate prices.,1,moderate price,JJ NN,"['moderate/JJ', 'price/NN']"
(1) turnip cakes at the little kiosk on east side of Mott St. just south of bayard,1,turnip cake little kiosk east side mott st just south bayard,NN NN JJ NN JJ NN JJ NN RB RB NN,"['turnip/NN', 'cake/NN', 'little/JJ', 'kiosk/NN', 'east/JJ', 'side/NN', 'mott/JJ', 'st/NN', 'just/RB', 'south/RB', 'bayard/NN']"
"Recommendations, of course, are required!",1,recommendation course be require,NN NN VB VB,"['recommendation/NN', 'course/NN', 'be/VB', 'require/VB']"
Arigato Gozimas Yuka!,1,arigato gozimas yuka,NN NN NN,"['arigato/NN', 'gozimas/NN', 'yuka/NN']"
Will give it another chance before I write it off.,1,give chance,VB NN,"['give/VB', 'chance/NN']"
"Same owner as the guy who owns Typhoon, which is just down the street on St. Marks and 1st Ave.",1,same owner guy own typhoon be just street st mark st ave,JJ NN NN VB NN VB RB NN NN NN NN VB,"['same/JJ', 'owner/NN', 'guy/NN', 'own/VB', 'typhoon/NN', 'be/VB', 'just/RB', 'street/NN', 'st/NN', 'mark/NN', 'st/NN', 'ave/VB']"
"Still, any quibbles about the bill were off-set by the pour-your-own measures of liquers which were courtesey of the house...",1,still quibble bill be off set pour own measure liquer be courtesey house,RB NN NN VB RB NN NN JJ NN NN VB NN NN,"['still/RB', 'quibble/NN', 'bill/NN', 'be/VB', 'off/RB', 'set/NN', 'pour/NN', 'own/JJ', 'measure/NN', 'liquer/NN', 'be/VB', 'courtesey/NN', 'house/NN']"
"Compared to other shabu restaurants around town, this places wins hands-down.",1,compare other shabu restaurant town place win hand,VB JJ NN NN NN NN VB NN,"['compare/VB', 'other/JJ', 'shabu/NN', 'restaurant/NN', 'town/NN', 'place/NN', 'win/VB', 'hand/NN']"
"Food was just average...if they lowered the prices just a bit, it would be a bigger draw.",1,food be just average lower price just bit be bigger draw,NN VB RB JJ VB NN RB NN VB JJ VB,"['food/NN', 'be/VB', 'just/RB', 'average/JJ', 'lower/VB', 'price/NN', 'just/RB', 'bit/NN', 'be/VB', 'bigger/JJ', 'draw/VB']"
"Rao is a good restaurant, but it's nothing special.",1,rao be good restaurant nothing special,NN VB JJ NN NN JJ,"['rao/NN', 'be/VB', 'good/JJ', 'restaurant/NN', 'nothing/NN', 'special/JJ']"
I just read Mocaramel's review and felt compelled to respond.,1,just read mocaramel review feel compel respond,RB VB NN NN VB VB VB,"['just/RB', 'read/VB', 'mocaramel/NN', 'review/NN', 'feel/VB', 'compel/VB', 'respond/VB']"
I sometimes see the waiters don't have enough knowledge of their dishes.,1,sometimes see waiter don have enough knowledge dish,RB VB NN VB VB JJ NN NN,"['sometimes/RB', 'see/VB', 'waiter/NN', 'don/VB', 'have/VB', 'enough/JJ', 'knowledge/NN', 'dish/NN']"
Visited there while on vacation and reading the reviews.,1,visit there vacation read reviews,VB RB NN VB NN,"['visit/VB', 'there/RB', 'vacation/NN', 'read/VB', 'reviews/NN']"
but ive heard a lot about this for the past 2 yrs and finally decided to eat here.,1,ive lot past yr finally decide eat here,VB NN JJ NN RB VB VB RB,"['ive/VB', 'lot/NN', 'past/JJ', 'yr/NN', 'finally/RB', 'decide/VB', 'eat/VB', 'here/RB']"
Arigato Gozimas Yuka!,1,arigato gozimas yuka,NN NN NN,"['arigato/NN', 'gozimas/NN', 'yuka/NN']"
less wait time for me!,1,less wait time,JJ JJ NN,"['less/JJ', 'wait/JJ', 'time/NN']"
I lived in Maine for ten years and grew up on fish.,1,live maine year grow fish,VB NN NN VB NN,"['live/VB', 'maine/NN', 'year/NN', 'grow/VB', 'fish/NN']"
"I wasn't thrilled to have to wait on line for thirty minutes, but I guess that's the price you pay for a popular place.",1,wasn thrill have wait line minute guess price pay popular place,VB VB VB VB NN NN NN NN VB JJ NN,"['wasn/VB', 'thrill/VB', 'have/VB', 'wait/VB', 'line/NN', 'minute/NN', 'guess/NN', 'price/NN', 'pay/VB', 'popular/JJ', 'place/NN']"
"No, really.",1,really,RB,['really/RB']
"Yeah the crowd can take it a bit seriously, but it shouldn't.",1,crowd take bit seriously shouldn,NN VB NN RB VB,"['crowd/NN', 'take/VB', 'bit/NN', 'seriously/RB', 'shouldn/VB']"
instead ordered an ice cold beer which to me works with indian.,1,instead order ice cold beer work indian,RB VB NN JJ NN VB JJ,"['instead/RB', 'order/VB', 'ice/NN', 'cold/JJ', 'beer/NN', 'work/VB', 'indian/JJ']"
"I love Ess-a-bagel, but I live on the west side, so I often go to Murray's for convenience.",1,love ess bagel live west side often go murray convenience,NN RB NN VB JJ NN RB VB VB NN,"['love/NN', 'ess/RB', 'bagel/NN', 'live/VB', 'west/JJ', 'side/NN', 'often/RB', 'go/VB', 'murray/VB', 'convenience/NN']"
enough said!,1,enough say,RB VB,"['enough/RB', 'say/VB']"
Old school meets New world.,1,old school meet new world,JJ NN VB JJ NN,"['old/JJ', 'school/NN', 'meet/VB', 'new/JJ', 'world/NN']"
We have lived in Chelsea for two years and have never noticed this restaurant.,1,have live chelsea year have never notice restaurant,VB VB NN NN VB RB VB NN,"['have/VB', 'live/VB', 'chelsea/NN', 'year/NN', 'have/VB', 'never/RB', 'notice/VB', 'restaurant/NN']"
"From the street it looks very hidden, and is actually an old warehouse.",1,street look very hidden be actually old warehouse,NN VB RB JJ VB RB JJ NN,"['street/NN', 'look/VB', 'very/RB', 'hidden/JJ', 'be/VB', 'actually/RB', 'old/JJ', 'warehouse/NN']"
My son and his girlfriend both wanted cheeseburgers and they were huge!,1,son girlfriend want cheeseburger be huge,NN NN VB NN VB JJ,"['son/NN', 'girlfriend/NN', 'want/VB', 'cheeseburger/NN', 'be/VB', 'huge/JJ']"
"A large is $20, and toppings are about $3 each.",1,large be topping be,JJ VB NN VB,"['large/JJ', 'be/VB', 'topping/NN', 'be/VB']"
I went there in late afternoon for some bite size food and refleshment with my date.,1,go there late afternoon bite size food refleshment date,VB RB JJ NN JJ NN NN NN NN,"['go/VB', 'there/RB', 'late/JJ', 'afternoon/NN', 'bite/JJ', 'size/NN', 'food/NN', 'refleshment/NN', 'date/NN']"
"The menu consisted of standard brassiere food, better then places like Balthazar etc.",1,menu consist standard brassiere food better then place balthazar etc,NN VB JJ NN NN RB RB VB NN NN,"['menu/NN', 'consist/VB', 'standard/JJ', 'brassiere/NN', 'food/NN', 'better/RB', 'then/RB', 'place/VB', 'balthazar/NN', 'etc/NN']"
You fellas above says its the best Taiwanese restaurant in town.,1,fella say best restaurant town,NN VB JJ NN NN,"['fella/NN', 'say/VB', 'best/JJ', 'restaurant/NN', 'town/NN']"
Stuffing yourself with Japanese food is a rare thing.,1,stuff japanese food be rare thing,VB JJ NN VB JJ NN,"['stuff/VB', 'japanese/JJ', 'food/NN', 'be/VB', 'rare/JJ', 'thing/NN']"
(2) egg custards and pork buns at either bakery on west side of Mott street just south of Canal.,1,egg custard pork bun bakery west side mott street just south canal,NN NN NN NN NN JJ NN JJ NN RB RB NN,"['egg/NN', 'custard/NN', 'pork/NN', 'bun/NN', 'bakery/NN', 'west/JJ', 'side/NN', 'mott/JJ', 'street/NN', 'just/RB', 'south/RB', 'canal/NN']"
"Bagels are ok, but be sure not to make any special requests!",1,bagel be be sure not make special request,NN VB VB JJ RB VB JJ NN,"['bagel/NN', 'be/VB', 'be/VB', 'sure/JJ', 'not/RB', 'make/VB', 'special/JJ', 'request/NN']"
They are opening two more places as i saw a flyer there one in Yonkers which is a restraunt and banquet hall and another one in parsipanny new jersey.,1,be open more place see flyer there yonker be restraunt banquet hall one parsipanny new jersey,VB VB JJ NN VB NN RB NN VB NN NN NN NN JJ JJ NN,"['be/VB', 'open/VB', 'more/JJ', 'place/NN', 'see/VB', 'flyer/NN', 'there/RB', 'yonker/NN', 'be/VB', 'restraunt/NN', 'banquet/NN', 'hall/NN', 'one/NN', 'parsipanny/JJ', 'new/JJ', 'jersey/NN']"
"Still, any quibbles about the bill were off-set by the pour-your-own measures of liquers which were courtesey of the house...",1,still quibble bill be off set pour own measure liquer be courtesey house,RB NN NN VB RB NN NN JJ NN NN VB NN NN,"['still/RB', 'quibble/NN', 'bill/NN', 'be/VB', 'off/RB', 'set/NN', 'pour/NN', 'own/JJ', 'measure/NN', 'liquer/NN', 'be/VB', 'courtesey/NN', 'house/NN']"
"From the street it looks very hidden, and is actually an old warehouse.",1,street look very hidden be actually old warehouse,NN VB RB JJ VB RB JJ NN,"['street/NN', 'look/VB', 'very/RB', 'hidden/JJ', 'be/VB', 'actually/RB', 'old/JJ', 'warehouse/NN']"
Will give it another chance before I write it off.,1,give chance,VB NN,"['give/VB', 'chance/NN']"
I sometimes see the waiters don't have enough knowledge of their dishes.,1,sometimes see waiter don have enough knowledge dish,RB VB NN VB VB JJ NN NN,"['sometimes/RB', 'see/VB', 'waiter/NN', 'don/VB', 'have/VB', 'enough/JJ', 'knowledge/NN', 'dish/NN']"
"I was in love with Pongsri on 48th, but compared to Suan it is slow in service and overpriced.",1,be love pongsri compare suan be slow service overpriced,VB NN NN VB VB VB JJ NN JJ,"['be/VB', 'love/NN', 'pongsri/NN', 'compare/VB', 'suan/VB', 'be/VB', 'slow/JJ', 'service/NN', 'overpriced/JJ']"
Sit outside in the warm weather; inside for cozy winter.,1,sit outside warm weather inside cozy winter,NN NN JJ NN NN JJ NN,"['sit/NN', 'outside/NN', 'warm/JJ', 'weather/NN', 'inside/NN', 'cozy/JJ', 'winter/NN']"
"Inside is a little cramped, but to be expected.",1,inside be little cramped be expect,NN VB JJ JJ VB VB,"['inside/NN', 'be/VB', 'little/JJ', 'cramped/JJ', 'be/VB', 'expect/VB']"
less wait time for me!,1,less wait time,JJ JJ NN,"['less/JJ', 'wait/JJ', 'time/NN']"
"Compared to Ess-a, Tal offers a less doughy bagel!",1,compare es tal offer less doughy bagel,VB VB NN NN JJ JJ NN,"['compare/VB', 'es/VB', 'tal/NN', 'offer/NN', 'less/JJ', 'doughy/JJ', 'bagel/NN']"
You fellas above says its the best Taiwanese restaurant in town.,1,fella say best restaurant town,NN VB JJ NN NN,"['fella/NN', 'say/VB', 'best/JJ', 'restaurant/NN', 'town/NN']"
(2) egg custards and pork buns at either bakery on west side of Mott street just south of Canal.,1,egg custard pork bun bakery west side mott street just south canal,NN NN NN NN NN JJ NN JJ NN RB RB NN,"['egg/NN', 'custard/NN', 'pork/NN', 'bun/NN', 'bakery/NN', 'west/JJ', 'side/NN', 'mott/JJ', 'street/NN', 'just/RB', 'south/RB', 'canal/NN']"
I'm sure I'll return for a final judgement tho.,1,sure ll return final judgement tho,JJ NN NN JJ NN NN,"['sure/JJ', 'll/NN', 'return/NN', 'final/JJ', 'judgement/NN', 'tho/NN']"
I stumbled upon this second floor walk-up two Fridays ago when I was with two friends in town from L.A. ,1,stumble second floor walk friday be friend town,VB JJ NN VB NN VB NN NN,"['stumble/VB', 'second/JJ', 'floor/NN', 'walk/VB', 'friday/NN', 'be/VB', 'friend/NN', 'town/NN']"
"I am not the most experienced person when it comes to Thai food, but my friend who took me there is.",1,be not most experienced person come thai food friend take be,VB RB RB JJ NN VB VB NN NN VB VB,"['be/VB', 'not/RB', 'most/RB', 'experienced/JJ', 'person/NN', 'come/VB', 'thai/VB', 'food/NN', 'friend/NN', 'take/VB', 'be/VB']"
"I love Ess-a-bagel, but I live on the west side, so I often go to Murray's for convenience.",1,love ess bagel live west side often go murray convenience,NN RB NN VB JJ NN RB VB VB NN,"['love/NN', 'ess/RB', 'bagel/NN', 'live/VB', 'west/JJ', 'side/NN', 'often/RB', 'go/VB', 'murray/VB', 'convenience/NN']"
"I am not the most experienced person when it comes to Thai food, but my friend who took me there is.",1,be not most experienced person come thai food friend take be,VB RB RB JJ NN VB VB NN NN VB VB,"['be/VB', 'not/RB', 'most/RB', 'experienced/JJ', 'person/NN', 'come/VB', 'thai/VB', 'food/NN', 'friend/NN', 'take/VB', 'be/VB']"
You fellas above says its the best Taiwanese restaurant in town.,1,fella say best restaurant town,NN VB JJ NN NN,"['fella/NN', 'say/VB', 'best/JJ', 'restaurant/NN', 'town/NN']"
This place is always packed.,1,place be always pack,NN VB RB VB,"['place/NN', 'be/VB', 'always/RB', 'pack/VB']"
(2) egg custards and pork buns at either bakery on west side of Mott street just south of Canal.,1,egg custard pork bun bakery west side mott street just south canal,NN NN NN NN NN JJ NN JJ NN RB RB NN,"['egg/NN', 'custard/NN', 'pork/NN', 'bun/NN', 'bakery/NN', 'west/JJ', 'side/NN', 'mott/JJ', 'street/NN', 'just/RB', 'south/RB', 'canal/NN']"
