sentence,sentiment,lem_words,lem_tags,word_tags
If you want something really different than try Jekyll and Hyde.,2,want something really different try jekyll hyde,VB NN RB JJ NN NN NN,"['want/VB', 'something/NN', 'really/RB', 'different/JJ', 'try/NN', 'jekyll/NN', 'hyde/NN']"
"The food is good, I can't lie.",2,food be good lie,NN VB JJ VB,"['food/NN', 'be/VB', 'good/JJ', 'lie/VB']"
I am happy i did the food was awsome.,2,be happy do food be,VB JJ VB NN VB,"['be/VB', 'happy/JJ', 'do/VB', 'food/NN', 'be/VB']"
"They have it all -- great price, food, and service.",2,have great price food service,VB JJ NN NN NN,"['have/VB', 'great/JJ', 'price/NN', 'food/NN', 'service/NN']"
We weren't!,2,weren,VB,['weren/VB']
I really recommend the very simple Unda (Egg) rolls.,2,really recommend very simple unda egg roll,RB VB RB JJ NN NN NN,"['really/RB', 'recommend/VB', 'very/RB', 'simple/JJ', 'unda/NN', 'egg/NN', 'roll/NN']"
I can't wait to go back.,2,wait go back,VB VB RB,"['wait/VB', 'go/VB', 'back/RB']"
"Good spreads, great beverage selections and bagels really tasty.",2,good spread great beverage selection bagel really tasty,JJ NN JJ NN NN NN RB JJ,"['good/JJ', 'spread/NN', 'great/JJ', 'beverage/NN', 'selection/NN', 'bagel/NN', 'really/RB', 'tasty/JJ']"
I cannot imagine you not rushing out to eat there.,2,imagine not rush eat,VB RB VB VB,"['imagine/VB', 'not/RB', 'rush/VB', 'eat/VB']"
Yakitori (bbq meats) is tasty too.,2,yakitori bbq meat be tasty too,NN NN NN VB JJ RB,"['yakitori/NN', 'bbq/NN', 'meat/NN', 'be/VB', 'tasty/JJ', 'too/RB']"
"It was the first place we ate on our first trip to New York, and it will be the last place we stop as we head out of town on our next trip to New York.",2,be first place eat first trip new york be last place stop head town next trip new york,VB JJ NN VB JJ NN NN NN VB JJ NN VB VB NN JJ NN NN NN,"['be/VB', 'first/JJ', 'place/NN', 'eat/VB', 'first/JJ', 'trip/NN', 'new/NN', 'york/NN', 'be/VB', 'last/JJ', 'place/NN', 'stop/VB', 'head/VB', 'town/NN', 'next/JJ', 'trip/NN', 'new/NN', 'york/NN']"
Decent wine at reasonable prices.,2,decent wine reasonable price,JJ NN JJ NN,"['decent/JJ', 'wine/NN', 'reasonable/JJ', 'price/NN']"
Service was also very good.,2,service be also very good,NN VB RB RB JJ,"['service/NN', 'be/VB', 'also/RB', 'very/RB', 'good/JJ']"
"To be completely fair, the only redeeming factor was the food, which was above average, but couldn't make up for all the other deficiencies of Teodora.",2,be completely fair only redeeming factor be food be above average couldn make other deficiency teodora,VB RB JJ RB JJ NN VB NN VB JJ NN JJ VB JJ NN NN,"['be/VB', 'completely/RB', 'fair/JJ', 'only/RB', 'redeeming/JJ', 'factor/NN', 'be/VB', 'food/NN', 'be/VB', 'above/JJ', 'average/NN', 'couldn/JJ', 'make/VB', 'other/JJ', 'deficiency/NN', 'teodora/NN']"
"And it all comes at a very reasonable price (congee, noodles, and rice dishes are no more than $3-6 each).",2,come very reasonable price congee noodle rice dish be no more,VB RB JJ NN JJ NN NN NN VB RB JJ,"['come/VB', 'very/RB', 'reasonable/JJ', 'price/NN', 'congee/JJ', 'noodle/NN', 'rice/NN', 'dish/NN', 'be/VB', 'no/RB', 'more/JJ']"
Great atmoshere and worth every bit.,2,great atmoshere worth bit,JJ NN NN NN,"['great/JJ', 'atmoshere/NN', 'worth/NN', 'bit/NN']"
"I found the food, service and value exceptional everytime I have been there.",2,find food service value exceptional everytime have be there,VB NN NN NN JJ NN VB VB RB,"['find/VB', 'food/NN', 'service/NN', 'value/NN', 'exceptional/JJ', 'everytime/NN', 'have/VB', 'be/VB', 'there/RB']"
The filet mignon dish was superb!,2,filet mignon dish be superb,NN NN NN VB JJ,"['filet/NN', 'mignon/NN', 'dish/NN', 'be/VB', 'superb/JJ']"
I've lived in NY for 5 years and this place has it all.,2,ve live ny year place have,NN VB NN NN NN VB,"['ve/NN', 'live/VB', 'ny/NN', 'year/NN', 'place/NN', 'have/VB']"
Very affordable and excellent ambient!,2,very affordable excellent ambient,RB JJ JJ NN,"['very/RB', 'affordable/JJ', 'excellent/JJ', 'ambient/NN']"
"The atmosphere is nothing special, but it feels like a Sushi establishment in Tokyo.",2,atmosphere be nothing special feel sushi establishment tokyo,NN VB NN JJ VB NN NN NN,"['atmosphere/NN', 'be/VB', 'nothing/NN', 'special/JJ', 'feel/VB', 'sushi/NN', 'establishment/NN', 'tokyo/NN']"
Warm and friendly in the winter and terrific outdoor seating in the warmer months.,2,warm friendly winter terrific outdoor seating warmer month,JJ JJ NN JJ JJ NN JJ NN,"['warm/JJ', 'friendly/JJ', 'winter/NN', 'terrific/JJ', 'outdoor/JJ', 'seating/NN', 'warmer/JJ', 'month/NN']"
I lOVE THIS PLACE!,2,love place,NN NN,"['love/NN', 'place/NN']"
We were 4 and got the family size penne a la vodka which was tremendously gigantic portion...a bucket of food literally.,2,be get family size penne la vodka be tremendously gigantic portion bucket food literally,VB VB NN NN VB JJ NN VB RB JJ NN NN NN RB,"['be/VB', 'get/VB', 'family/NN', 'size/NN', 'penne/VB', 'la/JJ', 'vodka/NN', 'be/VB', 'tremendously/RB', 'gigantic/JJ', 'portion/NN', 'bucket/NN', 'food/NN', 'literally/RB']"
"Considering we were the last patrons there and it was after the closing time, the waitstaff did not rush us at all and made us feel comfortable and relaxed.",2,consider be last patron there be closing time waitstaff do not rush make feel comfortable relax,VB VB JJ NN RB VB JJ NN NN VB RB VB VB VB JJ VB,"['consider/VB', 'be/VB', 'last/JJ', 'patron/NN', 'there/RB', 'be/VB', 'closing/JJ', 'time/NN', 'waitstaff/NN', 'do/VB', 'not/RB', 'rush/VB', 'make/VB', 'feel/VB', 'comfortable/JJ', 'relax/VB']"
The wine list is extensive and impressive.,2,wine list be extensive impressive,NN NN VB JJ JJ,"['wine/NN', 'list/NN', 'be/VB', 'extensive/JJ', 'impressive/JJ']"
I had the best ravioli ever.,2,have best ravioli ever,VB JJ NN RB,"['have/VB', 'best/JJ', 'ravioli/NN', 'ever/RB']"
Get the pepperoni - YUM - and a family style salad.,2,get pepperoni yum family style salad,VB NN NN NN NN NN,"['get/VB', 'pepperoni/NN', 'yum/NN', 'family/NN', 'style/NN', 'salad/NN']"
"The have over 100 different beers to offer thier guest so that made my husband very happy and the food was delicious, if I must recommend a dish it must be the pumkin tortelini.",2,have different beer offer thier guest make husband very happy food be delicious recommend dish be pumkin tortelini,VB JJ NN VB JJ NN VB NN RB JJ NN VB JJ VB NN VB NN NN,"['have/VB', 'different/JJ', 'beer/NN', 'offer/VB', 'thier/JJ', 'guest/NN', 'make/VB', 'husband/NN', 'very/RB', 'happy/JJ', 'food/NN', 'be/VB', 'delicious/JJ', 'recommend/VB', 'dish/NN', 'be/VB', 'pumkin/NN', 'tortelini/NN']"
Best Taiwanese food in NY!,2,best food ny,VB NN NN,"['best/VB', 'food/NN', 'ny/NN']"
"This place is really trendi but they have forgotten about the most important part of a  restaurant, the food.",2,place be really trendi have forget most important part restaurant food,NN VB RB NN VB VB RB JJ NN NN NN,"['place/NN', 'be/VB', 'really/RB', 'trendi/NN', 'have/VB', 'forget/VB', 'most/RB', 'important/JJ', 'part/NN', 'restaurant/NN', 'food/NN']"
HIGHLY RECOMMENDED!!!!!,2,highly recommend,RB VB,"['highly/RB', 'recommend/VB']"
I cannot imagine better Indian food in all of the city.,2,imagine better indian food city,VB RB JJ NN NN,"['imagine/VB', 'better/RB', 'indian/JJ', 'food/NN', 'city/NN']"
This is an amazing place to try some roti rolls.,2,be amazing place try roti roll,VB JJ NN VB JJ NN,"['be/VB', 'amazing/JJ', 'place/NN', 'try/VB', 'roti/JJ', 'roll/NN']"
The service was excellent and the food was delicious.,2,service be excellent food be delicious,NN VB JJ NN VB JJ,"['service/NN', 'be/VB', 'excellent/JJ', 'food/NN', 'be/VB', 'delicious/JJ']"
Good for dates or with friends.,2,good date friend,JJ NN NN,"['good/JJ', 'date/NN', 'friend/NN']"
I have to say I have never had a disapointing meal here.,2,have say have never have disapointing meal here,VB VB VB RB VB NN NN RB,"['have/VB', 'say/VB', 'have/VB', 'never/RB', 'have/VB', 'disapointing/NN', 'meal/NN', 'here/RB']"
I have been to Casimir over 5 times and I have always had a great time there.,2,have be casimir time have always have great time there,VB VB VB NN VB RB VB JJ NN RB,"['have/VB', 'be/VB', 'casimir/VB', 'time/NN', 'have/VB', 'always/RB', 'have/VB', 'great/JJ', 'time/NN', 'there/RB']"
"The freshest, best variety, and the fastest delivery.",2,freshest variety fastest delivery,JJ NN JJ NN,"['freshest/JJ', 'variety/NN', 'fastest/JJ', 'delivery/NN']"
The restaurant is a bit noisy but that is something that can be overlooked once you sit down and enjoy a great meal,2,restaurant be bit noisy be something be overlook once sit down enjoy great meal,NN VB NN JJ VB NN VB VB RB VB RB VB JJ NN,"['restaurant/NN', 'be/VB', 'bit/NN', 'noisy/JJ', 'be/VB', 'something/NN', 'be/VB', 'overlook/VB', 'once/RB', 'sit/VB', 'down/RB', 'enjoy/VB', 'great/JJ', 'meal/NN']"
"As a retired hipster, I can say with some degree of certainty that for the last year Lucky Strike has been the best laid-back late night in the city.",2,retired hipster say degree certainty last year lucky strike have be best layer back late night city,JJ NN VB NN NN JJ NN JJ NN VB VB JJ VB RB JJ NN NN,"['retired/JJ', 'hipster/NN', 'say/VB', 'degree/NN', 'certainty/NN', 'last/JJ', 'year/NN', 'lucky/JJ', 'strike/NN', 'have/VB', 'be/VB', 'best/JJ', 'layer/VB', 'back/RB', 'late/JJ', 'night/NN', 'city/NN']"
Myagi is one of my favorite restaurants in the City; the place the negative reviews describe sound like they were somewhere else.,2,myagi be favorite restaurant city place negative reviews describe sound be somewhere else,NN VB JJ NN NN NN JJ NN NN NN VB RB RB,"['myagi/NN', 'be/VB', 'favorite/JJ', 'restaurant/NN', 'city/NN', 'place/NN', 'negative/JJ', 'reviews/NN', 'describe/NN', 'sound/NN', 'be/VB', 'somewhere/RB', 'else/RB']"
You must have the crabmeat lasagna which is out of this world and the chocolate bread pudding for dessert.,2,have crabmeat lasagna be world chocolate bread pudding dessert,VB NN NN VB NN NN NN NN NN,"['have/VB', 'crabmeat/NN', 'lasagna/NN', 'be/VB', 'world/NN', 'chocolate/NN', 'bread/NN', 'pudding/NN', 'dessert/NN']"
And really large portions.,2,really large portion,RB JJ NN,"['really/RB', 'large/JJ', 'portion/NN']"
"Nice atmosphere, the service was very pleasant and the desert was good.",2,nice atmosphere service be very pleasant desert be good,JJ NN NN VB RB JJ NN VB JJ,"['nice/JJ', 'atmosphere/NN', 'service/NN', 'be/VB', 'very/RB', 'pleasant/JJ', 'desert/NN', 'be/VB', 'good/JJ']"
highly recommended.,2,highly recommend,RB VB,"['highly/RB', 'recommend/VB']"
"I choose to go with one of the special, the braised lamb shank in red wine, which was excellent.",2,choose go special braise lamb shank red wine be excellent,VB VB JJ VB NN NN JJ NN VB JJ,"['choose/VB', 'go/VB', 'special/JJ', 'braise/VB', 'lamb/NN', 'shank/NN', 'red/JJ', 'wine/NN', 'be/VB', 'excellent/JJ']"
"The whole set up is truly unprofessional and I wish Cafe Noir would get some good staff, because despite the current one this is a great place.",2,whole set be truly unprofessional wish cafe get good staff current one be great place,VB VB VB RB JJ NN NN VB JJ NN JJ NN VB JJ NN,"['whole/VB', 'set/VB', 'be/VB', 'truly/RB', 'unprofessional/JJ', 'wish/NN', 'cafe/NN', 'get/VB', 'good/JJ', 'staff/NN', 'current/JJ', 'one/NN', 'be/VB', 'great/JJ', 'place/NN']"
"The vibe is very relaxed and cozy, service was great and the food was excellent!",2,vibe be very relaxed cozy service be great food be excellent,NN VB RB JJ JJ NN VB JJ NN VB JJ,"['vibe/NN', 'be/VB', 'very/RB', 'relaxed/JJ', 'cozy/JJ', 'service/NN', 'be/VB', 'great/JJ', 'food/NN', 'be/VB', 'excellent/JJ']"
"The signs, the specials menus, food, and even all the waitstaff are ALL TOTALLY Japanese.",2,sign special menu food even waitstaff be totally japanese,NN NN NN NN RB NN VB RB JJ,"['sign/NN', 'special/NN', 'menu/NN', 'food/NN', 'even/RB', 'waitstaff/NN', 'be/VB', 'totally/RB', 'japanese/JJ']"
"Always a nice crowd, but never loud.",2,always nice crowd never loud,RB JJ NN RB JJ,"['always/RB', 'nice/JJ', 'crowd/NN', 'never/RB', 'loud/JJ']"
My roommate and I LOVE this place.,2,roommate love place,NN NN NN,"['roommate/NN', 'love/NN', 'place/NN']"
"sometimes i get bad food and bad service, sometimes i get good good and bad service.",2,sometimes get bad food bad service sometimes get good good bad service,RB VB JJ NN JJ NN RB VB JJ JJ JJ NN,"['sometimes/RB', 'get/VB', 'bad/JJ', 'food/NN', 'bad/JJ', 'service/NN', 'sometimes/RB', 'get/VB', 'good/JJ', 'good/JJ', 'bad/JJ', 'service/NN']"
The food can get pricey but the prixe fixe tasting menu is the greatest food for a good price and they cater the food to any food allergies or food you don't like.,2,food get pricey prixe fixe taste menu be greatest food good price cater food food allergy food don,NN VB JJ NN NN VB NN VB JJ NN JJ NN VB NN NN NN NN VB,"['food/NN', 'get/VB', 'pricey/JJ', 'prixe/NN', 'fixe/NN', 'taste/VB', 'menu/NN', 'be/VB', 'greatest/JJ', 'food/NN', 'good/JJ', 'price/NN', 'cater/VB', 'food/NN', 'food/NN', 'allergy/NN', 'food/NN', 'don/VB']"
This was a great surprise.,2,be great surprise,VB JJ NN,"['be/VB', 'great/JJ', 'surprise/NN']"
It was wonderful.,2,be wonderful,VB JJ,"['be/VB', 'wonderful/JJ']"
"The have over 100 different beers to offer thier guest so that made my husband very happy and the food was delicious, if I must recommend a dish it must be the pumkin tortelini.",2,have different beer offer thier guest make husband very happy food be delicious recommend dish be pumkin tortelini,VB JJ NN VB JJ NN VB NN RB JJ NN VB JJ VB NN VB NN NN,"['have/VB', 'different/JJ', 'beer/NN', 'offer/VB', 'thier/JJ', 'guest/NN', 'make/VB', 'husband/NN', 'very/RB', 'happy/JJ', 'food/NN', 'be/VB', 'delicious/JJ', 'recommend/VB', 'dish/NN', 'be/VB', 'pumkin/NN', 'tortelini/NN']"
"Still, any quibbles about the bill were off-set by the pour-your-own measures of liquers which were courtesey of the house...",2,still quibble bill be off set pour own measure liquer be courtesey house,RB NN NN VB RB NN NN JJ NN NN VB NN NN,"['still/RB', 'quibble/NN', 'bill/NN', 'be/VB', 'off/RB', 'set/NN', 'pour/NN', 'own/JJ', 'measure/NN', 'liquer/NN', 'be/VB', 'courtesey/NN', 'house/NN']"
Great sushi experience.,2,great sushi experience,JJ NN NN,"['great/JJ', 'sushi/NN', 'experience/NN']"
A restaurant that doesn't try to do anything except serve great food with great service in a pleasant atmosphere.,2,restaurant doesn try do anything serve great food great service pleasant atmosphere,NN VB NN VB NN NN JJ NN JJ NN JJ NN,"['restaurant/NN', 'doesn/VB', 'try/NN', 'do/VB', 'anything/NN', 'serve/NN', 'great/JJ', 'food/NN', 'great/JJ', 'service/NN', 'pleasant/JJ', 'atmosphere/NN']"
A little overpriced but worth it once you take a bite.,2,little overpriced worth once take bite,JJ JJ JJ RB VB NN,"['little/JJ', 'overpriced/JJ', 'worth/JJ', 'once/RB', 'take/VB', 'bite/NN']"
"i've been to sapphire twice and both times the food was fine, if not good.",2,have be sapphire twice time food be fine not good,VB VB VB RB NN NN VB JJ RB JJ,"['have/VB', 'be/VB', 'sapphire/VB', 'twice/RB', 'time/NN', 'food/NN', 'be/VB', 'fine/JJ', 'not/RB', 'good/JJ']"
"For authentic Thai food, look no further than Toons.",2,authentic thai food look further toon,JJ NN NN VB RB NN,"['authentic/JJ', 'thai/NN', 'food/NN', 'look/VB', 'further/RB', 'toon/NN']"
I would highly recommend this place!,2,highly recommend place,RB VB NN,"['highly/RB', 'recommend/VB', 'place/NN']"
and yes Dal Bukhara is so dam good and so are all the kababs.,2,yes dal bukhara be dam good so be kabab,RB JJ NN VB NN JJ RB VB NN,"['yes/RB', 'dal/JJ', 'bukhara/NN', 'be/VB', 'dam/NN', 'good/JJ', 'so/RB', 'be/VB', 'kabab/NN']"
The owner and staff are all Japanese as well and that adds to the entire ambiance.,2,owner staff be japanese as well add entire ambiance,NN NN VB RB RB RB VB JJ NN,"['owner/NN', 'staff/NN', 'be/VB', 'japanese/RB', 'as/RB', 'well/RB', 'add/VB', 'entire/JJ', 'ambiance/NN']"
Mermaid Inn is an overall good restaurant with really good seafood.,2,mermaid inn be overall good restaurant really good seafood,NN NN VB JJ JJ NN RB JJ NN,"['mermaid/NN', 'inn/NN', 'be/VB', 'overall/JJ', 'good/JJ', 'restaurant/NN', 'really/RB', 'good/JJ', 'seafood/NN']"
The food is so cheap and the waiters are nice.,2,food be so cheap waiter be nice,NN VB RB JJ NN VB JJ,"['food/NN', 'be/VB', 'so/RB', 'cheap/JJ', 'waiter/NN', 'be/VB', 'nice/JJ']"
"The dishes offered were unique, very tasty and fresh from the lamb sausages, sardines with biscuits, large whole shrimp to the amazing pistachio ice cream (the best and freshest I've ever had).",2,dish offer be unique very tasty fresh lamb sausage sardine biscuit large whole shrimp amazing pistachio ice cream best freshest ve ever have,NN VB VB JJ RB JJ JJ NN NN NN NN JJ JJ NN JJ JJ NN NN JJ VB NN RB VB,"['dish/NN', 'offer/VB', 'be/VB', 'unique/JJ', 'very/RB', 'tasty/JJ', 'fresh/JJ', 'lamb/NN', 'sausage/NN', 'sardine/NN', 'biscuit/NN', 'large/JJ', 'whole/JJ', 'shrimp/NN', 'amazing/JJ', 'pistachio/JJ', 'ice/NN', 'cream/NN', 'best/JJ', 'freshest/VB', 've/NN', 'ever/RB', 'have/VB']"
Myagi is one of my favorite restaurants in the City; the place the negative reviews describe sound like they were somewhere else.,2,myagi be favorite restaurant city place negative reviews describe sound be somewhere else,NN VB JJ NN NN NN JJ NN NN NN VB RB RB,"['myagi/NN', 'be/VB', 'favorite/JJ', 'restaurant/NN', 'city/NN', 'place/NN', 'negative/JJ', 'reviews/NN', 'describe/NN', 'sound/NN', 'be/VB', 'somewhere/RB', 'else/RB']"
Go hungry and enjoy.,2,go hungry enjoy,VB JJ NN,"['go/VB', 'hungry/JJ', 'enjoy/NN']"
"I can't wait for summer, when they serve outside on their gigantic patio.",2,wait summer serve gigantic patio,VB NN VB JJ NN,"['wait/VB', 'summer/NN', 'serve/VB', 'gigantic/JJ', 'patio/NN']"
"On a recent Sunday afternoon, a friend and I accidently found this great restaurant on our way to see the pulitzer prize winning play DOUBT.",2,recent sunday afternoon friend accidently find great restaurant way see pulitzer prize play doubt,JJ NN NN NN RB VB JJ NN NN VB NN NN VB NN,"['recent/JJ', 'sunday/NN', 'afternoon/NN', 'friend/NN', 'accidently/RB', 'find/VB', 'great/JJ', 'restaurant/NN', 'way/NN', 'see/VB', 'pulitzer/NN', 'prize/NN', 'play/VB', 'doubt/NN']"
"I come from a family of pizzeria owners, and I'm almost ashamed to say that the pizza in Fornino's blows my families receipies away.",2,come family pizzeria owner almost ashamed say pizza fornino blow family receipy away,VB NN NN NN RB JJ VB NN NN NN NN NN RB,"['come/VB', 'family/NN', 'pizzeria/NN', 'owner/NN', 'almost/RB', 'ashamed/JJ', 'say/VB', 'pizza/NN', 'fornino/NN', 'blow/NN', 'family/NN', 'receipy/NN', 'away/RB']"
You cannot go wrong with this place.,2,go wrong place,VB JJ NN,"['go/VB', 'wrong/JJ', 'place/NN']"
"The first time the sushi was outstanding, the second time it was a little bland.",2,first time sushi be outstanding second time be little bland,JJ NN NN VB JJ JJ NN VB JJ JJ,"['first/JJ', 'time/NN', 'sushi/NN', 'be/VB', 'outstanding/JJ', 'second/JJ', 'time/NN', 'be/VB', 'little/JJ', 'bland/JJ']"
"Try the congee and the donut like deep fried dough they call Ow Ley Soh, a delicious and sweet tasting bread.",2,try congee donut deep fried dough call ow ley soh delicious sweet taste bread,VB NN NN JJ JJ NN VB JJ NN VB JJ JJ VB NN,"['try/VB', 'congee/NN', 'donut/NN', 'deep/JJ', 'fried/JJ', 'dough/NN', 'call/VB', 'ow/JJ', 'ley/NN', 'soh/VB', 'delicious/JJ', 'sweet/JJ', 'taste/VB', 'bread/NN']"
"delicious bagels, especially when right out of the oven.",2,delicious bagel especially right oven,JJ NN RB RB NN,"['delicious/JJ', 'bagel/NN', 'especially/RB', 'right/RB', 'oven/NN']"
It's simply the best meal in NYC.,2,simply best meal nyc,RB JJ NN NN,"['simply/RB', 'best/JJ', 'meal/NN', 'nyc/NN']"
It is a lot of fun with live entertainment and all kinds of Disney type special effects.,2,be lot fun live entertainment kind disney type special effect,VB NN NN JJ NN NN NN NN JJ NN,"['be/VB', 'lot/NN', 'fun/NN', 'live/JJ', 'entertainment/NN', 'kind/NN', 'disney/NN', 'type/NN', 'special/JJ', 'effect/NN']"
Enjoyed a very nice Caesar Salad while my wife had arugula and goat cheese....both very tasty.,2,enjoy very nice caesar salad wife have arugula goat cheese very tasty,VB RB JJ NN NN NN VB NN NN NN RB JJ,"['enjoy/VB', 'very/RB', 'nice/JJ', 'caesar/NN', 'salad/NN', 'wife/NN', 'have/VB', 'arugula/NN', 'goat/NN', 'cheese/NN', 'very/RB', 'tasty/JJ']"
"Just because it's cheap does NOT mean the portions are small or the food is nasty, IT IS GREAT!",2,just cheap do not mean portion be small food be nasty be great,RB RB VB RB VB NN VB JJ NN VB JJ VB JJ,"['just/RB', 'cheap/RB', 'do/VB', 'not/RB', 'mean/VB', 'portion/NN', 'be/VB', 'small/JJ', 'food/NN', 'be/VB', 'nasty/JJ', 'be/VB', 'great/JJ']"
I think I've had some the best meals of my life at minnow.,2,think ve have best meal life minnow,VB NN VB JJ NN NN RB,"['think/VB', 've/NN', 'have/VB', 'best/JJ', 'meal/NN', 'life/NN', 'minnow/RB']"
It was pretty inexpensive too.,2,be pretty inexpensive too,VB JJ JJ RB,"['be/VB', 'pretty/JJ', 'inexpensive/JJ', 'too/RB']"
Myagi is one of my favorite restaurants in the City; the place the negative reviews describe sound like they were somewhere else.,2,myagi be favorite restaurant city place negative reviews describe sound be somewhere else,NN VB JJ NN NN NN JJ NN NN NN VB RB RB,"['myagi/NN', 'be/VB', 'favorite/JJ', 'restaurant/NN', 'city/NN', 'place/NN', 'negative/JJ', 'reviews/NN', 'describe/NN', 'sound/NN', 'be/VB', 'somewhere/RB', 'else/RB']"
The place is so cool and the service is prompt and curtious.,2,place be so cool service be prompt curtious,NN VB RB JJ NN VB JJ JJ,"['place/NN', 'be/VB', 'so/RB', 'cool/JJ', 'service/NN', 'be/VB', 'prompt/JJ', 'curtious/JJ']"
"This is some really good, inexpensive sushi.",2,be really good inexpensive sushi,VB RB JJ JJ NN,"['be/VB', 'really/RB', 'good/JJ', 'inexpensive/JJ', 'sushi/NN']"
"Yes, the prices are high, but I felt it was worth it.",2,yes price be high felt be worth,RB NN VB JJ NN VB JJ,"['yes/RB', 'price/NN', 'be/VB', 'high/JJ', 'felt/NN', 'be/VB', 'worth/JJ']"
Finally a reliable Chinese restaurant!,2,finally reliable chinese restaurant,RB JJ JJ NN,"['finally/RB', 'reliable/JJ', 'chinese/JJ', 'restaurant/NN']"
The food is great and reasonably priced.,2,food be great reasonably price,NN VB JJ RB VB,"['food/NN', 'be/VB', 'great/JJ', 'reasonably/RB', 'price/VB']"
"Good spreads, great beverage selections and bagels really tasty.",2,good spread great beverage selection bagel really tasty,JJ NN JJ NN NN NN RB JJ,"['good/JJ', 'spread/NN', 'great/JJ', 'beverage/NN', 'selection/NN', 'bagel/NN', 'really/RB', 'tasty/JJ']"
"Most of the servers are very attentive, friendly and quite attractive.",2,most server be very attentive friendly quite attractive,JJ NN VB RB JJ JJ RB JJ,"['most/JJ', 'server/NN', 'be/VB', 'very/RB', 'attentive/JJ', 'friendly/JJ', 'quite/RB', 'attractive/JJ']"
Very cozy and warm inside.....,2,very cozy warm inside,RB JJ JJ NN,"['very/RB', 'cozy/JJ', 'warm/JJ', 'inside/NN']"
This dish is my favorite and I always get it when I go there and never get tired of it.,2,dish be favorite always get go there never get tired,NN VB JJ RB VB VB RB RB VB JJ,"['dish/NN', 'be/VB', 'favorite/JJ', 'always/RB', 'get/VB', 'go/VB', 'there/RB', 'never/RB', 'get/VB', 'tired/JJ']"
"It melted in my little mouth and the perfect consistency-not too fishy, creamy, and slightly buttery.",2,melt little mouth perfect consistency not too fishy creamy slightly buttery,VB JJ NN JJ NN RB RB JJ JJ RB JJ,"['melt/VB', 'little/JJ', 'mouth/NN', 'perfect/JJ', 'consistency/NN', 'not/RB', 'too/RB', 'fishy/JJ', 'creamy/JJ', 'slightly/RB', 'buttery/JJ']"
They were served warm and had a soft fluffy interior.,2,be served warm have soft fluffy interior,VB JJ NN VB JJ JJ NN,"['be/VB', 'served/JJ', 'warm/NN', 'have/VB', 'soft/JJ', 'fluffy/JJ', 'interior/NN']"
"whoever the jazz duo was, they were on POINT.",2,jazz duo be be point,NN NN VB VB NN,"['jazz/NN', 'duo/NN', 'be/VB', 'be/VB', 'point/NN']"
This place is so much fun.,2,place be so much fun,NN VB RB JJ NN,"['place/NN', 'be/VB', 'so/RB', 'much/JJ', 'fun/NN']"
Our food was great too!,2,food be great too,NN VB JJ RB,"['food/NN', 'be/VB', 'great/JJ', 'too/RB']"
It is expensive but well worth the money.,2,be expensive well money,VB JJ RB NN,"['be/VB', 'expensive/JJ', 'well/RB', 'money/NN']"
The place was nice and calm.,2,place be nice calm,NN VB JJ VB,"['place/NN', 'be/VB', 'nice/JJ', 'calm/VB']"
noodles with shrimp and chicken and coconut juice is the MUST!,2,noodle shrimp chicken coconut juice be,NN NN NN NN NN VB,"['noodle/NN', 'shrimp/NN', 'chicken/NN', 'coconut/NN', 'juice/NN', 'be/VB']"
I'm going back.,2,go back,VB RB,"['go/VB', 'back/RB']"
The bar is very well stocked with interesting beers and well priced wines.,2,bar be very well stock interesting beer well price wine,NN VB RB RB VB JJ NN RB VB NN,"['bar/NN', 'be/VB', 'very/RB', 'well/RB', 'stock/VB', 'interesting/JJ', 'beer/NN', 'well/RB', 'price/VB', 'wine/NN']"
"Good spreads, great beverage selections and bagels really tasty.",2,good spread great beverage selection bagel really tasty,JJ NN JJ NN NN NN RB JJ,"['good/JJ', 'spread/NN', 'great/JJ', 'beverage/NN', 'selection/NN', 'bagel/NN', 'really/RB', 'tasty/JJ']"
"Have eaten at Ginger House several times, and it's always good.",2,have eat ginger house several time always good,VB VB NN NN JJ NN RB JJ,"['have/VB', 'eat/VB', 'ginger/NN', 'house/NN', 'several/JJ', 'time/NN', 'always/RB', 'good/JJ']"
"The food is amazing, rich pastas and fresh doughy pizza.",2,food be amazing rich pasta fresh doughy pizza,NN VB JJ JJ NN JJ NN NN,"['food/NN', 'be/VB', 'amazing/JJ', 'rich/JJ', 'pasta/NN', 'fresh/JJ', 'doughy/NN', 'pizza/NN']"
"Try everything for that matter, it is all good.",2,try everything matter be good,NN NN NN VB JJ,"['try/NN', 'everything/NN', 'matter/NN', 'be/VB', 'good/JJ']"
